Unnamed: 0.1,AssignmentId,scalar_text_sequentiality,sentence_total_sequentialities,sentence_contextual_sequentialities,sentence_topic_sequentialities,story,recAgnPairId,recImgPairId,Unnamed: 0
0,3VZLGYJEYMWKHJ76AJ1OG4PO58FZXZ,1.0629449712784242,"[0.0, 0.5633875762715059, 2.322296142578125, 0.4932672900538291, 0.7912644885835194, 0.7688560485839844, 1.2925217572380514, 0.6234441296807651, 1.5914993604024252, 1.3372521033653846, 1.3602150364925987, 1.208912696838379, 1.5756454997592502, 1.1936767578125, 0.90283203125, 0.9820486215444711]","[-42.54464149475098, -64.6354660987854, -28.7535400390625, -67.19496154785156, -49.379783630371094, -75.18815231323242, -35.068145751953125, -77.11116027832031, -32.02745008468628, -26.3701171875, -45.257049560546875, -60.59042739868164, -29.456233024597168, -53.64208984375, -41.740234375, -57.86688232421875]","[-42.54464149475098, -83.7906436920166, -56.62109375, -82.48624753952026, -65.996337890625, -95.947265625, -57.041015625, -95.1910400390625, -55.899940490722656, -43.75439453125, -71.10113525390625, -90.81324481964111, -57.81785202026367, -89.452392578125, -56.185546875, -83.400146484375]","I got married a little later than most of my friends, in my mid-30s. When our first child came along, I was pretty apprehensive about being a father, since I had deliberately put off marriage and having kids for so long. What surprised me was how good being a Dad felt. My Mom had always told me, ""Its different when they're your own kids"" and damn if it wasn't true. All this ran through my mind as we drove back from dropping off my oldest son at college today. In retrospect, it all seemed to go by so fast, like things fast-forwarded from him being born until today. He is just a couple steps away from being out on his own as an adult. It was emotional experience for all of us, even our younger son, who had seemed almost happy to be the only kid in the house. Now he seems a little upset, just like my wife and I. Part of it is the knowledge that we're getting older. Retirement is just around the corner, part of the downside of starting a family late. I also worry about how our younger son feels about having parents in their 50s as a young teenager. Some of his friend's parents are a good 10 years younger than us. But we are both in good health and pretty active, so we should be around to see our youngest off to college in a few more years. Hopefully those years will go by a little slower, but I doubt it. Time does seem to go by faster and faster as you get older, another one of my parents sayings that has proven true.",,3GDTJDAPVVXU3B7FNMZ2S3CLKSHM83,0.0
0,3EFVCAY5L4V4231UKPMACBK453I8JG,1.8364715358657,"[0.0, 1.3980894429343087, 1.4198177337646485, 2.322048611111111, 1.4418411254882812, 0.9802746772766113, 2.836338588169643, 2.4877232142857144, 2.3352842785063244, 1.8878173828125, 2.098208957248264, 2.2257486979166665, 1.9096428366268383, 1.8359375, 2.6048400185324927, 2.054631233215332, 2.38125, 1.2667975425720215, 1.2270633473115808, 1.5426385667588975, 1.7323104010687933, 2.1157670454545454, 2.4346245659722223, 1.53662109375]","[-40.7041015625, -30.204208374023438, -42.4855260848999, -14.7099609375, -37.99072265625, -23.498748779296875, -14.2550048828125, -15.4140625, -36.11814880371094, -17.728271484375, -50.40093994140625, -35.322265625, -29.31390380859375, -32.08984375, -18.699359893798828, -34.648234367370605, -15.640625, -35.4307861328125, -37.7523193359375, -40.183677673339844, -31.77032470703125, -25.3203125, -16.141845703125, -34.8837890625]","[-40.7041015625, -49.77746057510376, -63.78279209136963, -35.6083984375, -61.0601806640625, -35.26204490661621, -34.109375, -32.828125, -85.15911865234375, -36.6064453125, -88.168701171875, -62.03125, -61.77783203125, -50.44921875, -47.35260009765625, -69.57696533203125, -27.546875, -55.699546813964844, -58.612396240234375, -67.951171875, -62.95191192626953, -48.59375, -38.053466796875, -57.93310546875]","My sister got married a several months ago. She got married right after Christmas and it was a beautiful wedding. On the morning of her wedding we got ready and had bagels. We got our hair and make up done. It was just us sisters and it was really nice talking and being together. It did not feel rushed or overwhelming. The bride was so calm. She looked so beautiful and natural. When our hair and make up was done, we left and went to her venue to get dressed. It was raining but that did not matter. All events were inside so we quickly ran in and did not let the rain bother us. I got to pick out any red dress I wanted to. I liked that we did not have to wear a specific bridesmaid dress. My sister got dressed and she looked so classic. Her dress was simple and really flattered her. When all was ready we walked down the aisle and had a fast ceremony. The place looked beautiful. It was still decorated for Christmas and just looked like a winter wonderland. The ceremony was quick and straight to the point but there were some really powerful moments. Once the ceremony was over the family took some pictures and then enjoyed cocktail hour. The food was fantastic and then once that was over we danced the night away. She had a great DJ that played music for everyone. People were on the dance floor all night. My sister looked so happy and for that I am very happy for her.",3GFK2QRXXA37L5IRTQYMPH4LXCI5WW,,0.0
0,3GU1KF0O4JNJQC2ZIEB409WHMHLPBQ,0.9446052816456548,"[0.0, 1.2740256569602273, 1.2537841796875, 0.36094007305070464, 0.5678264338795732, 0.7531448890422953, 0.390373757011012, 1.0449114072890509, 1.259521484375, 1.9313512731481481, 1.1580699814690485, 0.6676381429036459, 0.6315504286024306, 1.376812395842179, 0.6291976202101934, 1.0124376737154448, 0.6773492268153599, 1.0917063745959052, 1.566159929547991, 1.0782421875, 1.1116677989130435]","[-36.3739128112793, -38.1451416015625, -31.70166015625, -128.59161376953125, -129.9097900390625, -84.37144470214844, -73.39881610870361, -120.3238296508789, -31.412109375, -61.603515625, -85.51101875305176, -95.88705444335938, -92.64985656738281, -51.32701110839844, -96.09304809570312, -49.22127914428711, -76.36462020874023, -72.04168701171875, -38.501617431640625, -51.5673828125, -55.998046875]","[-36.3739128112793, -52.159423828125, -54.269775390625, -146.9995574951172, -153.190673828125, -106.212646484375, -88.23301887512207, -164.21010875701904, -46.5263671875, -113.75, -127.2015380859375, -115.91619873046875, -121.06962585449219, -82.99369621276855, -122.51934814453125, -62.38296890258789, -95.33039855957031, -103.701171875, -60.4278564453125, -78.5234375, -81.56640625]","This past July I went on vacation with my family. Most years the vacation is a real grind. We have been going to the same place for twenty years with the exception of two years. The truth is for a couple of years I have been trying to back out of it and do something on my own with my vacation time but my mom can do one hell of a passive aggressive guilt trip to get me to go. My parent will ask me and my siblings what we want to do new this year at the destination but the truth is as far as activities go we've gone scorched earth over this place. Anyway, My dad and older sister normally have the trip scheduled down to the minute, leaving no room for anybody else to have much input. I am a little ashamed to admit for the past few years I've spent most of my time in varying degrees of drunken stupor as my main form of entertainment.  I had thought this might be the year that the cycle would break but my sister, who definitely drives the engine in this scenario, came up with a scenario to take my brother's children along this year. I have to admit, this was not her worst idea. My brother had moved to a different city and these children had never been to the destination before and would definitely shake up the routine. So, that was what happened a couple of month's ago my brother brought his children to town and we packed them into the cars a few days later for the trip. The car ride down was mostly unmemorable except for the fact that I realized that my spotify  playlists were not really kid friendly. The trip itself was a lot of the same things as before but there was a new energy because it was it was new to the children and it was exciting for them to go someplace that they had never been before. Things that had been stale were given new life and people were forced to change up some of their routines. Doing things that had become pedestrian and had lost their luster became fun again as I watched my nieces do them and remembered how I used to love to do these things when I was younger. For some reason I was dominating games that required coordination. Actually, one of the biggest problems was as the week progressed was that time was becoming compressed and there was so much to do. These kids had heard about the different things, those of us who had been coming for years had done, and wanted to do it all. Our last night there we were doing things until one in the morning. The next morning when we left was the first time in a couple years I had felt the least bit sad to be leaving. It was a long drive home I think most people were a little frayed but it had been a good trip.",,3GU1KF0O4JNJQC2ZIEB409WHMHLPBQ,0.0
0,3H7XDTSHKDD5127BAMHDTEVA6FQGWQ,1.0554897694359582,"[0.0, 0.7890568971633911, 0.6813285134055398, 0.6532892167568207, 1.0661559471717248, 0.8462990647868106, 1.6561412811279297, 1.3129959106445312, 1.048828125, 0.747653067111969, 1.0063423488451086, 0.8577018976211548, 0.6918639209535387, 0.8320257013494318, 0.7862065633138021, 0.5952099760373434, 0.8323965939608488, 1.2232142857142858, 0.504390407252956, 1.2895592175997221, 4.022623697916667, 2.1166915893554688, 0.7162904739379883]","[-30.70049238204956, -35.256980895996094, -40.241973876953125, -45.03744125366211, -49.668800354003906, -42.793148040771484, -28.268157958984375, -23.560714721679688, -14.150390625, -63.31580114364624, -47.93475341796875, -54.37111568450928, -52.87590265274048, -57.7491455078125, -73.31072998046875, -94.8173360824585, -58.104251861572266, -16.5546875, -96.49916648864746, -32.374606132507324, -7.2939453125, -15.057693481445312, -32.52555847167969]","[-30.70049238204956, -54.19434642791748, -55.231201171875, -58.10322558879852, -77.38885498046875, -58.872830271720886, -54.76641845703125, -41.942657470703125, -22.541015625, -85.74539315700531, -71.08062744140625, -79.24447071552277, -71.55622851848602, -76.0537109375, -92.1796875, -116.24489521980286, -76.41697692871094, -25.1171875, -115.16161155700684, -49.13887596130371, -31.4296875, -36.224609375, -43.9862060546875]","About three months ago I started going to see a therapist. I had been suffering from anxiety and depression for a really long time, and I had been suffering in silence. The first day of therapy I realized this was something that I had been needing for a long time. It wasn't until our third or fourth session that more memories started coming to the surface. These memories had been repressed for quite some time and I finally felt like I had somebody to talk to about them to. I didn't feel any judgement, there was no eye roll or glaring. There was no, ""that was a long time ago, get over it"". I was able to just speak the words as they came to me. I'll never forget that experience. Once I finally began to breathe deeply again she told me how proud she was that I was able to share all of those things with her. I really recommend therapy for anybody that has things on their mind that they feel they need to keep to themselves. The session is all about you and they won't make you feel like you are a burden for taking the time to speak to them. You don't have to worry about them discussing your personal matters with friends or family that could come back to bite you. Your information that you share is private and at the same time you're sharing it with an actual person. I remember feeling a massive amount of relief that I had discussed my life so thoroughly and was made to feel normal afterwards. Any other time I've touched on past issues with friends or family, I didn't feel relief, I felt annoying and like I was  dragging them down. The therapy session I had at week three or four is exactly what I had been needing for years. I will never forget that experience. I felt ten pounds lighter at least, and any time those memories surfaced and started to affect me I would just remember everything that was said to me during the session. That I don't need to hold onto those any longer. I can let them go. They no longer have the power to affect me. Easily the most memorable experience that I've had this year.",,3H7XDTSHKDD5127BAMHDTEVA6FQGWQ,0.0
0,3QY5DC2MXS6MVYMB42WUT5A1KYNUF6,1.16157344816201,"[0.0, 0.6818790350641523, 1.658721923828125, 1.5575408935546875, 0.7706620065789473, 0.70135498046875, 0.9689348008897569, 1.1261199951171874, 0.9884690504807693, 2.0601671006944446, 1.11474609375, 1.0074637276785714, 1.0704100699651808, 1.7967722039473684, 0.8373043823242188, 2.24462890625]","[-32.65266418457031, -52.8957040309906, -39.518585205078125, -41.533660888671875, -60.283203125, -46.8753662109375, -40.782623291015625, -51.24273681640625, -34.38232421875, -18.48974609375, -76.23876953125, -30.19140625, -47.860453605651855, -54.58984375, -66.31574249267578, -20.9755859375]","[-32.65266418457031, -71.98831701278687, -64.3994140625, -75.799560546875, -74.92578125, -60.9024658203125, -58.22344970703125, -73.76513671875, -47.232421875, -37.03125, -97.4189453125, -44.2958984375, -70.33906507492065, -88.728515625, -87.24835205078125, -43.421875]","I worked with a contractor to remodel my bathroom.  I had never done a project in my house before and was really unprepared for all of the decisions that needed to be made.  My contractor was patient with  me and involved me in the project.  He made some great suggestions keeping in mind my taste and budget and we ended up with a beautiful bathroom.  He refers to it as a collaboration which boosted my confidence in matters of design and construction.  At the same time, I noticed that I was starting to be more observant all around me.  I started cleaning out other areas of the house and paying more attention to myself.  I suddenly had more energy to go to exercise classes, and even started polishing my nails.  I painted the front of my house and hung new house numbers.  I put plants inside and outside the house.  I am using my Turk money to buy things for the house to refresh the decor, etc.  I was acting as if I had come out of a deep sleep.  I don't think I was depressed but maybe had fallen into a complacent lifestyle.  I had energy for other people and things but had not really directed it toward my living environment.  I plan to remodel my kitchen in January and am enjoying the research and getting excited about possibilities for the small space.  I will be working with the same contractor.",3H7Z272LX8TV3LOB9R0YECSM00UPLO,,0.0
0,3VBEN272MLLCULQ2QH7CWPSP14JSGH,1.4424402357884718,"[0.0, 0.8722098214285714, 1.32958984375, 1.4037911551339286, 0.39009915865384615, 1.4759440104166666, 1.32481689453125, 1.288427734375, 1.1964378356933594, 1.667266845703125, 1.3733097956730769, 1.8812934027777777, 2.6369140625, 2.6966145833333335, 2.099888392857143]","[-31.125, -57.453125, -55.7421875, -51.3349609375, -43.96875, -47.92138671875, -33.71630859375, -36.68017578125, -49.79302978515625, -46.9853515625, -87.9111328125, -81.3046875, -34.318359375, -40.0703125, -44.2021484375]","[-31.125, -69.6640625, -77.015625, -70.988037109375, -49.0400390625, -70.060546875, -46.9644775390625, -56.006591796875, -68.93603515625, -73.66162109375, -123.6171875, -115.16796875, -60.6875, -72.4296875, -73.6005859375]",So regarding this event. Overall i was happy for it because well it was something fun? who would not enjoy something that is a fun and good time out with people.  i was looking forward to this since then and planned many since then. As nights out are not something that can be done daily. As fun as that could be but overall it is a highlight for me. Like so many things can be mundane. And not be what you really want them to be when you go out. its good that something at least is what it should be nothing more nothing less. Which since the time of the event i have done it a couple more times. And i plan to go again somewhere else again as drinking and kicking the bucket with friends with a band playing awesome music. Is some of the best moments i have had though that night was in paticular better. Because the bands that played killed it so hard. They were heavy hard and just ripped through their sets. Plus their were so many of them which was a good turn around.,3H7Z272LX8TV3LOB9R0YECSMZZEPL5,,0.0
0,31Z0PCVWUL1UGSSGME880HBITVYT7Z,1.1661438227413083,"[0.0, 1.27130126953125, 0.4853515625, 0.4089593315124512, 0.9498886835007441, 2.57080078125, 0.7800268471240998, 1.5995349884033203, 1.0147230965750558, 3.24365234375, 0.8593424987792969, 1.3373325892857142, 1.443900242447853, 0.9831019810267857, 1.067727481617647, 0.642657466556715]","[-42.143653869628906, -15.86279296875, -30.33203125, -70.69521284103394, -45.195892333984375, -29.486328125, -35.667359590530396, -19.619056701660156, -12.999427795410156, -6.46142578125, -62.2693977355957, -44.79296875, -16.634650349617004, -59.25048828125, -56.6357421875, -37.00924110412598]","[-42.143653869628906, -29.84710693359375, -37.126953125, -80.91919612884521, -65.1435546875, -60.3359375, -51.26789653301239, -38.8134765625, -27.205551147460938, -22.6796875, -83.75296020507812, -63.515625, -39.737054228782654, -79.8956298828125, -74.787109375, -51.79036283493042]","What a wild ride this life has been so far. The ups, the downs and everything in between. My beautiful bride and I have been married for two years now. Our anniversary is tomorrow and we're going on a fabulous date of dinner around Newport Harbor. As I reflect back, I think to how nervous I was to even ask her to marry me. I bought the ring five months before I actually asked her. I practiced what I would say for months and just couldn't work up the nerve. Finally, after all that, I popped the question. I got down on one knee and asked her to marry me. And she said yes! She actually said yes, the most beautiful woman in the world agreed to marry me, some schmuck from Brooklyn. We got married just one month later and the most beautiful service ever. We were married at the Little White Wedding Chapel in Las Vegas. Everyone was there, our parents, our friends and even Elvis made an apppearance! We stayed the Mirage just up the street and just had the most wonderful time. The last two years have just been so amazing, I can't wait to see what the future holds.",,3H8DHMCCWAXBUI33JIX2ZIYIWF9KDK,0.0
0,3LRLIPTPERVDWB0RZ8609HQCAFJKAU,1.25841461048709,"[0.0, 1.0990439967105263, 1.133203125, 1.1374289772727273, 1.11759765625, 0.9043246375189887, 1.7041766826923077, 1.9013241038602942, 2.162388392857143, 0.8001218523297992, 1.0748076262297455, 1.7349036080496651, 1.7281494140625, 1.1166107177734375, 1.2621383666992188]","[-74.97216796875, -47.814453125, -51.38671875, -70.259765625, -62.26123046875, -54.50060272216797, -34.423828125, -56.401123046875, -33.513671875, -36.06220245361328, -57.006378173828125, -35.98796081542969, -26.9178466796875, -54.05767822265625, -35.76300048828125]","[-74.97216796875, -68.6962890625, -68.384765625, -95.283203125, -90.201171875, -70.77844619750977, -56.578125, -88.7236328125, -63.787109375, -52.86476135253906, -86.02618408203125, -60.276611328125, -49.3837890625, -76.389892578125, -55.95721435546875]",She usually plans hanging out with me and coming over within a specific date. This time she had told my brother and my mom that she was going to be coming over. I was working on the computer whenever she sent me pictures of my city. I was confused to why she was sending me that so I checked my front door camera and I saw car. It shocked me since she told me that she was going to be having a meeting out of town and she has before. When she arrived we spent it many different places just enjoying each other's company. It was really fun going all over town and showing her around. I also enjoyed her at my house while we played video games or us watching videos. It was a great experience and I thank her for randomly surprising me. She had originally wanted to stay for 5 days but she ended up staying for 8 days. During the last day she was crying a bit and was sad that she was not going to be seeing me for a few months. Because of that our goodbyes were very tough to do. We finally did it and I thanked her for coming over. Once she had left and time passed by we planned a new time for us to see each other. Thankfully that we will be seeing each other in a short amount of time.,3HFNH7HEMI00H5BPYDI71PDOYFMGQH,,0.0
0,3XCC1ODXDMXR6VK3EOCJ0TRV8EIQRW,1.2683498736893912,"[0.0, 1.1914760044642858, 1.4573713030133928, 0.8948272191561185, 2.370849609375, 0.6088978160511364, 0.9735677083333333, 0.9022392388936635, 1.3586462194269353, 1.5424107142857142, 0.8903393745422363, 1.4133907045636858, 1.5410330636160714, 2.355656215122768, 1.5245429144965277]","[-40.50048828125, -37.9482421875, -29.5457763671875, -31.650086402893066, -19.8564453125, -110.241943359375, -37.130859375, -72.24145126342773, -21.352041244506836, -18.3671875, -49.90110778808594, -26.487424850463867, -9.3729248046875, -23.42901611328125, -21.55645751953125]","[-40.50048828125, -54.62890625, -49.948974609375, -43.28284025192261, -38.8232421875, -137.033447265625, -51.734375, -105.62430310249329, -36.297149658203125, -29.1640625, -78.3919677734375, -46.27489471435547, -20.16015625, -56.408203125, -35.27734375]","My family and I are so extremely close. We love to get together and have food at any chance we can. This time, though, we had a real reason to get together. My cousin's husband recently got his Master's degree. This meant so much to my cousin. We grew up very poor, so seeing her now in her new house, with her having a great job, and now her husband able to get a great job with his degree, was almost poetic in a way. We knew that she could do it, and she had finally made it. I know that it was the husband's achievement, but this was my cousin after all, so I couldn't help but feel it was an accomplishment for her too. We celebrated with a party and a barbecue. The same way we always do. There was loads of ribs, chicken, hamburgers, hot dogs, potato salad; you name it, and it was there. We had the best time ever just laughing and eating together. I will never forget that day. The day that my cousin finally got what she deserved in life. We have such a tight knit family.",,3HMIGG0U4MSUXSWT6PNDMYZSHMJY8L,0.0
0,3BXQMRHWK0KS18ESQP07OVUA9V1UMZ,1.3994304253022336,"[0.0, 1.1913200827205883, 1.2036120096842449, 0.43413834344773067, 1.9672760009765624, 1.714329719543457, 1.3352194393382353, 1.6668788364955358, 1.2090267605251737, 1.3795166015625, 1.7743252840909092, 1.4117475183386552, 2.099609375, 1.7938168174342106, 1.1401174444901316, 2.1497233072916666, 1.3196596891983696]","[-36.02294921875, -50.25244140625, -28.574378967285156, -52.626827239990234, -13.518157958984375, -18.95447540283203, -36.3427734375, -49.52972412109375, -66.52230834960938, -45.1923828125, -26.0029296875, -50.65040874481201, -24.548828125, -48.72509765625, -52.4644775390625, -33.417236328125, -69.4302978515625]","[-36.02294921875, -70.5048828125, -43.017723083496094, -61.74373245239258, -33.19091796875, -39.526432037353516, -59.04150390625, -84.5341796875, -88.2847900390625, -67.2646484375, -45.5205078125, -77.47361159324646, -47.64453125, -82.8076171875, -74.126708984375, -65.6630859375, -99.782470703125]",My Fathers funeral is today. Im feeling all kinds of emotions I have always been a daddys girl. Even at times when i didn't want to be. My earliest memory of my dad is me dancing in my room while he played the air guitar. I think I was about 4 years old. I remember thinking he was the coolest guy alive. I remember the first time he hit me for no reason i was 10. He was mad at something I cant remember what but he picked me up and threw me into the tv. I really remember feeling pain i just remember my head feeling numb almost like white noise. I cried thinking it had to be my fault I was gonna be better. But I never did get better and things got worse. My father was addicted to drugs I knew that I think it was something everybody knew. I had tried over the years to get him clean. Nothing worked i began to hate him blaming him for everything that happened bad in my life.  I looked at his body in the casket i kissed his cheek he was cold. Almost as cold as our relationship had been while i was growing up. I felt a since of loss for our relationship that could of been I felt guilt for not forgiving him.,3HMIGG0U4MSUXSWT6PNDMYZS9SV8YB,,0.0
