Unnamed: 0.1,AssignmentId,scalar_text_sequentiality,sentence_total_sequentialities,sentence_contextual_sequentialities,sentence_topic_sequentialities,story,recAgnPairId,recImgPairId,Unnamed: 0
0,3483FV8BEF5HSTKYKPJKTG2WX6P262,1.4341071951803697,"[0.0, 0.7914777483258929, 2.1806640625, 1.378082275390625, 0.8535970052083334, 1.9820033482142858, 2.3294677734375, 1.567112972861842, 1.0697881449823794, 0.9983024199803671, 0.8052629743303571, 1.4916341145833334, 2.013970947265625, 1.2751953125, 2.775048828125]","[-32.33544921875, -53.2724609375, -25.90625, -53.59619140625, -56.70703125, -29.064453125, -24.39599609375, -34.1365966796875, -50.48702049255371, -28.499260425567627, -46.9779052734375, -32.66064453125, -18.60345458984375, -20.107421875, -17.73779296875]","[-32.33544921875, -64.3531494140625, -43.3515625, -75.6455078125, -77.193359375, -56.8125, -52.349609375, -63.9117431640625, -75.09214782714844, -40.47888946533203, -63.888427734375, -55.03515625, -38.7431640625, -32.859375, -45.48828125]","I can still remember it like it was yesterday.  My significant other and I had gone out to the Ohm Festival.  This is basically a hippy festival.  We had wanted to go and watch the crystal bowl sound experience performance.  As the two of us tried to enter the door a man stopped us and said we were too late to go in.  It was literally 1 minute after the start time of the performance.  After a few more people showed up he let us in.  The room was huge and had about 200 people laying down on the ground.  The stage was set with crystal bowls and people dressed in some sort of wizardly outfits.  It was vaguely spooky to be there.  The sounds were amazing and so interesting, I've never heard anything like that before in person.  After what seemed like 2 minutes we got up and it was over.  The performance actually lasted 90 minutes!  The sounds were something I had never experienced before.  I would definitely go to see this performance again!",,,0.0
0,37UQDCYH6YH9TKW5R98N1ZZ3PHDV7H,1.6304282742812892,"[0.0, 1.5896573274031929, 1.6287977430555556, 2.8398112456003823, 3.1682942708333335, 1.427734375, 1.3274271488189697, 1.7764892578125, 2.061916383107503, 1.406736814058744, 1.8070350060096154, 1.6121089458465576, 1.0160242427479138, 1.343219478925069, 1.451171875]","[-41.458984375, -49.13163757324219, -23.4033203125, -25.160881996154785, -8.9951171875, -44.681640625, -28.335067749023438, -14.62060546875, -27.1601824760437, -46.52686309814453, -28.184326171875, -29.587116241455078, -55.69566345214844, -28.904361248016357, -28.576171875]","[-41.458984375, -85.69375610351562, -38.0625, -59.238616943359375, -18.5, -67.525390625, -49.57390213012695, -28.83251953125, -58.08892822265625, -83.10202026367188, -51.67578125, -55.380859375, -78.04819679260254, -45.02299499511719, -45.990234375]","I purchased a house I knew would need some work. I was anticipating spending most of the proceeds from the sale of my older home on the fixups. The worst part was the carpeting. It was old, nasty brown and green shag. Horrible. Right after closing I went over to the house with my sisters and parents. I was feeling discouraged about all of the work left to do. I wanted to get started right away. My sister and I started ripping up a bit of the carpet. To my astonishment we found that under the living room carpet was unbelievably gorgeous hardwood flooring. It'd been perfectly preserved for over 40 years. The same was in the dining room, bedroom, and hallways. The discovery will save me thousands of dollars on renovation costs and free us up to tackle other projects. It's much nicer than what I could afford. It was such an unexpected treat and made me so happy.",,,0.0
0,31LM9EDVOMEP5AOYQRBTU8AZU7VJNB,1.4186840728265275,"[0.0, 0.8945106707121196, 0.6288261413574219, 0.13354944299768517, 1.0899769176136365, 0.584056936777555, 2.4059244791666665, 2.1495472301136362, 2.460205078125, 1.1123570893940173, 1.12635498046875, 1.6283482142857142, 1.453369140625, 2.4933446248372397, 2.7724609375, 1.76611328125]","[-85.470703125, -49.486297607421875, -81.50555419921875, -87.7235107421875, -54.5830078125, -36.70863151550293, -28.09375, -23.07666015625, -18.826171875, -44.22076416015625, -36.225830078125, -22.5703125, -26.03759765625, -12.446182250976562, -8.697265625, -33.46484375]","[-85.470703125, -66.48200035095215, -91.5667724609375, -91.329345703125, -78.5625, -44.301371693611145, -42.529296875, -46.7216796875, -38.5078125, -65.35554885864258, -47.4893798828125, -33.96875, -46.384765625, -27.40625, -25.33203125, -47.59375]","i am a young tall lady with a zeal to be a positive influence of mankind. i am a lesbian and a black american who is a digital marketer by profession. I love attending Basketball games and following up various club site to get updates. on the last Sunday of the moth of July, I met a wonderful lady who attended the same seminar with me on that day. We got talking and i discovered she had all the qualities i had been search for as a soulmate. She talks eloquently, firm and intelligently. Her educational background is killing. she went to the best school in united states. Her family is a middle class one. Her present job offers her an annual salary of 81000 Us dollars. she offers voluntary services every Tuesdays. Her mentality is also unique. i fell in love with her when i got to know her better. We are currently dating. I want to marry her. we are making serious plan towards it.",,,0.0
0,3BV8HQ2ZZXN6XWF2X4CZZYLU9V3A65,1.4673775056682314,"[0.0, 0.5872967529296875, 2.218563715616862, 2.575146484375, 2.2432725694444446, 0.40339412689208987, 1.3568780899047852, 1.365493392944336, 1.8775551535866477, 1.1739823190789473, 1.9498956853693181, 1.4324770815232222, 1.0420954777644231, 1.2137863452617939, 1.86710205078125, 1.4538850784301758, 1.2415450246710527, 1.2241058349609375, 0.9344932710802233, 2.1648966471354165, 1.9444715711805556, 2.5699869791666665, 0.9093589782714844]","[-48.43328857421875, -63.60224151611328, -27.73914337158203, -20.34619140625, -19.669921875, -18.005685806274414, -54.970919609069824, -47.38311767578125, -43.02131652832031, -41.9638671875, -19.48388671875, -38.47858953475952, -88.661376953125, -61.16335678100586, -22.6180419921875, -26.237945556640625, -55.80810546875, -73.69552612304688, -82.06829929351807, -17.4984130859375, -24.676513671875, -29.4375, -48.81378173828125]","[-48.43328857421875, -78.28466033935547, -54.361907958984375, -46.09765625, -39.859375, -22.039627075195312, -82.10848140716553, -74.69298553466797, -84.32752990722656, -64.26953125, -40.9327392578125, -62.8306999206543, -115.755859375, -92.7218017578125, -41.2890625, -49.50010681152344, -79.3974609375, -110.418701171875, -116.64455032348633, -36.98248291015625, -42.1767578125, -60.27734375, -63.363525390625]","I remember the day we had our counselling after the results were out. I had worked immensely hard for the last one year and was really hoping to get a seat in GMCH. When my seat got confirmed there, I was elated. But more than me, my parents were happy. It was nice to see their proud faces. But that's a story for another day. Today is about the person who was the happiest that day - My GRANDFATHER. On the day of counselling, he accompanied me the office of the Director of Medical Education. On seeing my name in the list of the selected candidates for GMC, he was elated beyond measures. It could be seen in his face; it was being reflected in his eyes and his voice. We went home after the counselling was over. As the entire family sat for lunch, he suddenly called me to his room. I went inside grandpa gave me a box, somewhat twice the size of a typical geometry box, and it looked very old. I opened the box - it contained the equipments I'd be needing for MBBS in the 1st year. I smiled as he gave the box to me. He then said the following words which I'll never be able to forget. He said - “Annu, I had brought this set almost 20 years back. As I was passing by one of the medical supplies shop during my trips (he's a surveyor), my eyes fell upon this box. It was expensive at that time, and more than that- unnecessary, yet, I still bought it, hoping that someday I can give it to my children or grandchildren. You've fulfilled my dream today. Maybe, God wanted me to witness this. Maybe, He has kept me alive for this day only.” That day, I'll make you proud in the truest sense.",,,0.0
0,3DUZQ9U6SNAVCIGXFC6YWQVZCT8VSI,1.535552865157026,"[0.0, 0.5338437373821552, 1.1332682291666667, 0.8421282087053571, 1.9561734199523926, 0.92138671875, 1.21875, 3.246875, 1.5460379464285714, 2.27490234375, 5.322509765625, 0.8136219531297684, 0.8639468622207641, 0.9539295543323864, 2.225595610482352, 0.7158764925870028]","[-47.571441650390625, -66.14371871948242, -28.564453125, -56.42864990234375, -18.898731231689453, -27.51611328125, -17.53125, -7.6875, -15.404296875, -12.103515625, -5.0458984375, -24.970025539398193, -55.96093833446503, -40.95745849609375, -36.59288215637207, -36.657676696777344]","[-47.571441650390625, -80.02365589141846, -45.5634765625, -80.00823974609375, -34.548118591308594, -41.3369140625, -21.1875, -23.921875, -26.2265625, -21.203125, -26.3359375, -37.98797678947449, -77.55960988998413, -61.94390869140625, -67.751220703125, -44.532318115234375]","Earlier this month, I was reviewing my recent finances. My job had to cut back my hours, so income has been tight and I have been running a little behind on bills. I have good credit and have never needed to take out a loan before. I figured now may be a good time to try, so I can pay down my outstanding debt before it gets out of hand. I was very nervous to apply. It took me a few days to get up the strength to do so. But then... my application was denied. At first, I felt guilty. Worthless. Like a failure. After a while, I started to feel frustrated and helpless. I don't even know why I was denied since my credit history is great and credit score is 750. I've never defaulted on a loan---in fact, I have never even taken one out before. So my only guess is my lower income resulted in the denial. How is someone supposed to get ahead in this world?",,,0.0
0,33CKWXB73K6FWM15VF7PT11AYC811A,1.3228706721173915,"[0.0, 0.4690819615903108, 1.6251953125, 1.6702223557692308, 1.9281684027777777, 1.1751960305606617, 1.642653329031808, 1.222147640429045, 1.5208395048975945, 1.4221331278483074, 2.050877621299342, 1.235725202058491, 2.6163470961830835, 0.4875895182291667, 0.7768829785860502]","[-66.4609375, -61.3392276763916, -23.5986328125, -29.294921875, -29.580078125, -44.220916748046875, -22.225250244140625, -47.388875007629395, -27.75647735595703, -43.16674041748047, -51.832763671875, -35.721561431884766, -18.458585262298584, -63.9246826171875, -28.27372646331787]","[-66.4609375, -72.12811279296875, -39.8505859375, -51.0078125, -46.93359375, -64.19924926757812, -45.22239685058594, -70.60968017578125, -52.08990943431854, -68.76513671875, -90.7994384765625, -59.200340270996094, -47.2384033203125, -77.089599609375, -38.37320518493652]","In the past there was little time for exploration and travel with my wife. We both had obligations to fill, and our schedules were packed to the gills with various work. This led to us both feeling rather stressed. So when we did have some time, we went all out. My wife had never seen Disney world before. Originally hailing from China, she would hear stories about this magical place. She never would have thought she'd have the chance to visit. So we took the first jet from NYC to Orlando and went to the magic kingdom. All of the parks - Magic Kingdom, Epcot, Animal Kingdom. She enjoyed every minute of the rides and the masterful design of the parks. I would say her favorite park was animal kingdom, particularly for the amount of birds we saw. We spent about a week in Orlando, visiting other sites, such as Universal Studios. However, the main attraction for her was Disney. We came home and resolved to spend more time together, and now we try to do something fun and unique at least once a month. As a result, we feel much happier and fulfilled.",,,0.0
0,32XVDSJFP0JJHW5Q75Q1ICZIOTQ2M9,1.2072171873491733,"[0.0, 0.9100925611413043, 1.1915889037282843, 1.7380022321428572, 1.19268798828125, 2.063671875, 1.1218039772727273, 0.9397897159352022, 1.679591128700658, 0.9572892189025879, 1.0774952281605115, 1.8596583416587429, 1.3267661503383092, 1.0164871556418282, 1.0333333333333334]","[-69.11838912963867, -54.55615234375, -40.42493724822998, -26.978515625, -31.39599609375, -22.546875, -32.19140625, -79.00784301757812, -41.5711669921875, -20.328704833984375, -40.40435791015625, -33.57298564910889, -32.56570625305176, -31.15918493270874, -46.568359375]","[-69.11838912963867, -75.48828125, -63.06512641906738, -51.310546875, -45.708251953125, -43.18359375, -44.53125, -110.960693359375, -73.4833984375, -29.901597023010254, -64.1092529296875, -68.906494140625, -60.42779541015625, -45.390005111694336, -62.068359375]","I was really nervous, I needed to take my final exam in order to finish with my master’s degree. I studied a lot for this test but thought about what would happen if I were to score low on the test. I was up almost all night before the test thinking about this and couldn’t really sleep. I knew I was prepared but I heard the test was really hard. I decided to relax and be detached from the outcome. The morning finally came and the time was up. I picked up my bag and then started the test. It took me around 3 hours to complete it but the whole time I was nervous, some of the answers I knew but my mind suddenly forgot all about them. I tried to do my best and came out of the test wanting to know the results already. I was really nervous and fidgety. The results finally came and I made it, I was so happy because all my hard work had paid off. I even had a higher grade than expected and decided to celebrate with my friends and family. I had a great time with them and they all congratulated me because of my accomplishment. I guess being nervous in this situation was unavoidable. . I felt great and accomplished and now its time to think about new goals.",,,0.0
0,3JNQLM5FT58ZBEN57TPMIZKTN1D2L9,1.6347907442834697,"[0.0, 0.571509769984654, 1.6255696614583333, 1.265771484375, 1.4781221088610197, 2.392732913677509, 2.3078177315848216, 1.646253083881579, 1.9762209723977482, 2.2831771850585936, 1.8042237688513363, 1.037951017680921, 2.8355823863636362, 1.4808281792534723, 1.8161009008234197]","[-38.28620910644531, -51.75493621826172, -39.619384765625, -28.53857421875, -35.461822509765625, -24.086854934692383, -33.3009033203125, -43.12841796875, -24.424571990966797, -9.407844543457031, -27.617042660713196, -36.36767578125, -17.9345703125, -34.3792724609375, -49.838748931884766]","[-38.28620910644531, -59.756072998046875, -64.0029296875, -53.85400390625, -63.546142578125, -55.1923828125, -65.6103515625, -74.4072265625, -58.020328521728516, -20.82373046875, -58.28884673118591, -56.0887451171875, -49.1259765625, -61.0341796875, -89.79296875]","I had a very memorable event happen to me recently. I was producing a beat for a song I was working on it. While producing it I had an idea for a song pop in my head. It was a beautiful melody, and I decided to record it and make it into a song. I finished the beat and it turned out to be my best beat I've ever made. I mixed and mastered the beat and then recorded my vocals. It turned out great and was definitely my best song I made yet. I uploaded it to my YouTube page which I had built up to a decent subscriber count. Within 24 hours, my song had amassed over ten thousand views. I was astounded. I couldn't believe my music had resonated with this many people this quickly. I felt deeply touched by the fact that my dreams were coming true before my very eyes. This experience motivated me to make even better music. It also showed me that I am more than capable of making it big as an artist. I produced, engineered, wrote and recorded the entire song myself which made it feel all the more satisfying.",,,0.0
0,3YJ6NA41JC2P8V0B66OLYXFUUMUJP5,1.2839693427192775,"[0.0, 1.1116536458333333, 0.6166666666666667, 1.4788153512137276, 1.0312025282118056, 1.5075658162434895, 1.3396797387496284, 1.060661190434506, 1.4491900275735294, 2.3328857421875, 1.8087921142578125, 1.0713257167650305, 0.6942232572115384, 1.4377034505208333, 2.319174894919762]","[-78.21881866455078, -33.5625, -54.153564453125, -34.24176025390625, -18.205322265625, -66.48992919921875, -40.732266426086426, -54.386889934539795, -45.1884765625, -18.064453125, -40.547607421875, -48.53216552734375, -45.98095703125, -36.451416015625, -20.23535466194153]","[-78.21881866455078, -46.90234375, -63.403564453125, -54.94517517089844, -27.48614501953125, -102.6715087890625, -71.54490041732788, -74.53945255279541, -69.82470703125, -43.7261962890625, -69.48828125, -73.17265701293945, -55.005859375, -58.0169677734375, -50.38462829589844]","What a great day this July 4th was spending time with the family while on vacation in Texas. Today started off the same as normal with coffee and breakfast. My brother in law which I call my brother always treats us well.  Then we had to get ready for today's big BBQ.  This is what I was looking forward to. You see we live in California so we do not get many holiday's with immediate family on my husband side.  Texas is where his parents, brothers, sisters, uncles, aunts, and so many more. Our child got to have a fun filled holiday with everyone, especially her grandparents.  Everyone came, there was so many people there that we love and cherish.  I got to meet a lot of new family members.  What makes this the best was my child got to spend time with her family. I will always remember this day because this is the day that I felt more welcomed into this huge family.  Great food with great people and some fireworks at the end. This is one of the best July the 4th's ever.  I hope to have many more holidays with our family.",,,0.0
0,3LEP4MGT3HMA1FZ9D5K90FFS80KBD4,1.4250197364635024,"[0.0, 0.17717633928571427, 1.3291672926682692, 1.4899948967827692, 1.7273763020833333, 1.3427992512782414, 1.8806423611111112, 2.295670572916667, 1.2344702643317145, 1.0248507942472185, 2.6018473307291665, 1.1915475945723684, 0.9775908589363098, 1.3930998932231555, 2.4051106770833335, 1.7289713541666667]","[-89.66632080078125, -46.86328125, -32.8970947265625, -33.28596496582031, -29.0732421875, -50.31482994556427, -28.27734375, -29.22119140625, -99.02156066894531, -60.82736587524414, -62.354248046875, -38.1168212890625, -69.42879486083984, -38.20438766479492, -46.12890625, -36.7705078125]","[-89.66632080078125, -49.34375, -50.17626953125, -60.105873107910156, -49.8017578125, -82.54201197624207, -45.203125, -63.65625, -144.69696044921875, -89.52318811416626, -109.1875, -60.7562255859375, -94.8461571931839, -68.85258531570435, -74.990234375, -62.705078125]","The most memorable and enjoyable experience I can think back to, happened to me a few months ago when I got to see my favorite band perform live. This happened at a previous job I worked for a few months back. At the time I was ushering at a convention center. My responsibility was to greet the people and direct them to their seats for the event. on that night my favorite band was going to be performing. At the time I didn't know they were going to play because I did not thoroughly read about the event prior. They were the last to play onstage. After they had played a few sets it was time for their last song. Before the last song started one of my managers  told me that the lead singer was going to walk by the upper stadium were I was at during the start of the song. This was exciting for me and I almost could not breathe because I really loved the lead singer and was very fond of him. Just as stated before he did walk by were I was as he song the last song. I was so close to him that I patted him on his side to get his attention. He didn't hear or see me because it was so loud in their and security guards were pushing people away from him. Even though I couldn't talk to him I was content with seeing him up close and touching him. After that night I moved on to work some were else. It was the perfect way to end my last night at that job though",,,0.0
0,369J354OFEW77NS5J449VKWX8FI6GU,1.916115206457175,"[0.0, 0.8577880859375, 2.273070526123047, 3.743104934692383, 2.1779383850097656, 2.66005859375, 1.1740669012069702, 3.238030569893973, 1.2452840275234647, 2.026833089192708, 2.2323518232865767, 2.3640848795572915, 2.1367124557495116, 0.8208143446180556, 1.5648878921162, 1.9168613978794642, 1.8912674753289473, 1.6149760352240667, 2.4459402901785716, 1.938232421875]","[-56.32421875, -43.3204345703125, -67.92005920410156, -29.48272705078125, -52.17875671386719, -35.9798583984375, -74.5650486946106, -36.80926513671875, -61.32334899902344, -89.79071044921875, -34.02873611450195, -33.5216064453125, -62.08972644805908, -89.382568359375, -65.65443658828735, -28.3807373046875, -64.6416015625, -69.89373970031738, -16.609375, -45.9521484375]","[-56.32421875, -54.4716796875, -113.3814697265625, -59.42756652832031, -106.62721633911133, -62.5804443359375, -98.04638671875, -82.14169311523438, -83.7384614944458, -150.595703125, -58.5846061706543, -61.890625, -115.50753784179688, -104.1572265625, -100.08197021484375, -55.216796875, -100.57568359375, -113.49809265136719, -33.73095703125, -69.2109375]","It was one fine evening I was coming back to home from office. one old man was selling towels on footpath. one guy bought two  towels cost of Thirty Rupees, for that. He gave hundred Rupees through. He had no change of Thirty Rupees, old man returned him one-hundred and fifty Rupees. Instead of returning seventy Rupees suddenly. one guy, I asked who was eating pizza next to that old man to that. old man uncle why did you give him one fifty Rupees. Then, the old man said, son I can't see properly by mistakenly. I have given him after having pizza that guy, came to sold man and said, I will help you to sale your towels. Then, the guy started convincing to people. who were going on that way to buy a towel. At least, for this old man so, many people bought towels from him and thanked to that guy. for his great job and some are taken selfie within him for doing inspirational job. unbelievable thing is that that guy has sold Hundred towels  within a hour. At last the old man had no more towels to sell. He went with empty bag at that time of going his old man eyes are full of tears. and he hugged to that guy and gave him big thanks with blessing that guy is one and only my friend... I am really inspired by him. ""Help others it come back to you in unexpected way"".",,,0.0
0,38F5OAUN5OY4BJ1LMKRJMY8UIN4H7M,0.9383598317500488,"[0.0, 0.6632753885709323, 2.5911458333333335, 0.6006969328849546, 0.3823968505859375, 0.9697560204399956, 0.8381918770926339, 0.6877737778883714, 1.0988930150082237, 1.0739782651265461, 1.287249392271042, 1.262109375, 1.061284363269806, 0.6157660058566502, 0.99375, 0.513652635657269, 0.621713825300628, 1.3712577819824219, 0.5898973999953852, 1.544407894736842]","[-30.56116485595703, -55.061964988708496, -8.75, -57.1011962890625, -64.104248046875, -40.92049789428711, -67.1142578125, -69.78997802734375, -44.6185302734375, -54.34233474731445, -34.25271964073181, -31.6015625, -35.1276478767395, -72.75119352340698, -22.19921875, -40.7784423828125, -87.36073303222656, -27.347747802734375, -87.71019172668457, -39.611328125]","[-30.56116485595703, -72.30712509155273, -24.296875, -75.7228012084961, -73.66416931152344, -58.37610626220703, -96.45097351074219, -87.6720962524414, -65.49749755859375, -80.11781311035156, -59.99770748615265, -50.533203125, -60.598472595214844, -98.61336576938629, -32.13671875, -52.59245300292969, -119.0681381225586, -39.68906784057617, -111.89598512649536, -68.955078125]","My mother died unexpectedly two months ago. She checked herself into the hospital with stomach pains and while under observation she developed a brain bleed which killed her. She was 65. When I try to remember the day it happened, when my brothers and I went to the hospital, it feels like I'm remembering a dream. I was in shock and my brain was in full blown panic mode, not only for that day but for weeks. Something that I do remember is seeing my mom hooked up to a breathing machine. I had assumed at that point that she was alive and in some kind of coma so I was talking to her, telling her things that were going on in my life. Later a group of doctors gathered us in a room and they were relaying the string of events that led to this situation. I remember, thinking my mom was in a coma, asking about the prognosis. The doctor non-chalantly told us that even though our mom was breathing mechanically she was actually dead. He didn't elaborate and moved on with the rest of the information he had to give us. I remember the way he said it made me feel like I was stupid. However I was still in shock so I didn't have the wherewithal to ask any follow-up questions. I did some googling and found out that when brain death happens it's common for hospitals to keep the body hooked up to breathing machines so they can harvest the organs later. I wish the doctor had explained that part better. Up until this point in my life I had been fortunate that I had not lost anybody close to me. I recently had friends that had both lost parents and I tried to be as consoling as I could but now that it's happened to me I've realized that there's not a lot anybody can say that will make you feel better. That death affects you profoundly. In my case it took roughly a month before I felt like my life was regaining any kind of balance and my mom and I weren't particularly close in the last few years of her life. I imagine the closer you are to the person who dies the more off balance your life becomes.",,,0.0
