Unnamed: 0.1,AssignmentId,scalar_text_sequentiality,sentence_total_sequentialities,sentence_contextual_sequentialities,sentence_topic_sequentialities,story,recAgnPairId,recImgPairId,Unnamed: 0
0,3VE8AYVF8NJOX1FY1ZVPXDSCCKQF8L,1.211347702817443,"[0.0, 1.034191840573361, 0.6953772862752279, 1.5405818504445694, 0.8482925415039062, 1.3600341796875, 1.4173743724822998, 1.2174390068760625, 2.0150282118055554, 2.2303292410714284, 1.2144540640024037, 1.0411238968372345, 0.755374028132512, 0.7394814491271973, 1.0020329533396541, 1.112109375, 1.1779224395751953, 1.4873844214848109, 2.1270751953125]","[-35.949951171875, -40.99204432964325, -69.71432828903198, -35.153449177742004, -46.250579833984375, -53.86572265625, -38.157901763916016, -64.5139389038086, -17.93408203125, -25.361328125, -27.27069091796875, -42.25277137756348, -61.532745361328125, -41.535648345947266, -76.36132228374481, -39.849853515625, -57.77899932861328, -23.73365068435669, -17.4619140625]","[-35.949951171875, -60.64168930053711, -90.57564687728882, -61.34334063529968, -63.2164306640625, -81.06640625, -60.83589172363281, -97.38479208946228, -36.0693359375, -56.5859375, -43.05859375, -71.40424048900604, -81.17247009277344, -59.283203125, -113.43654155731201, -56.531494140625, -81.33744812011719, -44.55703258514404, -34.478515625]","I took a trip to Minneapolis two months ago.  I flew into MSP early on a Sunday morning via a red-eye flight.  It was nice not to deal with so many people and I was able to sleep through part of it, so the day wasn't ruined.  My friend Mike from college picked me up and we went downtown for breakfast.  He and I chilled at his apartment and caught up for a few hours until the afternoon.  We met up with some of his friends in the city and saw a UFC headline match.  I decided to put money on some of the fights and got lucky.  It was foolish but hey, I was there to have fun and it wouldn't have cost much more to lose anyway.  I ended up winning about $50.  We hit up a couple bars afterward and had a nice time.  I wandered around a bit over the next couple days.  I didn't have much of an itinerary and it was nice not to have anything in particular to do until the weekend.  I spent almost a whole day at The Mall of America - it was huge, even larger than I was expecting it to be.  I went to see The Specials on Thursday as part of their 40th anniversary tour.  I like ska, and I don't listen to it much at home, but the show was fun and the music sounded pretty good in person, so I enjoyed myself.  On Friday and again on Saturday I met up with family outside the city.  It was a reunion party and we were able to spend it outside in the sun both days.  I played a lot of horseshoes and frisbee.  I flew back home Sunday morning.",,3RUIQRXJBCA5C09DHZ7RXVJ2T1YLLB,0.0
0,3FE2ERCCZYU396R8MJGQ6TWGUHJOPB,1.23492264840884,"[0.0, 0.7528491417566935, 0.6666829892567225, 1.237435073852539, 0.9389902750651041, 1.770064303749486, 1.657136462983631, 0.9873798076923077, 1.0782982219349255, 1.6901254653930664, 1.7190290178571428, 0.9916274126838235, 1.4394618335523104, 2.7173475159539118, 1.2711588541666667, 1.0666087865829468, 0.6836113207267992, 1.5608011881510417]","[-41.44189453125, -37.46297645568848, -69.12381136417389, -33.04818534851074, -57.1395263671875, -42.87492752075195, -45.687957763671875, -31.255859375, -83.4965763092041, -35.495574951171875, -38.2646484375, -87.79638671875, -57.35931587219238, -20.883988857269287, -26.52734375, -90.42103815078735, -73.00228881835938, -11.98089599609375]","[-41.44189453125, -46.4971661567688, -92.45771598815918, -63.98406219482422, -79.67529296875, -76.50614929199219, -80.48782348632812, -44.091796875, -119.08041763305664, -62.53758239746094, -62.3310546875, -121.51171875, -84.70909070968628, -45.34011650085449, -41.78125, -128.81895446777344, -95.56146240234375, -21.345703125]","One month ago, my daughter came to me asking for help. She was determined to start her own lipgloss line. At first, I was a bit skeptical, since she had been prone to picking up hobbies and tossing them aside quite often throughout her youth. However, I quickly realized that she had put a considerable amount of thought into this and was surprisingly passionate about it. I was quite happy for her to say the least and was myself determined to help her in any way that I could. The primary aspects she wanted help with were the packaging and the pricing for her products. I was pleased to find that she was so deep into the process of creating this lipgloss line. Of course, I thought these were great ideas to start with. To start, we went to a nearby crafts and art supplies store and decided to spend much of the day browsing the extensive collection for what would work best. She already had her mind set on packaging that was bold and memorable. We looked first at the most striking colors and materials we could find. To my surprise, she was immediately taken by a combination of colors and materials, as though she had fully established in her mind the design she'd be going for. We selected our packaging supplies and were thrilled we had made it so far so efficiently. We then thought extensively about pricing. She had several ideas and was confident that they would work. I searched online for similar pricing models for makeup and lipgloss lines and quickly found that my daughter's ideas were in line with the common pricing trends. The whole day proved to be a success and I love that my daughter has finally found an aspect of her life she can be fully involved in and passionate about. It warms my heart.",,3S06PH7KSSQ9OHHHB8RKU32JNAND1Q,0.0
0,3WYGZ5XF3X1HW7MLG8SRUHKIV9JSK2,1.2805555658105958,"[0.0, 0.7893886107664841, 1.7731759207589286, 1.5463186899820964, 1.5126065340909092, 0.6665870878431532, 0.86395263671875, 1.4731270639519942, 1.810107421875, 1.865386962890625, 0.8680066560444079, 1.1767307628284802, 1.1964648842811585, 2.130695343017578, 1.535784912109375]","[-46.23750686645508, -38.649800539016724, -14.01611328125, -16.00397491455078, -16.533203125, -66.31562423706055, -41.490966796875, -36.60049057006836, -29.51611328125, -16.1837158203125, -40.76075744628906, -21.718101501464844, -32.380311012268066, -23.65228271484375, -21.26348876953125]","[-46.23750686645508, -59.17390441894531, -26.4283447265625, -34.55979919433594, -33.171875, -90.31275939941406, -55.314208984375, -64.58990478515625, -47.6171875, -38.568359375, -57.25288391113281, -34.662139892578125, -56.309608697891235, -49.22062683105469, -36.621337890625]","The loss of a parent is probably the hardest thing that most people have to deal with at some point in their lives. The death of my father, however, was something I don't think I'll ever be able to fully get over. I love my father so much. He was always there for me, always by my side. He gave me the best advice anyone could ever give. He was there through my first break up, there for my graduation, even there for me when I was going through a rebellious phase in my 20s. Most people rebel in high school, but I was a really good kid. I guess in my early 20s I was tired of being so good, though. I just know that he would always love me. I knew that he would always be there no matter what. To this day, I still feel upset over his death, and the way he died. I will never be able to live the same again. I try not to get so sad, because I know he wouldn't want that for me. But it's so extremely hard not to miss him. I honor him every year on his birthday.",,3S0TNUHWKU4RZH12AT0Z9DPRZYE8DO,0.0
0,3VFJCI1K40L0T6QPBS776FNUSWQRGL,1.1342097819646193,"[0.0, 1.3759098052978516, 0.6721598307291666, 2.52056884765625, 1.031136509250192, 0.8684586234714674, 0.5492326674922821, 0.6417496292679398, 1.7126434326171875, 1.1624149322509765, 0.8118024553571429, 1.1708984375, 1.2721383571624756, 1.1493031874946926, 2.4407535899769175, 0.7681862059093657]","[-49.739295959472656, -38.912750244140625, -74.41261291503906, -12.93701171875, -66.10955810546875, -52.99119567871094, -80.86941146850586, -57.197723388671875, -33.17388916015625, -50.22330284118652, -55.42919921875, -29.79443359375, -51.91278839111328, -37.37900638580322, -30.706398010253906, -66.49897575378418]","[-49.739295959472656, -60.92730712890625, -92.56092834472656, -33.1015625, -101.16819941997528, -72.96574401855469, -97.8956241607666, -74.52496337890625, -67.4267578125, -79.28367614746094, -72.47705078125, -52.04150390625, -92.6212158203125, -63.81297969818115, -57.5546875, -82.63088607788086]","I had been watching my son's martial arts classes for a year. I was amazed at what the classes and the environment had done for him. His body transformed from that of a soft, pudgy video game fanatic into the lean body of a junior Tarzan. He also came out of his shell. He is a shy, socially awkward boy and the extremely positive and supportive atmosphere helped him to be more confident in himself and more comfortable with other people. It really made me feel like I wanted to be a part of this big ""family"", so I signed up. I was still very worried that my age and the extra pounds I was carrying would be embarrassing at least and insurmountable at worst. In my very first class I met a student who was older than my mother and another who weighed over 300 pounds. They both assured me that it was fun and very doable for people of all ages and sizes. I also was treated in a very supportive and encouraging manner by everyone, regardless of their age or level of ability. I think the most surprising thing was that I apparently move really well for a 50 year old. I was really proud of myself when I realized that I could keep up with the youngsters. I'm not as fast and flexible as they are, of course, but I can make up for it with my strength and my focus on proper technique. That first class was such a positive and uplifting experience that I immediately signed up for a year of classes. I also signed up for weapons and sparring classes. My son is still doing great and is only 2 belts away from his black belt now!",3S96KQ6I9NQAX1TQDRBU09LEE5LTD9,,0.0
0,3SEPORI8WOL8L6ZDZ99AWWEPFO1AZC,1.617443055934218,"[0.0, 1.4958898370916194, 2.5289427439371743, 1.964709394507938, 1.3357412020365398, 1.4887173916842487, 0.885582263653095, 2.07759884425572, 0.713823820415296, 0.9380696614583334, 2.096270751953125, 1.9828725961538463, 3.4779739379882812, 1.7263255649142795, 1.5838068181818181, 2.0788696259260178, 2.107330322265625, 0.8532150268554688, 0.6332964215959821, 2.1099330357142856, 1.4747909545898437, 1.6127220392227173, 2.1956357088955967, 1.5134162902832031, 1.5605421447753907]","[-64.62158203125, -45.317962646484375, -28.160547256469727, -25.881035208702087, -38.91465377807617, -75.42293334007263, -26.838260650634766, -47.653404235839844, -44.2626953125, -41.8486328125, -38.009765625, -32.23046875, -16.906349182128906, -32.737579345703125, -35.625, -30.46699070930481, -15.6820068359375, -56.32475280761719, -42.25092792510986, -15.58984375, -31.880088806152344, -26.100984573364258, -40.334686279296875, -31.4044189453125, -34.358829498291016]","[-64.62158203125, -78.2275390625, -66.09468841552734, -61.24580430984497, -70.97244262695312, -130.50547683238983, -38.350830078125, -105.826171875, -57.825347900390625, -53.10546875, -79.9351806640625, -58.0078125, -55.1640625, -63.811439514160156, -53.046875, -63.728904724121094, -40.969970703125, -81.92120361328125, -59.98322772979736, -30.359375, -54.001953125, -56.742703318595886, -88.638671875, -55.61907958984375, -73.37238311767578]","An elderly friend of the family, GW, passed away after a brief battle with cancer. I first met GW when I went to work for my uncle at his business after I graduated from college. GW was my uncle's neighbor and he worked part time there. GW didn't talk a lot but he had a wicked sense of humor. He and his wife, AW, raised 4 kids together in the same house for 50 years. I didn't get to see GW often after I got a new job and moved but I heard for AW that GW wasn't feeling so well since last year. He was in and out of hospital a lot of the time. Then in March I got a call from AW that GW was in the hospital again and would like to see me and my uncle. I got the feeling that this might be the last time we will speak to each other again. This might be the goodbye the we all dreaded. On a beautiful Saturday I drove my uncle and my aunt to visit GW at the hospital. On the way there we bought him some flowers for the room. When we got there I could hardly recognize GW. He looked so thin and frail and his cheeks sunk in quite a bit. I felt so sad that some tears actually came out. GW was asleep so we asked a nurse to wake him. He was groggy but very happy to see us. Even though he was physically deteriorating I could see that his mind was as sharp as even and his sense of humor was still there. I stuck my hand out to shake his hand and he held mine for a long time like he didn't want to let go. His hand felt cold and weak. I got emotional again and almost cried again but I held it in. I didn't want GW to worry so I put on a brave face and smiled. Before we left I told GW to get better soon and we'll be waiting for him at home. For the rest of the day I felt a bit melancholy and down. Seeing GW like that reminded me of how fleeting and fragile life is and it scared me.",3SEPORI8WOL8L6ZDZ99AWWEPFO1AZC,,0.0
0,3R5F3LQFV36XNATE9SESXRYU5OSZOQ,1.076703676758643,"[0.0, 0.5693061728226511, 0.0011418660481770833, 1.1931248833151424, 0.8380720808699325, 1.019287109375, 0.6161964993144191, 0.6895741245202851, 1.8429361979166667, 0.8173791133996212, 0.9718647003173828, 1.1134751263786764, 1.039582994249132, 1.5027418870192308, 3.9358723958333335]","[-138.54087352752686, -127.55119514465332, -53.77865982055664, -47.735201716423035, -84.4429931640625, -42.130859375, -99.79107284545898, -163.5296630859375, -17.8330078125, -62.22587585449219, -106.73710632324219, -44.696044921875, -55.30897521972656, -28.280426025390625, -6.8642578125]","[-138.54087352752686, -149.18482971191406, -53.79921340942383, -68.01832473278046, -115.45166015625, -50.28515625, -126.287522315979, -202.83538818359375, -28.890625, -89.19938659667969, -145.6116943359375, -63.6251220703125, -83.37771606445312, -47.816070556640625, -18.671875]","A little more than two months ago, my now-girlfriend confessed she was interested in me - it was June 20th, the day before the solstice so an easy date to remember, and not long before her birthday. That makes her zodiac sign the crab and mine the ram, not meant to get along without a lot of work, but we get along fantastic - so much for that. She speaks quite directly, and it's very relaxing and reassuring. Wasn't so direct about that crush for a few months, though. I'd first started talking to her because I admired her art, and she admired my writing - not that you'd know it from this kind of diary entry. Bit more comfortable with fiction I suppose. Anyway, we'd spent a few months chatting online, flirting a bit but ambiguously so, you know, like you could read more or less into it, whichever way you liked. Anyway, we'd both developed massive crushed on each other of the course of chatting - though she's told me since that she'd been pining a bit even before we started talking, that was cute - so it was nice to finally have that stated. Feelings mutual. And it's only been a couple months, and it's a long distance thing, but it's been working unbelievably well since then. All the little things, waking up to texted good-mornings and listening to her voice saying good night every night, chatting while we watch shows together, sorting out travel plans. Really quite remarkable given that she's ridiculously out of my league. Talented, thoughtful, gorgeous, ambitious, much smarter than I am - she's incredible. And somehow she's enjoying spending time with me. Go figure.",3SNVL38CI5E1PQXPJM2RFCG015VCKG,,0.0
0,3HRMW88U17CCLM2CSIMNZO632IT0MV,1.1225404951582822,"[0.0, 0.371519775390625, 2.279575892857143, 0.6601584434509278, 1.1047175480769231, 0.9956997871398926, 1.304210205078125, 0.6549616274626359, 0.8749725705101377, 0.8515777587890625, 1.5751953125, 1.0789097377232142, 1.5997600640569414, 1.2503428724077013, 0.9080409622192382, 1.575876690092541, 1.816723593959102, 1.3034860711348684]","[-51.79947280883789, -69.39462280273438, -15.02734375, -53.00969982147217, -39.841796875, -46.86336803436279, -56.979278564453125, -63.823486328125, -113.94282531738281, -54.75311279296875, -36.02490234375, -42.3702392578125, -57.744285345077515, -32.46139144897461, -56.337141036987305, -46.772586822509766, -36.22799873352051, -41.88232421875]","[-51.79947280883789, -78.6826171875, -30.984375, -72.814453125, -54.203125, -66.77736377716064, -89.58453369140625, -78.88760375976562, -150.6916732788086, -75.19097900390625, -54.92724609375, -65.02734375, -102.53756713867188, -54.96756315231323, -79.03816509246826, -79.86599731445312, -85.27953577041626, -66.6485595703125]","I had been riding behind my dad on motorcycles. He was seriously injured from the accident and had actually died and needed to resuscitated on his way to the hospital. I thought I would lose him. He had broken his C7 vertebrae, crushed his larynx, pharynx and paralyzed his vocal cords. During his stint at the hospital he was handling it well. He wasn't very happy about it but he was pushing through and just continued to be himself. Every day his voice is getting a little bit stronger and he is scheduled to get the tracheotomy taken out soon. This will relieve the family of a lot of the everyday nursing duties that we've shared. It will be a bit of a recovery time for him but the doctors think he is ready and he is beating all standards so far so we are not going to be ones to disagree with him. Right after he had a consultation he wanted to go to the motorcycle dealership to look at new bikes. He already has his eyes set on a new a one. I told him that when he was ready to buy a new one I would buy one with him too. Granted he will probably buy a much nicer bike than I will but is nice to be able to still share that with him. He won't be able to ride for a bit but we are both hopeful. It is very satisfying to see that even a huge accident wouldn't deter him from his love of motorcycles. He has been riding forever and we were all worried if he would become scared of them. I don't think any of us expected him to want to get back on so soon but he just loves them so much. I'm just glad he is progressing steadily and can keep looking to the future.",3SNVL38CI5E1PQXPJM2RFCG0BF7KCU,,0.0
0,3B3WTRP3DCO4ACMWIWMWDQTZCSM29Z,1.1088304403675695,"[0.0, 0.5900530133928571, 1.3952094184027777, 1.4859510149274553, 1.273688590526581, 0.644093563923469, 0.8863748403695914, 1.21011962890625, 0.801048583984375, 1.259455680847168, 1.5769929431733631, 1.085619474712171, 1.0982421875, 1.6610440340909092, 1.664563630756579]","[-50.8095703125, -50.41162109375, -48.50439453125, -33.576568603515625, -43.9617919921875, -53.4627799987793, -28.529495239257812, -22.5101318359375, -73.715576171875, -48.61480712890625, -51.720458984375, -51.07098388671875, -46.0830078125, -23.595703125, -30.068603515625]","[-50.8095703125, -62.802734375, -73.6181640625, -54.3798828125, -69.43556380271912, -70.20921266078949, -40.0523681640625, -34.611328125, -93.74179077148438, -78.84174346923828, -84.83731079101562, -71.69775390625, -62.556640625, -41.8671875, -61.6953125]","I experienced the worst thing I could experience as a parent. The most suprising thing to me was the fact that it happened and the emotions I felt. It is unreal when something so painful happens, that you think will never happen. I also never knew the strength of negative emotions I could feel. I thought I knew pain before, but I was never remotely close to feeling real pain. There were many sleepless nights spent crying, and feeling like I was just going to fall over and die. The extreme anxiety and panic attacks I experienced were terrible. I look back wondering how I made it through. After surviving the worst time period of my life I learned that I can take something awful and get some good form it. I think the only way to survive something so bad it to find a way to see something good come from it. I am able to help others, and connect with other bereaved parents who have helped me survive. I can be that person who saves someone from going down the wrong path to handle grief. There have been a couple people who were here for me in that way. That is the best way to handle a bad situation. You have to find something positive to take from it, and use it in a good way.",3STRJBFXOXDIB7Z058XH4MG4XKVKT1,,0.0
0,3DEL4X4EL77KCTX1EXZ52XGL9GUXY1,1.0609031048584496,"[0.0, 1.5593915666852678, 0.7968581627155172, 1.3347138904389881, 0.912744140625, 0.7060139973958334, 1.206519024712699, 1.383436260552242, 0.9569884590480638, 0.6584635416666667, 2.187274639423077, 1.0208984375, 0.5823149247602983, 1.0471684382512019, 1.8204862154447115, 0.801177978515625]","[-66.644287109375, -24.519775390625, -55.3135986328125, -38.5726318359375, -54.884765625, -64.0174560546875, -53.77033233642578, -49.25494360923767, -111.03382873535156, -52.935546875, -23.0224609375, -72.1767578125, -50.36125183105469, -65.51483154296875, -25.37469482421875, -129.2208251953125]","[-66.644287109375, -46.35125732421875, -78.4224853515625, -66.60162353515625, -73.1396484375, -87.31591796875, -87.55286502838135, -89.37459516525269, -155.0552978515625, -62.8125, -51.45703125, -97.69921875, -63.17218017578125, -92.7412109375, -49.041015625, -164.47265625]","Diary Entry - This week, my significant other and I drove to the airport to pick up my son. This was his first visit home after enlisting in the Army. I was so excited to see him and I was so relieved when he was finally sitting beside me in the truck for the drive home. I was so filled with pride when I saw my son in his Army uniform standing in the airport. He looked so grown up, more so than one would expect after just the passing of several months. I can tell just by how he stands straighter and taller, with his shoulders back and his chin held high, that he is proud of himself too. Starting in the truck on the ride home, I was so full of questions and so eager to hear about my son's experiences. I needed reassurance, as a mom, that my son was doing all right and that the Army was treating him well and fairly. Seeing my son looking fit and happy did a lot to give me this reassurance and to dispel the worries that I had been feeling after hearing of problems my son had been having with certain people during Basic Training. At one point, it looked uncertain he would even successfully complete the training. But now, seeing him, I knew everything would be okay. As my son shared his stories, he could laugh about some of those experiences with the perspective gained by the passing of time. Now, he was collecting his own stories, and I'm sure there would be more to come. I could laugh as well, instead of feeling the ache of wanting to protect my son from pain, emotional and physical. Seeing my son now gave me such hope for his future. It made me feel like everything would be okay, and helped balance the worries and headaches my son had given me as a rather troubled kid, drifting without any concrete goal in mind, after high school.",3SUWZRL0MZZ9N9WED9ELVHBLM2OE63,,0.0
0,3SUWZRL0MZZ9N9WED9ELVHBLTFQE62,1.8652952104030456,"[0.0, 0.7489225968070652, 1.8095367431640625, 2.547154017857143, 4.164453125, 3.14306640625, 3.17724609375, 2.099723307291667, 1.5417794892282197, 2.6515625, 1.4096716421621818, 0.9941928863525391, 1.3987379807692308, 1.8497314453125, 1.0619904891304348, 1.493997012867647, 1.6182528409090908]","[-49.7001953125, -45.1990966796875, -35.8577880859375, -16.294921875, -9.255859375, -19.52734375, -15.52734375, -33.396728515625, -56.02191162109375, -9.3515625, -94.08513641357422, -33.3088493347168, -41.81640625, -17.6591796875, -61.9375, -37.939453125, -21.6328125]","[-49.7001953125, -62.42431640625, -72.04852294921875, -34.125, -30.078125, -44.671875, -40.9453125, -64.892578125, -106.900634765625, -22.609375, -132.14627075195312, -43.25077819824219, -60.0, -32.45703125, -86.36328125, -63.33740234375, -39.43359375]","About a week ago, my son, who is 9 months, was playing on the floor in the living room. I turned away for a split second and next thing I know, he stood up and started to walk towards me! My other son, who is 5 years old, started yelling ""He's walking!"" I could not believe it! He was actually walking! Not just taking a step and falling. No, he was practically running! Okay, maybe not that fast, but they were definitely not baby steps. He had been taking a few steps here and there, walking with the assistance of us or the couch, but never just standing up on his own and walking! I was so excited! Maybe to excited because we were so loud yelling ""he's walking, o my goodness,"" that he fell shortly after. My husband had just went into the garage. He ran in the house, but had missed his first steps. He was sad that he missed it. We had him walk again for his Dad and so we could get it on video to send to our family. It was a wonderful moment and a memory that will of course stick with us forever. We were so excited to see our little one walking!",,3SUWZRL0MZZ9N9WED9ELVHBLTFQE62,0.0
