,AssignmentId,scalar_text_sequentiality,sentence_total_sequentialities,sentence_contextual_sequentialities,sentence_topic_sequentialities,story,recAgnPairId,recImgPairId,Unnamed: 0
0,31IBVUNM9TLM8DBB9S6ZPRCKYQCVFI,1.5575877409167778,"[0.05349392361111111, 1.4837239583333333, 2.6725551060267856, 1.1958984375, 2.2776322798295454, 0.7120917825137868, 0.7682883522727273, 1.94921875, 1.5860460069444444, 2.651171875, 1.630694580078125, 2.0000701904296876, 1.4765625, 2.3217329545454546, 0.5846354166666666]","[-27.5205078125, -28.27734375, -19.9991455078125, -45.0068359375, -16.859130859375, -40.048248291015625, -66.76953125, -16.49609375, -18.8984375, -21.150390625, -26.730865478515625, -21.609649658203125, -8.8359375, -33.7734375, -17.173828125]","[-28.001953125, -50.533203125, -38.70703125, -62.9453125, -41.9130859375, -52.15380859375, -83.671875, -30.140625, -33.1728515625, -34.40625, -51.1912841796875, -41.6103515625, -16.21875, -59.3125, -20.681640625]","A few weeks ago, my boss was fired. Being the second highest ranking person, I should have been promoted to her position. At least on a Interim basis. Unfortunately, the Board decided to hire a extremely under qualified part time staff member. He was hired because he is friends with the board chair. This has been especially concerning since I have been at this job for over 15 years. This has me thinking that our board is actually not very fair and doesn't actually uphold the ideals of the organization. I am now thinking of changing jobs. the problem is I am good at my job. I also Like my Job. It is disappointing to have to look for another job due to cronyism. The organization I work for is suppose to be trustworthy. I guess I was wrong. Again this causes concern because I believed in the organization mission. It is what it is though.",,,0.0
0,3C8HJ7UOP8G9N782WCZF5N9P7BRZMW,0.7212333897013976,"[-0.07911609468005952, 0.394814742238898, 1.0330268012152777, 0.40921181126644735, 0.7767064836290147, 0.7513191469254032, 0.9398450349506579, 0.9702837908709491, 1.285107421875, 0.7698396381578947, 0.21140681780301607, 0.7172002484721522, 0.580221439230031, 0.82435546875, 1.1173192804509944, 0.8381922040666853]","[-40.14410400390625, -51.67027282714844, -37.050048828125, -103.334228515625, -83.09606170654297, -74.851806640625, -48.8746337890625, -41.021453857421875, -59.845947265625, -65.43017578125, -96.45284986495972, -82.28726959228516, -56.7243595123291, -67.829345703125, -37.207061767578125, -77.64899063110352]","[-38.482666015625, -59.1717529296875, -55.64453125, -118.88427734375, -111.0574951171875, -98.1427001953125, -66.731689453125, -67.2191162109375, -91.9736328125, -94.68408203125, -104.69771575927734, -104.52047729492188, -73.55078125, -88.438232421875, -61.7880859375, -106.9857177734375]","About a year ago, I went out on a few dates with someone I met online in a dating app. I did not enjoy his company very much, I continued dating him out of a sense of boredom. He started to really develop deep feelings for me, feelings that I did not return in kind. I still continued to date him for a time just to hang out as friends, but then about six months ago I broke up with him as a romantic dating partner to move on with someone else. He was very confused and hurt by this event, and accused me of leading him on and giving him false encouragement, so I ended out friendship and I cut off all contact with him. I felt very guilty for presuming to continue to spend time with someone that I knew I felt zero chemistry with just to have a friend to spend time with. I regretted having to be so abrupt and cold when I broke up with this person, too. I wish there would have been a way to remain friends, because he was a nice person and I enjoyed his company on a friendship level. I was resigned to the fact that this would not be possible after the way things happened and evolved with the break up, though. At first I felt bad for being unable to conjure up feelings that just weren't there for him and for hurting his feelings, but eventually I began to see things in a slightly different way. I think it is quite common for people to have a variety of dating experiences that aren't ideal in some form or other while they're out there searching for people they want to be with romantically. There are never any guarantees or promises in romantic situations in the early stages, before there is any kind of commitment made and while feelings are still developing or unclear. Even if I am not the best judge of chemistry, it is not wrong to end a relationship with someone you don't feel a romantic attraction to. I feel that trying to compromise or settle in dating relationships will cause everyone involved to have unnecessary pain and heartache in the end. So I was sorry for hurting anyone's feelings, but I do not regret doing what I did in the end. I did not wrong anyone by dating them and giving them a fair chance, and by being their friend, simply because I didn't ultimately develop romantic feelings for them in the end.",,,0.0
0,3GM6G9ZBKOJD1VZ3QKAXJZ88P85MTS,1.235573889616008,"[-0.16971842447916666, 0.7052904211956522, 0.4160224066840278, 0.6772689819335938, 1.2284613715277777, 2.1657002766927085, 2.28076171875, 1.3608217592592593, 1.9983889261881511, 0.999162882566452, 1.98779296875, 1.487561677631579, 0.744475624778054, 1.0868082682291667, 1.0260335286458333, 1.7330845424107142, 1.2768391927083333]","[-41.1712646484375, -65.8271484375, -47.4822998046875, -109.44938659667969, -47.8037109375, -10.7596435546875, -22.3017578125, -49.4384765625, -56.58070755004883, -80.98609256744385, -37.685546875, -35.29296875, -91.0069808959961, -79.053955078125, -86.557861328125, -28.49462890625, -37.222412109375]","[-39.643798828125, -82.048828125, -54.970703125, -133.83106994628906, -69.916015625, -36.748046875, -45.109375, -86.1806640625, -98.546875, -112.95930480957031, -69.490234375, -63.556640625, -115.57467651367188, -111.658203125, -117.3388671875, -52.7578125, -56.375]","I finished landscaping my courtyard about two months ago. I bought my condo last year and the courtyard was one thing I had always wanted and had based my purchase on it. I've taken horticulture in college so I'm pretty knowledgeable about how to do it. About 4 years before I purchased the condo, previous owners had hired a landscape company to decorate it with a flowering tree, plants, pond and black river rock stone as mulch. They sold the condo to a retired woman a year later and she never even pulled one weed. So when I bought it, it was an overgrown jungle. My first step was pulling out weeds and dead bushes. My next step, which took about 3 months, was pulling out all the river rock from about 1 foot down in the dirt. From rain and other weather, the rocks had sunken down through the landscape fabric and underneath all the weeds. Every day, I spent 15-30 minutes overturning the dirt, one shovel scoop at a time, then pulling each rock out (from 1 in. to 4 inches wide) and tossing them into huge plastic bins in the garage. I then drew out a new landscape plan, bought the plants, dug the holes and planted them. To my surprise, I called a pond company and I was able to afford their services of rebuilding my broken down pond and adding a filter, pump and some underwater plants. After that was all done, I called a landscape company to drag the bins out of the garage, lay down new landscape fabric and all those black rocks. I also brought out my garden decor, added fish to the pond, added some smaller plants to decorative pots and finally stood back to look at my work. I can't believe how beautiful it is and my neighbors also love it. It's a soothing place to come out to several times a day for relaxation.",,,0.0
0,3R08VXYT7DHM89WAHJDJN1IH79MW7C,1.0664601853006452,"[-0.02814275568181818, 0.3209582913306452, 2.035861545138889, 1.4910912146935096, 0.337359619140625, 1.4464419682820637, 0.8319568634033203, 1.4155085245768229, 1.4687391916910808, 0.8759902861060166, 0.5655899047851562, 1.4681464301215277, 0.6311095388312089, 1.66630859375, 0.6684188842773438, 1.3587763859675481, 0.8551136363636364, 1.5588071459815616, 1.294708251953125]","[-92.1572265625, -75.92724609375, -19.5322265625, -58.50115966796875, -43.7547607421875, -34.01091957092285, -32.523746490478516, -41.870643615722656, -42.43561935424805, -87.05473518371582, -93.42343139648438, -31.9464111328125, -25.09149932861328, -27.0947265625, -104.54539489746094, -35.624969482421875, -26.931640625, -33.99014759063721, -44.388031005859375]","[-91.228515625, -85.876953125, -56.177734375, -97.26953125, -50.501953125, -60.046875, -44.171142578125, -63.103271484375, -68.8729248046875, -122.9703369140625, -113.78466796875, -58.373046875, -37.08258056640625, -43.7578125, -132.61898803710938, -53.2890625, -36.337890625, -66.72509765625, -66.3980712890625]","A few months ago in July, I had my son and two weeks later, my boyfriend, my son's dad, got shot in the foot during an attempted robbery. I was in the car with him and I was driving and this black male came running at my car on the passenger side with a gun at a stoplight. The windows were down and he stuck the gun in the car and told us to get out. My boyfriend Hunter said no and he stuck the gun in his face so he grabbed it and pulled down and got shot in the foot. I know this didn't happen exactly to me, but it has made a huge impact in my life. I have PTSD and I don't even feel comfortable being in the car that it happened in. My ears ring to this day and every loud noise freaks me out. I am still continuing to figure out parenting on my own while he's recovering. I never got to mentally heal or physically heal since it happened two weeks after I gave birth. Not having my boyfriend at home was really tough because I had to do all the feedings all the diaper changes, figure out a schedule and do all these things on my own while he was at the hospital. Now that he's home, my source of income is mTurk and it's stressful trying to do everything I can and still not make enough money to support a family of three. My boyfriend can't pick up my son without being in pain and it hurts me to see. Every time I close my eyes I can see the look on his face when the bullet hit him. The bullet was a hollow point and destroyed his foot. I suddenly had to become a nurse and get taught how to give him injections for the pain medication and learn how to change out his IV bag at home and change the dressings on his foot until it closed up. Being a young mother and now becoming a caregiver as well drains me. I am very depressed, very anxious, and losing hope. I don't sleep because I'm terrified that my boyfriend will stop breathing because he's in so much pain. And on top of that, being paranoid about my newborn son stop breathing in his sleep.",,,0.0
0,3SKEMFQBZ4RZDN7C2AMMDQKHCV68K1,1.4205684051894416,"[-0.10878971644810267, 1.6316691080729167, 1.4654043097245066, 1.0466974431818181, 1.3207058376736112, 1.9706013997395833, 0.8598225911458334, 0.6289937337239583, 1.3138834635416667, 0.11558263442095588, 1.0762845552884615, 1.1691623263888888, 0.5251057942708334, 1.71402587890625, 1.9373224431818181, 1.6226029829545454, 1.7218132019042969, 2.9196363176618303, 0.9807692307692307, 0.449853515625, 1.4046818659855769, 2.354458279079861, 1.9128011067708333, 1.686688232421875, 3.79443359375]","[-36.55390930175781, -31.20074462890625, -54.939056396484375, -25.97265625, -19.3704833984375, -17.9832763671875, -36.64697265625, -47.5146484375, -18.82373046875, -31.51708984375, -36.73486328125, -29.45263671875, -41.961669921875, -17.1741943359375, -27.08544921875, -19.49462890625, -5.462310791015625, -5.3940887451171875, -25.921875, -49.6025390625, -20.4119873046875, -13.46221923828125, -27.51904296875, -6.55352783203125, -2.650390625]","[-35.030853271484375, -55.67578125, -82.78173828125, -37.486328125, -31.2568359375, -41.6304931640625, -46.96484375, -66.38446044921875, -34.59033203125, -33.48199462890625, -50.7265625, -39.97509765625, -49.8382568359375, -34.314453125, -48.39599609375, -37.34326171875, -19.23681640625, -25.83154296875, -38.671875, -58.599609375, -38.6728515625, -34.65234375, -50.47265625, -23.42041015625, -17.828125]","My dog was diagnosed with lymphoma a year ago and was on chemotherapy. She was responding quite well to it and her lymph nodes reduced greatly in size. But then a few months ago,, overnight the lymph nodes doubled in size and she looked so miserable. I decided that she was not having a good life anymore. It would be selfish for me to hold on. I brought her to the vets where she was euthanized. I remember being in the room and seeing her close hers eyes. I tried so hard not to cry, cause I didn't want her to see me like that as her last memory, but I couldn't help it. I was so devastated knowing that I would never see her again. That day, I went out for a walk because I couldn't stand staying at home. On that walk, my normal path was under construction for some reason. I decided to go down random streets this time. While I was passing a bush, I heard some noises of crunching leaves. When I turned, there was a kitten standing there. I bent down and the kitten cam running into my hands. She was so small and dirty, covered in fleas. I decided to take her home with me. I cleaned her up and fed her. She was so well behaved, I thought she was someones pet. Because I just lost my dog that day, I was very scared that I would lose this kitten too. I put off taking her to the vet, but I eventually did. I needed to see if she belonged to someone. When the searched for the microchip, I was so nervous. But it turned out that she didn't have one. I was so relieved.",,,0.0
0,3EQHHY4HQTEBOJSRELU43EIXA1A5GC,1.1762057669331982,"[0.0076904296875, 0.8367919921875, 0.16811116536458334, 1.3790130615234375, 0.16015625, 5.029296875, 1.7432454427083333, 0.5755333533653846, 1.5019317626953126, 0.9352022058823529, 1.7977469308035714, 0.9838714599609375, 0.6726351651278409, 1.4356820242745536, 0.4161783854166667]","[-20.625, -25.00390625, -59.17681884765625, -37.5859375, -15.28125, -4.44140625, -22.54833984375, -36.609130859375, -56.26008605957031, -44.81494140625, -9.474365234375, -44.11444091796875, -42.1947021484375, -12.092681884765625, -8.9833984375]","[-20.6865234375, -31.6982421875, -62.7071533203125, -59.650146484375, -15.921875, -14.5, -33.0078125, -44.091064453125, -78.7890625, -60.71337890625, -22.05859375, -63.7918701171875, -56.99267578125, -22.1424560546875, -11.48046875]","It was when I first met my wife. It was quite a bizarre and memorable moment. We were in a bus when all of a sudden one of the passengers started throwing homophobic jabs at me. It was bizarre in the sense that I never did anything whatsoever to provoke this passenger. He was so mean. Very aggressive. Out of nowhere stood my defender. She was so blunt and candid that I got attracted to her immediately. Her courage to speak up was impeccable  She cautioned my abuser at length. She made it clear that he was the type that brings a bad name to the USA. Made him realize how wrong he was. He eventually apologized for his unruly behavior, and we had a peaceful trip until we reached out destination. It was an unforgettable experience because that was how I got to meet the lady that turned out to be my wife. We've been living together ever since. I'll never forget that day.",,,0.0
0,3SB5N7Y3O4QCTC6QHFOSMJM6V9K0G5,1.3368166138243651,"[0.0908203125, 0.36261307565789475, 0.5051329077743902, 1.5123087565104167, 1.0720880681818181, 2.6036202566964284, 1.2415248325892858, 1.7059896257188585, 1.7015625, 1.0594100952148438, 1.92303466796875, 1.11328125, 2.40732421875, 2.0659508338341346, 1.4851655960083008, 0.5392388237847222]","[-21.041015625, -75.8427734375, -140.34814453125, -30.74237060546875, -44.609375, -24.27978515625, -67.986572265625, -51.766422271728516, -8.7578125, -37.197715759277344, -22.45458984375, -36.015625, -39.47998046875, -32.57232666015625, -38.04887390136719, -20.46319580078125]","[-21.6767578125, -82.732421875, -161.05859375, -53.427001953125, -56.40234375, -60.73046875, -94.05859375, -82.47423553466797, -17.265625, -53.0888671875, -37.8388671875, -44.921875, -75.58984375, -59.4296875, -61.8115234375, -25.31634521484375]","Dear Diary, I just got fired! I was called into the back where the new supervisor and manager were sitting (super was on vacation). They said that my supervisor said I hadn't' cleaned the hood, and after like 10 minutes of us running around and me poking holes in the stories they were spouting I got my shit and left. It was pretty funny actually, they like expected me to be sad or something. The HR guy was on the line through a remote location. They basically just sat me down and said I didn't clean the hood. I told them that yes I did, and told them they should look to whatever day I cleaned the bins. Then I asked when they were asking people if I cleaned if they asked my other coworker. They said they had not. When I asked to review the tapes myself, the tapes didn't exist anymore. Like seriously how sketchy is that lol. I was so mad just about that really. Also they noted the hood was dirty 22 days after I supposedly cleaned it. They addressed it to me almost 45 days after I cleaned it. And by the time they were firing me over it, the tape didn't exist. what a bunch of malarkey, really.",,,0.0
0,3PJ71Z61R5OXLR40ZSMI87JTXQA91A,1.0093522057342097,"[-0.13060413707386365, 0.5267333984375, 1.5424471768465908, 0.5865207248263888, 1.76171875, 0.369287109375, 1.0746694711538463, 2.065673828125, 1.4521687825520833, 1.470361328125, 1.176904296875, 1.4686355590820312, 1.2138765775240385, 0.8995819091796875, 0.6751302083333334, 1.3925984700520833, 1.461152818467882, 2.8301827566964284, 1.8835282759232954, 1.35064697265625, 1.122975999658758, 0.46051743451286764, -0.32127967247596156, 0.12565104166666666, -0.0395928744612069, 0.7937443405389786, 0.2872721354166667, 0.7613590785435268]","[-43.902587890625, -22.1826171875, -17.7938232421875, -23.041946411132812, -31.76171875, -76.073486328125, -82.185546875, -21.701904296875, -23.652587890625, -14.54296875, -65.58056640625, -46.026756286621094, -24.9488525390625, -19.5546875, -28.734375, -24.095458984375, -18.39898681640625, -11.305908203125, -18.07806396484375, -30.284912109375, -23.015914916992188, -17.232177734375, -84.960205078125, -20.078125, -102.13916015625, -67.8275375366211, -68.626953125, -37.147125244140625]","[-42.4659423828125, -28.50341796875, -34.7607421875, -28.320632934570312, -56.42578125, -85.3056640625, -110.126953125, -40.29296875, -41.07861328125, -29.24658203125, -89.11865234375, -70.99356079101562, -40.729248046875, -33.947998046875, -34.810546875, -40.806640625, -44.699737548828125, -31.1171875, -38.796875, -51.895263671875, -47.72138690948486, -25.06097412109375, -76.60693359375, -20.83203125, -100.990966796875, -93.22735643386841, -75.521484375, -47.80615234375]","The happiest day of my life our tour to Ooty. We went for a trip to the beautiful hill station last month. It was a nice family trip where we enjoyed a lot. The trip started on a breezy Sunday morning. We hired a van from our home and my uncle’s family accompanied us. We boarded a lodge at 10 ‘o clock in the morning and the weather so cold that we were freezing like a statue. After getting ready with all our jackets over us we went to the Thunder world which was a very different theme zone I have ever seen.  The botanical garden and rose garden were so amazing. It was a great scene to see so many flowers all together. They all looked as if they were smiling at us. The next day we visited Pykara and the boating experience there, was indeed not equivalent to words. The same afternoon we went to Mudhumalai forests and saw wildlife face to face. The trip was so wonderful that it cannot be explained simply in words. The trip to Ooty was definitely one of the most memorable ones in my life. Today my tenth board exam results have been declared. Until 2'o clock, my heart was beating very fast. As soon as I saw my result I felt that I was on the top of this world. I have come first in my school. Everyone was very happy after they came to know my results. My parents were so happy that they ordered lots of sweets and distributed in our neighborhood. I was at the top of the world after I came to know that I was the topper of my school. I will always remember this day as it was one of the best days of my life.  I was away on a long weekend with a group of my best friends, sitting around, drinking and having fun when something struck me. I wondered how this had happened? ​The most healthy person in the room had recently completed an Iron​ ​Man triathlon, so I had a pretty high benchmark to ​meet.  Fast forward a few years​ and ​I have completed 30+ marathons​ and ​ultra marathons and I think I did just fine.- Daniel Da Vinci   I was sitting in my room with some friends when I got a call from my dad's number. I thought he was going to ask about the interview that I had just",,,0.0
0,3VNXK88KKD4D73KY6667FVQ9MXY9VM,1.0884586280166235,"[-0.041064453125, 0.010498046875, 0.3956705729166667, 1.0922966003417969, 1.0974308894230769, 1.8931790865384615, 1.1399468642014723, 0.7081392728365384, 0.8093705610795454, 1.3973642985026042, 1.1771814682904411, 0.4515625, 1.3470633370535714, 1.8859375, 2.498931884765625, 1.5518296185661764]","[-43.03955078125, -31.020751953125, -21.56640625, -41.89404296875, -34.88720703125, -30.634765625, -61.76079559326172, -47.097900390625, -43.032470703125, -31.55621337890625, -43.41259765625, -21.0859375, -11.1630859375, -14.671875, -12.828857421875, -65.117919921875]","[-42.62890625, -31.125732421875, -23.9404296875, -59.37078857421875, -49.15380859375, -55.24609375, -91.3994140625, -56.3037109375, -60.838623046875, -56.708770751953125, -63.4246826171875, -23.34375, -20.592529296875, -24.1015625, -32.8203125, -91.4990234375]","It happened exactly two months ago in the swimming pool . I had been heart broken by my ex-girlfriend. It was really an exciting encounter. I was learning how to swim when she can into the pool in her swimming dress. she looks very ravaging and i could not stop looking at her. After the  swimming classes, i ask her out for a date. At first,she turn my offer down but after much pressure she finally agreed after she new that we went to the same high school. Am always elated when i remembered the lines i used for her. I told her that she was a paragon of beauty and a typical example of God's perfection in human creation. She agreed to be my girlfriend and she filled the vacuum that my ex-girlfriend has created. I have been dating her now for two months and there has never been a better yesterday. We are both black Americans. I am totally in love with her. She is a good match. I am always happy when am around her. We share so many things sin common like the same high school,color,birthday and temperament.",,,0.0
0,3RANCT1ZVG3WIHAVZ0AYAFJG5HTUBK,1.0760304540454342,"[0.1083984375, 0.7024348332331731, 0.675697021484375, 1.15478515625, 1.0252120971679688, 1.4245091488486843, 0.9128383091517858, 0.9123757102272727, 0.9122751871744792, 0.4358492764559659, 0.8288552420479911, 1.5385721842447917, 1.689684549967448, 1.3667879971590908, 1.9380326704545454, 1.590179443359375]","[-25.29296875, -15.53948974609375, -36.274688720703125, -31.73046875, -39.04508972167969, -37.469482421875, -64.7349853515625, -37.4150390625, -26.745559692382812, -20.511627197265625, -25.701690673828125, -13.884918212890625, -15.214508056640625, -16.22998046875, -22.544921875, -21.40667724609375]","[-26.16015625, -24.671142578125, -53.1671142578125, -50.20703125, -69.80145263671875, -64.53515625, -96.684326171875, -57.4873046875, -40.4296875, -25.30596923828125, -37.3056640625, -36.9635009765625, -35.49072265625, -31.2646484375, -43.86328125, -46.84954833984375]",A month ago I proposed to my girlfriend.  We had been dating for three years and living together for one year.  I thought the time was right for us to take the next step in our relationship but didn't know how to go about it.  I thought about it for weeks on how to propose and more importantly where to propose.  The first time we met was at a park and I thought that would be a good place to ask her to marry me but I thought twice about it.  I then thought of the first date we had which was hiking at a local trail near our home.  Since we both love to hike I decided to propose to her while we were hiking but instead of doing it at our local trail I decided to go for a hike in Griffith Park.  In Griffith Park they have a great hiking trail on Mount Lee which leads you to the top of the Hollywood sign.  We got there really early in the morning and made our ascent up the mountain.  I didn't realize how long it was going to take.  After climbing for three hours we finally made it to the top completely exhausted.  Once we were there I got on my knees and asked her to marry me.  I could see the joy in her face as she said yes.  It was a great feeling something that I will never forget.  Knowing that I picked the right woman made it more special.  We both cried tears of joy and enjoyed the rest of the day celebrating our engagement!,,,0.0
