,AssignmentId,scalar_text_sequentiality,sentence_total_sequentialities,sentence_contextual_sequentialities,sentence_topic_sequentialities,story,recAgnPairId,recImgPairId,Unnamed: 0
0,3R2UR8A0IB28IFTZ8AQ706IJX4IOX2,1.0342691135359194,"[-0.059004563551682696, 0.297445068359375, 0.8159748424183239, 0.9374640969669118, 1.3391488882211537, 0.7158465915256076, 0.9035263061523438, 1.0615699404761905, 1.05694580078125, 1.439453125, 0.42273680369059247, 1.8995361328125, 1.7080434163411458, 1.80615234375, 1.0319967830882353, 1.171470240542763]","[-27.6746826171875, -57.055755615234375, -50.845794677734375, -41.3953857421875, -30.7342529296875, -71.84133911132812, -66.87788391113281, -44.767578125, -43.5361328125, -37.7578125, -86.83382415771484, -18.09326171875, -12.00885009765625, -18.63671875, -27.8994140625, -20.7930908203125]","[-26.907623291015625, -64.49188232421875, -68.7972412109375, -57.332275390625, -48.1431884765625, -97.61181640625, -97.5977783203125, -67.060546875, -60.447265625, -70.865234375, -96.97950744628906, -40.8876953125, -32.50537109375, -40.310546875, -45.443359375, -43.051025390625]","Life is full of unexpected events, my life has been no different. About ten months ago I found out my significant other was pregnant,  I knew a new adventure was about to begin for me. As the weeks rolled by, the due date was coming closer and closer, and time seemed to move quicker too. I knew I was going to need lots of baby stuff, and a lot more money. I immediately started saving money, as well as working many more hours. Saving money wasn't the only hurdle I was going to have to overcome,  I also needed to move many hours away from where I was raised, and where my business was located. About a month before the due date my significant other decided that I could finally move up to where she was, I did not delay, and moved as quickly as I could. It took me three trips to move all of the baby stuff, and another trip to move my necessary belongings. Upon arriving,  I immediately setup the nursery for our soon to  arrive daughter. There were many other things to prepare,  like child proofing the house, and making sure that we were ready. I made tons of food, and froze them into individual servings, ensuring we would have proper caloric intake upon our return. I also made sure that our vehicles were in top operating condition. Before we knew it,  we were driving to the hospital. After two long days, our beautiful daughter was in our arms. It was the happiest day in my life,  and the beginning of my new family. A few days later we were able to go home, and start a new chapter of our lives.",3R2UR8A0IB28IFTZ8AQ706IJX4IOX2,,0.0
0,3R5F3LQFV36XNATE9SESXRYUF98OZB,1.8106047837947323,"[-0.03007238051470588, 0.6221852022058824, 1.673046875, 2.0520833333333335, 0.9662642045454546, 2.894500732421875, 2.2640516493055554, 0.9885525173611112, 2.3568202427455356, 1.7361297607421875, 1.7570079456676135, 3.15048828125, 1.1350446428571428, 1.92890625, 3.6640625]","[-65.38330078125, -45.2353515625, -18.890625, -20.78125, -34.4267578125, -19.054931640625, -18.70166015625, -25.69384765625, -9.99993896484375, -26.0714111328125, -37.53228759765625, -12.7841796875, -17.2421875, -31.828125, -6.3125]","[-64.8720703125, -55.8125, -35.62109375, -33.09375, -45.0556640625, -42.2109375, -39.078125, -34.5908203125, -26.4976806640625, -45.16883850097656, -56.859375, -44.2890625, -25.1875, -51.1171875, -17.3046875]","I since then have lost the job because they weren't giving me the breaks I wanted. I am going to move out with my boyfriend eventually and will have to get another job. I am nervous about it because I have bad anxiety. I'm hoping I do ok. I'm going to see if I can get councling. Councling would help alot I would assume. Though last time I had it, it didnt. So my assumption is really more of a hope. Worse comes to worse I get medication. I dont want medication because it upsets my tummy. I need a good tummy for a good working job. I also need good mental health for a good job. I hope my new job is good. This one didnt give me my 15 minute breaks. It really sucked.",32M8BPYGAU8N07N6L5DYSNM2H3BIGS,,0.0
0,31UV0MXWNRYPKAYM49U7OQVDQYK5IR,0.7761901202780646,"[-0.0281982421875, 0.5474477914663461, 0.9333552607783565, 0.5861523276881168, 0.5861268477006392, 1.1674813164605036, 1.5374056498209636, 0.6388671875, 0.35169458389282227, 1.0074300130208333, 1.1962818665937944, 0.62486328125, 0.9298612154447116, 0.4208689722521552, 1.1432137324892242]","[-25.832763671875, -48.870361328125, -59.468109130859375, -34.990318298339844, -39.89518737792969, -40.55613708496094, -24.845809936523438, -25.74560546875, -38.475669860839844, -44.3621826171875, -51.61752891540527, -74.19775390625, -28.1026611328125, -74.6109619140625, -70.3409423828125]","[-25.55078125, -63.10400390625, -84.668701171875, -46.12721252441406, -52.78997802734375, -61.57080078125, -43.294677734375, -35.32861328125, -44.102783203125, -59.4736328125, -77.93572998046875, -89.8193359375, -40.19085693359375, -86.816162109375, -103.494140625]","My wife and I had our 18th anniversary.  We went out for a romantic dinner at our favorite restaurant then came back to our house to have drinks and spend time with each other.  This one was special because we hit 18 years, and they weren't all easy, but we always stuck by each other's side. This was something that we were both looking forward to for weeks, mainly due to our busy schedules.  My wife and I both work full time, plus we have 3 kids, 2 who play multiple sports.  With all of this going on we never get date nights, even though we talk about them.  We never have time to get away and just have alone time.  We got to the restaurant, sat down, and put in our drink order.  We were instantly transformed back to the kids we were when we first fell in love.  I starred into my wife eyes and tried to say things to make her smile.  I love making my wife laugh, we sat there making each other giggle and reminiscing until our food came.  Afterwards we stayed a bit longer after paying the check, then went home a had a few more drinks, hanging out and laughing.  We get very few date nights and I always look forward to them.  Our anniversary is definitely something that can't get put off, so it's a time when no matter what comes up we make time for each other.  We made a goal to not make these nights wait for our once a year date, we need to take time for ourselves and our relationship more frequently.",3EO896NRAXHN0NTINNX537GRBIUTJD,,0.0
0,3PS7W85Z80OYUBG91B6SED2OY3Q9T5,1.0346424841677022,"[0.10982572115384616, 0.6207932692307693, 1.1328125, 0.848046875, 1.3574625651041667, 1.2242196890024037, 1.09765625, 0.8114433288574219, 1.8493923611111112, 1.2560763888888888, 1.2335862379807692, 0.0875, 1.5734675480769231, 1.79296875, 0.5243857781092326]","[-58.5390625, -40.369140625, -28.18359375, -26.91796875, -32.2900390625, -32.61334228515625, -26.04296875, -60.4383544921875, -21.09765625, -28.96875, -23.53564453125, -74.4453125, -39.9638671875, -23.9296875, -37.833664774894714]","[-59.966796875, -48.439453125, -39.51171875, -35.3984375, -48.57958984375, -48.5281982421875, -39.21484375, -73.42144775390625, -37.7421875, -40.2734375, -39.572265625, -75.7578125, -60.4189453125, -38.2734375, -45.6994514465332]","A person I know struggles with bipolar disorder but perseveres many times.  He has practiced for many years in music and doesn't give up.  He loves to play with others in band and orchestra.  He is caring and really wants to do his best.  A few years ago he started to not think straight at times.  His mind became foggy and he became more paranoid about life events.  He had to be put on medication because it became so severe.  The medication also had to be extremely strong as episodes lasted several months without respite.  Despite this he recovered and continued with the music.  He went to practice regularly and attended a concert.  I was so proud of him for keeping on going and working hard.  He did something few there even understood because they had been hidden from his reality.  They saw him practice, but didn't know the true events underneath.  Not many could understand the hardships and perseverance.  This was an accomplishment I'll never forget as tears welled in my eyes.",37M28K1J0RZILRU9HN6O82QZXR5AJB,,0.0
0,3DBQWDE4Y7KHYB9D1P7ZTYRUCUEN5J,1.1994176399479957,"[-0.010814525462962963, 1.8912654203527115, 0.8230202414772727, 2.2133614676339284, 1.068288803100586, 1.1932091346153846, 3.9796875, 0.7466618464543269, 1.056311565896739, 1.2598407451923077, 0.9868607954545454, 0.7549525669642857, 0.862579345703125, 0.8334318462171053, 0.3722873263888889, 1.1597381591796876]","[-105.2044677734375, -50.5289421081543, -47.65380859375, -17.1383056640625, -45.278472900390625, -44.23828125, -20.0390625, -36.45281982421875, -54.0162353515625, -38.5625, -30.6240234375, -39.9697265625, -28.267578125, -40.8125, -34.40625, -33.19805908203125]","[-104.9124755859375, -82.68045425415039, -56.70703125, -32.6318359375, -62.37109375, -59.75, -39.9375, -46.159423828125, -78.3114013671875, -54.9404296875, -41.4794921875, -50.5390625, -42.06884765625, -56.647705078125, -37.7568359375, -56.392822265625]","We went out for my sons birthday and we went to old orchard beach with his friends, Instead of choosing a normal kids food choice. Such as Chucky cheese or the Golden Arches he chose an authentic noodle bar. He loves the brown egg and all the seaweed bits. He loves to slurp them up. He tells us that's how the Japanese do it and we cannot tell him off. When we went to the board walk their is a large fairground. It has mainly adult rides. He is aged only 7 and his very tall for his age. He showed no fear and wanted to ride all of the adult rides where as a lot of his little friends did not. It was chaotic looking after all those kids but everyone enjoyed the day. It was along day and the weather was really quite warm. But we decided to go to the beach area that had a good breeze. But the area was very busy it took us a while to find a parking space. We ended up paying $35 dollars which I thought was a little high for a few hours parking. The kids wanted to leap out of the van. Even though they had been in the van for a while they still manage to make a lot of noise.",38F5OAUN5OY4BJ1LMKRJMY8UBKHH7M,,0.0
0,3JW0YLFXRU21YOXBPRLVFHHYRFHWWL,0.8569242432310976,"[-0.2734375, 1.41796875, 0.1732940673828125, 0.22708333333333333, 0.9190352590460527, 1.19921875, 0.4390670112941576, 0.7771499807184393, 0.8944038722826086, 1.5205165318080358, 1.7509765625, 1.3107550327594464, 0.53298095703125, 1.20277828640408, 0.76207275390625]","[-20.94140625, -21.41796875, -38.93487548828125, -43.197265625, -51.215576171875, -28.056640625, -59.325592041015625, -67.66487693786621, -50.1845703125, -6.60076904296875, -13.577392578125, -51.743245124816895, -57.64654541015625, -34.11824035644531, -14.1370849609375]","[-19.30078125, -31.34375, -41.70758056640625, -46.603515625, -68.67724609375, -46.044921875, -69.42413330078125, -84.76217651367188, -70.755859375, -17.244384765625, -36.340087890625, -85.8228759765625, -70.9710693359375, -55.76824951171875, -21.7578125]","This was a while ago now. I may not remember as many details. The wedding took place on a farm that belonged to my cousin's father-in-law. Since there were no trees around, it was nice and quiet and quite beautiful. It was very hot, and the reception being held in a nearby metal barn didn't help either. The bathrooms were in a trailer that was air conditioned, so that was nice. I was able to see family from Chicago, England, LA, and other places I don't normally get to see. It was fun watching my dad have to squirm while he interacted with brothers he doesn't particularly care for. They had an issue with food running out, so my aunt had to call a local pizza place for an emergency order. In the end it all worked out. The ceremony was nice, and my cousin looked beautiful in her dress. I felt like I was sweating too much due to the heat, and the pictures I'm in I don't look too good in. In an odd turn of events, I never actually got to speak to her husband, even though we were in a picture together. But I understand they were very busy that day and had a lot of guests to interact with. Overall I had a very good time at the wedding.",3UOUJI6MTE03VKDW4W2GZCA84RJUXP,,0.0
0,3FTF2T8WLS4QMSK3WGB31X9OGXR9WU,1.131509388489876,"[0.03840467664930555, 0.5202746921115451, 0.462335928892478, 2.1170003255208334, 1.7351840475331182, 0.9638233184814453, 1.4015682444852942, 1.4836980646306819, 0.6872429317898221, 1.1729621887207031, 1.8184455422794117, 1.8970758774701286, 0.6544637969045928, 1.0100476664881552, 1.010113525390625]","[-46.8341064453125, -78.73300170898438, -104.41872787475586, -29.9600830078125, -63.80512237548828, -48.487741470336914, -17.85791015625, -52.345947265625, -89.12235260009766, -36.13805389404297, -48.39697265625, -15.328628540039062, -113.937255859375, -55.69377136230469, -47.2176513671875]","[-47.525390625, -97.462890625, -122.4498291015625, -61.715087890625, -103.71435546875, -74.51097106933594, -41.6845703125, -84.9873046875, -113.86309814453125, -66.63507080078125, -79.310546875, -47.57891845703125, -135.53456115722656, -87.0052490234375, -67.419921875]","My son describes himself as a crazy cat lady, and he loves cats with all his heart.  He pretends to be a cat, he plays with his cats, he runs around meowing and grooming himself, basically anything a child can do to emulate a cat, he does.  For the last year he has had two cats and always talked about wanting more, always asking if we could get another, pointing out how he would be able to care for another anytime the opportunity arose.  I, as his mom, had said no to any more cats numerous times.  I was dead set against getting anymore, two was enough to feed and care for and buy litter for them to use.  Near my son's seventh birthday his father, my exhusband, called me up and asked if I was interested in a free cat.  My immediate response was no, I was not interested in having another cat in the house.  Then my ex said the cat was going to be a ragdoll, and my immediate no became an enthusiastic yes.  I had previously been interested in getting a rag doll kitty, I knew they were prized for the soft coats and gentle temperaments, and I knew they were sold for thousands of dollars.  Hearing that I could get one for free was amazing and I was not going to miss out on the chance to own a ragdoll.  She came home to us the weekend before his birthday and the humans here loved her immediately.  The other two cats took a little while to warm up to her, but they did.  Now it's commonplace to find them snuggled up to each other sleeping, or darting around playing together like furry little streaks of thunderous kitty running rampage. The cost of caring for three cats is somehow exponentially more than only two, but I wouldn't trade my new kitty for any amount of money in the world.  In this short time she has became a family member and you cannot put a price on your family members.",30ZX6P7VF9HTGOZ548D92K71IIJJ2A,,0.0
0,39RP059MEIFD595MQYJCJ52MKAVBM0,1.1101023361835003,"[-0.19670758928571427, 0.8880208333333334, 1.8705240885416667, 1.4270562065972223, 1.3176075328480115, 0.5492435031467013, 1.6287318638392858, 1.396875, 1.4479166666666667, 2.1921875, 0.8416295369466146, 1.4920376777648925, 0.4498291015625, 0.8553123474121094, 0.9603949652777778, 1.6253884055397727, 1.0627253605769231, 0.78680419921875, 0.4963671875]","[-44.2646484375, -19.7421875, -34.887451171875, -17.309814453125, -48.64739990234375, -56.964447021484375, -23.03466796875, -21.0, -35.7265625, -11.2734375, -21.95374298095703, -54.6684627532959, -73.626953125, -36.68218994140625, -62.150390625, -42.662353515625, -26.9619140625, -34.6436767578125, -87.6865234375]","[-41.5107421875, -25.0703125, -62.9453125, -30.1533203125, -77.634765625, -66.850830078125, -45.8369140625, -27.984375, -57.4453125, -22.234375, -34.57818603515625, -84.50921630859375, -83.523193359375, -50.3671875, -79.4375, -60.5416259765625, -40.77734375, -42.51171875, -100.095703125]","About 5 months ago I attended the graduation ceremony for my oldest Son. I remember watching him get ready. Fussing over his clothes and hair but trying to hide that from us. He looked so handsome in his bright green gown. I remember his, then, girlfriend was going to be there and he was a little shy about us meeting her. He was anxious to leave that day but also acting like it was no big deal to rush. In the car ride over he sat in the back seat with his siblings. They sang songs from camp. The younger two were in awe and a bit of envy over their big brother. We all felt so proud. Pulling up to the school I took a minute to take it all in. A sea of young teenagers in green gowns, feeling accomplished, all funneled into one place. The setting was meant to be formal but it was comically ironic how ""cheap"" a lot of it seemed. Once all of the students came in it was impossible to tell any of them apart. I sat through the few hundred names letting my attention wander off to his first day of school. A handful of bad days that involved tears over the years. But I also thought about how proud and excited I was for him. And entire lifetime of opportunity and experiences lay before him. I was interested in the difference between my current state of being settled in my life and his just starting to be lived for himself.",3QJOXOW4XKDBCCH60PL2KD87CL5MEP,,0.0
0,3MMN5BL1W0Q82E19B5461M4BIJQ3MZ,0.957169350508324,"[0.07628598420516304, 0.7686767578125, 0.6736921830610796, 0.0631103515625, 1.5246484375, 0.8806719098772321, 1.412363052368164, 0.40475260416666664, 2.604052734375, 1.4902437650240385, 0.6055081389671149, 0.8748224431818182, 1.03448486328125, 1.4049573625837053, 1.309127134435317, 0.6109406227289245, 0.5335406135110294]","[-61.02447509765625, -30.40478515625, -52.56036376953125, -32.3916015625, -28.6455078125, -27.11346435546875, -37.56544494628906, -52.5146484375, -12.27587890625, -62.931396484375, -100.53446960449219, -45.482421875, -56.798828125, -59.79046630859375, -32.83272933959961, -113.00323486328125, -36.9654541015625]","[-62.779052734375, -42.70361328125, -67.381591796875, -32.896484375, -66.76171875, -39.44287109375, -71.462158203125, -58.5859375, -38.31640625, -101.677734375, -126.57131958007812, -55.10546875, -73.3505859375, -99.1292724609375, -55.087890625, -139.273681640625, -46.03564453125]","When my friend and I met for the first time one of the things we really enjoyed was sitting around the bonfire. We enjoyed the flames licking at the logs and the warmth spreading out from the fire. We made smores and had a few drinks, spending most of our time just talking laughing and joking about life. At my house I have motion sensor lights. One night when we were sitting in the back yard around the bonfire one of the motion sensor lights kept going on and off. The odd thing about this was that it had never acted that way before. Talk around the bonfire went to ghosts and spirits, we joked that there may be a ghost trying to get our attention. Laughingly she said ""We see that you are here and recognize your presence."" After that the light did not go on again. This was something that we both found interesting, it's like she acknowledged whatever was going on and it was happy to be acknowledged it. The night was uneventful after that but it was the topic of conversation for the next few days, even though we had bonfires after that, we didn't experience that situation for any of those other bonfires. The other thing we enjoyed tremendously was going to Ren Fest. It was hot and humid that day but we both dressed as different Steam Punk characters. There were so many different things to look at and enjoy, we got to experience the fire whip, the jousting and the comedy troop. We spent hours just going through the different shops, enjoying the wares that were sold. And the food, don't get me going on the turkey legs, we spent so much time stuffing our faces with the different specialty foods that when we came home we both joked we would need too go on a diet. The sights, sounds and flavors that assaulted our senses were something that I will never forget.",3IUZPWIU1PTA3O3U0D2SR6N31EMWKC,,0.0
0,3U088ZLJVLF8QYWQWKSA8M8U0YE0WL,1.1342052569774017,"[0.0783547794117647, 0.46781099759615385, 0.7393465909090909, 1.3951655796595983, 1.149177074432373, 0.48479114879261365, 2.4439998973499644, 2.395480069247159, 1.43011474609375, 0.9262021520863408, 0.5058182426120924, 1.0677151150173612, 1.367583974202474, 0.9642736261541193, 0.8452529907226562, 1.1301959111140325, 1.8902064732142858]","[-60.015625, -22.439453125, -69.5615234375, -30.056671142578125, -82.46083068847656, -106.00286865234375, -28.65329360961914, -14.23516845703125, -27.01318359375, -55.13350772857666, -58.2037353515625, -36.042236328125, -23.57022476196289, -57.3035888671875, -97.8489990234375, -47.36078643798828, -19.0029296875]","[-61.34765625, -28.52099609375, -85.8271484375, -49.5889892578125, -119.2344970703125, -122.0009765625, -55.53729248046875, -40.58544921875, -49.89501953125, -76.4361572265625, -69.83755493164062, -55.2611083984375, -44.083984375, -78.51760864257812, -124.8970947265625, -76.74588012695312, -32.234375]","Mom startled me one day early this year and made me very worried about her mental state. It's been a long time since I've seen her so sad. She had recently finished speaking to Aunt Rue in New Jersey on the phone when I noticed how low her mood was. When I asked, she told me she had just learned really disturbing news. According to Aunt Rue, my cousin Deena -- who is my mother's and aunt's niece -- has apparently joined what other family members described as a ""cult."" We don't live in the same state and visit close to never, so it's not surprising that all of us up East were a bit suspicious of the claims. We thought the family Down South was exaggerating the situation... that is, until we went down to see for ourselves. Shockingly, we soon learned, they were not stretching the truth in the least. Deena, always a husky if not somewhat fat person, had lost so much weight we could barely recognize her. Her house, always pristine and inviting, was now a veritable dump with stuff just thrown haphazardly everywhere. The saddest part was that she seemed oblivious to how all of this looked to other people. Months later we still have not figured out how to get through to Deena.  She has resisted every attempt to break through her wall and help her understand how dangerous and unhealthy her predicament is. The family Down South continues to monitor her as closely as possible while attempting to not appear like they are stalking her, which makes her defensive, angry and argumentative. Meanwhile, the rest of us are seeking professional advice because it has become increasingly certain that we cannot get through to her on our own. Sad, perplexing situation all around.",31LM9EDVOMEP5AOYQRBTU8AZVWPNJO,,0.0
