,AssignmentId,scalar_text_sequentiality,sentence_total_sequentialities,sentence_contextual_sequentialities,sentence_topic_sequentialities,story,recAgnPairId,recImgPairId,Unnamed: 0
0,3N1FSUEFL6MQGGE0YQAMS19MRPZ4DE,1.0406169934208114,"[-0.014404296875, 0.4113103693181818, 0.43559126420454547, 1.3449519230769231, 0.2668269230769231, 1.2306976318359375, 0.020100911458333332, 1.0584658668154763, 1.23828125, 1.0794661672491777, 1.9568142361111112, 1.262798854282924, 1.02890625, 2.6369972229003906, 0.8617324829101562, 2.180447048611111, 1.4433040618896484, 1.2935791015625, 1.4018762761896306, 1.1981201171875, 0.10709635416666667, 0.4506138392857143]","[-20.857421875, -26.4423828125, -44.66943359375, -39.71875, -48.2265625, -25.311874389648438, -46.9853515625, -50.545654296875, -21.1875, -30.015472412109375, -24.095703125, -21.609878540039062, -17.35546875, -15.005584716796875, -13.168304443359375, -22.8271484375, -22.428619384765625, -14.658203125, -18.189407348632812, -15.35595703125, -16.0810546875, -17.7890625]","[-20.7421875, -30.966796875, -54.25244140625, -57.203125, -51.6953125, -43.7723388671875, -47.34716796875, -72.7734375, -26.140625, -50.52532958984375, -41.70703125, -39.2890625, -22.5, -36.1015625, -16.615234375, -42.451171875, -45.521484375, -25.0068359375, -33.61004638671875, -20.1484375, -16.7236328125, -20.943359375]","I had the best day at work today. I love this new job more than I ever thought possible. 6 months ago I really thought my life was over when I quit my job with no plan for the future. I admit now I quit on an impulse, but it felt right. I had been getting harassed at work by this horrible employee named Jan. She was inappropriate and rude to everyone, and no one stood up to her. I was trying to complete a project at the office while everyone else was enjoying the Christmas party. Jan kept coming into my office to ask me to drink with her and to dance, it was obnoxious. She was obviously drunk,. I asked her several times to leave me alone and she would not stop touching me and harassing me. After an hour of the constant annoyance I snapped. I told her exactly what I thought of her and how terrible she was. Everyone just stood and watched. No one joined in or had my back. I was distraught. My supervisors watched me be harassed and did nothing. After my outburst I knew I was done at that company, so I quit. I just grabbed my things and walked out. I remember getting in my car and crying my eyes out. I needed that job. I hadn't done anything wrong. I really thought my life was over.",,34PGFRQONPXFS4XCIS2GQRNQFVFJWY,0.0
0,3RRCEFRB7NYX1JGGKUJGXBLMMSQB4R,1.2646903620421122,"[-0.2451171875, 0.8098558698381696, 1.991455078125, 1.8206100463867188, 2.71484375, 1.2886152267456055, 1.0081863403320312, 0.8882652731502757, 1.2748633490668402, 1.6114819844563801, 0.6978236607142857, 1.1144202096121651, 1.6434461805555556, 1.8248731825086806, 0.9914381239149306, 2.1243489583333335, 0.584228515625, 1.1184895833333333, 0.7639382102272727, 1.2677408854166667]","[-26.70947265625, -25.360565185546875, -6.35986328125, -20.38433837890625, -2.3671875, -29.132156372070312, -30.9422607421875, -32.43708801269531, -7.9543914794921875, -13.939559936523438, -19.439453125, -22.517745971679688, -30.083984375, -18.386383056640625, -15.316986083984375, -24.498046875, -15.988037109375, -17.8359375, -35.6806640625, -21.099609375]","[-24.50341796875, -36.69854736328125, -14.32568359375, -34.94921875, -10.51171875, -49.75, -47.0732421875, -47.53759765625, -19.42816162109375, -33.27734375, -24.32421875, -38.11962890625, -44.875, -34.81024169921875, -24.23992919921875, -43.6171875, -21.24609375, -24.546875, -44.083984375, -36.3125]","I had a serious problem a few months ago. I was working on a big project and spilled coffee all over my computer. My computer stopped working. None of the normal tricks would restart it. Everything was lost. I had just started a new job and really needed that computer in order to work. I did not have much money saved up because I had not gotten my first paycheck. It was super embarrassing, but I decided to reach out and ask my family for help. Luckily, my parents were able to help me. They gave me money that I needed to buy a new computer. They are always so loving and kind. I don't know what I would ever do without them there for me. I definitely would not have my job any more. I was able to get the perfect new computer. I was able to finish my project in time. I am always thankful that my parents could help. I hope to never be in this situation again. There's little chance I will. I've learned my lesson and keep the coffee far away. No way do I want to have to ask for money again!",,39LNWE0K4VI65PO15A2FW2NTGNSIU8,0.0
0,378XPAWRUDZMQGA3Z5LOW1BZAJBAIY,0.8424321951672378,"[-0.1998779296875, 0.7473182678222656, 0.5747975742115694, 0.7978515625, 0.8343912760416666, 0.9427734375, 0.7369539814610635, 1.0043004353841145, 0.6926915095402644, 1.2086759868421053, 1.1022237141927083, 0.6354041466346154, 0.9708640358664773, 0.8716354370117188, 1.7164794921875]","[-41.756103515625, -46.83442687988281, -68.17020797729492, -28.982421875, -58.66796875, -16.9453125, -65.44910430908203, -61.75103759765625, -38.80848693847656, -42.2001953125, -21.352783203125, -97.47802734375, -38.4385986328125, -40.0577392578125, -13.837646484375]","[-39.75732421875, -61.780792236328125, -87.71332550048828, -36.9609375, -78.693359375, -26.373046875, -88.294677734375, -85.854248046875, -47.8134765625, -65.1650390625, -34.5794677734375, -122.2587890625, -59.797607421875, -54.00390625, -31.00244140625]","3 months ago today I had my prayers answered. After months of treatment, endless hospital bills, and fear: my mother had finally gone into remission. She had gone through 6 rounds of chemo, her hair had fallen out, she had grown to a third of the size of the plump woman I once knew. She was frail, almost ghostlike in her disposition. I was afraid, as all children are when things like these happen, that my mother would not be there within a year. Thankfully, that little voice inside of me was wrong. She made a full recovery, as of today there is no sign of the cancer that had gripped her; however, this has taught me a few things. I realized I need to understand she wont be around forever, and that it, the cancer, might come back one day. It's not a one and done deal, this is a killer. My mother is strong, though, I have full faith that she will live for another dozen years. She's strong, and she won't give up that easily! We went to the Bahamas to celebrate, the place where my father and her met, and we drank and talked about life and what we would do now that she can actually, well, do things! She was always tired before, but now she's active and ready to make up for the time she's lost. I really appreciate that shes alive, but I wish she'd be more careful. I don't want to lose her, after all!",,3TK8OJTYM27YZQ05NV241LQOH2QPVZ,0.0
0,37QW5D2ZRH8X16KK7JVO4CBR09OS8I,0.9336490997731236,"[-0.017789713541666665, 0.24406941731770834, 1.5328125, 1.1936863490513392, 1.0643768310546875, 0.8983219691685268, 0.5088764537464489, 0.7295339483963815, 0.7007107204861112, 0.6454580206620065, 1.4134567260742188, 0.7449111938476562, 1.0880974663628473, 2.6953125, 0.5629021139705882]","[-37.9434814453125, -68.900146484375, -15.5625, -30.96368408203125, -21.1568603515625, -27.724212646484375, -20.658096313476562, -52.53466796875, -31.9384765625, -35.545928955078125, -12.202011108398438, -37.5445556640625, -60.83416748046875, -16.296875, -32.111328125]","[-37.6766357421875, -76.22222900390625, -23.2265625, -47.67529296875, -29.671875, -40.30072021484375, -26.2557373046875, -66.39581298828125, -38.244873046875, -47.80963134765625, -26.336578369140625, -49.463134765625, -80.419921875, -27.078125, -41.6806640625]","Two months ago I lost the person that gave birth to me in this world. It still doesn't feel totally real, but the amazing part is that I'm actually coming to terms with it a lot quicker than what I expected to. This woman was my hero. This woman helped raise me and steered me towards the direction of success. But lung cancer took her away from me. She was so stubborn though, and put up one heck of a fight. She tried her best to last as long as she could. She beat the odds every time it felt like and at times I thought she was simply invincible. Only way mom was going was kicking and screaming. I think the reason she held out for so long was because she felt like her family needed her. She wanted to make sure they were taken care of. She wanted us to feel safe, just as much as she had her entire life. Two months ago she felt safe with this knowledge and left for those big clouds in the sky. It does still sting. But I'm so proud of her, and I hope she's the same for me.",,3WS1NTTKEZY6FCAV6VIA4YMUSEW0FK,0.0
0,3YZ8UPK3VU8FSM21D06TLZPZ1LRUC7,0.8711175638354505,"[0.01240234375, 0.9169921875, 1.3315972222222223, 1.6893199573863635, 1.3807237413194444, 1.0548258463541667, 1.308807373046875, -0.074951171875, 1.2142857142857142, 2.0390625, 0.8539021809895834, 0.8658854166666666, 0.760546875, 1.1201171875, 0.21824428013392858, 1.141320881090666, 0.19462253736413043, 0.2766518063015408, 0.5619132632300967, 0.9431533813476562, 0.49584297511888586, 0.80023193359375, 0.9302055358886718]","[-46.49755859375, -38.48046875, -21.16015625, -33.34521484375, -67.806396484375, -53.9178466796875, -52.26904296875, -71.484130859375, -33.578125, -7.359375, -48.8997802734375, -25.1953125, -24.40234375, -42.427734375, -72.2469482421875, -42.711631774902344, -59.496826171875, -77.3035659790039, -80.16502380371094, -87.2327880859375, -54.992095947265625, -30.15283203125, -55.30059051513672]","[-46.68359375, -49.484375, -33.14453125, -51.927734375, -105.0859375, -69.740234375, -78.4451904296875, -69.91015625, -42.078125, -15.515625, -66.83172607421875, -30.390625, -32.0078125, -58.109375, -76.830078125, -64.396728515625, -63.97314453125, -87.26303100585938, -103.765380859375, -117.4136962890625, -66.396484375, -36.5546875, -83.20675659179688]","Hubby surprised me with an early birthday present this morning 2 month ago! My birthday party is tomorrow & my birthday isn’t until Monday. But he wanted to do something with just us. So he bought me an awesome & yummy ice cream cake. I came out of the bathroom & he had it setting on the table with candles & holding the camera with the lights off singing happy birthday. Then he gifted me with a beautful sterling silver & yellow gold heart bracelet! I just wanted to share with you awesome ladies & I hope all the September babies have an amazing birthday!  The surprise was a custom Harley Davidson that I had designed, and he spent 2 years building for me. i was really awesome and great feelings. i was really happy.  Well my birthday isn't until next week but my husband usually surprises me early because I don't expect it...actually I am catching on lol. We went to the mall and had food court lunch. I was good, I ate at the cafe that has salads and such. I had one of his french fried with ketchup and I couldn't believe how intense the saltiness was. I haven't had a lot of salt in the past few weeks so it was intense salt taste. I wanted to give him something really special and personal for Christmas (I believe it was our second or third Christmas together). I reflected back on gifts that my loved ones had given me through the years and decided that my absolute favorite gift was the photo album of my life that my parents put together for me. Given that my husband's parents had died several years before we met, I thought it would be the perfect way for me to get to know him and a beautiful memento of his life that he would cherish forever. I spent hours after work secretly rifling through a box of photos I found, gathering the best shots of him, his family, his homes and his beloved dogs. I hoped he wouldn't see any part of my project before it was over since I wanted him to be totally surprised. I took pride and delight in my project. My heart overflowed with love and I could hardly wait for Christmas morning when he would open it and laugh, cry, and appreciate me all the more.",,34S9DKFK74BF0ZJXCRCW4VPN90ZNYK,0.0
0,3A1COHJ8NKH8BX64WPJP0Y4PSWB8HE,1.5118052248029143,"[0.08508682250976562, 1.4117259979248047, 2.01141357421875, 1.6013658311631944, 1.4930826822916667, 1.2136674360795454, 0.9859793526785714, 1.0761067708333334, 4.364990234375, 0.8702505011307565, 1.0254231770833333, 1.463208712064303, 1.0775955863620923, 2.2787704467773438, 1.1082275390625, 2.1219889322916665]","[-51.98193359375, -17.254165649414062, -18.9283447265625, -24.7379150390625, -33.2509765625, -21.427001953125, -34.60205078125, -56.734375, -0.22314453125, -27.126373291015625, -35.10791015625, -53.452667236328125, -46.694305419921875, -7.753814697265625, -38.6630859375, -19.5361328125]","[-53.34332275390625, -28.5479736328125, -39.04248046875, -53.5625, -51.16796875, -34.77734375, -55.3076171875, -72.8759765625, -8.953125, -43.6611328125, -50.4892578125, -91.49609375, -71.47900390625, -16.868896484375, -60.82763671875, -45.0]","Everyone knows that my 1995 Geo Tracker has been completely run into the ground. I get jokes about it all the time. It even has 279,000 miles on it! Some of my good friends even have a running bet on when it will finally die for good. I kept telling them they were foolish and it would live forever. Sadly, though, about two months ago it finally happened. I was driving on the highway back home from work when I heard a bad clunking from the engine. After some recent repairs by my husband I knew it was probably a transmission failure.  Not good. I had to call my husband at work and he came to pick me up to take me home. But instead of going back to our house, he pulled into the Hyundai dealer! He had already arranged a test drive for a brand new Santa Fe, the car we had been talking about recently as wanting to own. After a great test drive and some consultation, my husband walked back into the dealership and handed the salesman his credit card. I was blown away! I had no idea he was prepared to get me a new car, so this totally blew me away! From one bad car to a great new car in one day!",,3IXEICO7935BCSEB343GU3BMXLX6TX,0.0
0,3TK8OJTYM27YZQ05NV241LQOG8WVPM,1.4355573577282232,"[0.0400390625, 1.746484375, 1.54765625, 1.857206556532118, 2.715541294642857, 0.986198598688299, 0.640289306640625, 1.9966230392456055, 1.1369883219401042, 2.110506924715909, 0.7096354166666666, 2.490234375, 1.4438069661458333, 0.6470703125, 1.1967129177517362, 1.7039240056818181]","[-25.97265625, -21.0234375, -21.5625, -18.286605834960938, -12.7919921875, -25.37740135192871, -23.022216796875, -6.869789123535156, -49.4293212890625, -12.556884765625, -16.7705078125, -6.705078125, -31.01025390625, -22.9033203125, -26.055755615234375, -19.58203125]","[-26.3330078125, -38.48828125, -37.0390625, -35.00146484375, -31.80078125, -36.2255859375, -28.14453125, -22.8427734375, -76.717041015625, -35.7724609375, -21.0283203125, -19.15625, -48.3359375, -26.138671875, -36.826171875, -38.3251953125]",My dog doesn't like being in small spaces. Sadly my daughter's room is too small for him. We needed him to go in there for the night. Didn't want him bothering me and the wife. I tried to convince him with treats. He wouldn't listen to me and just go in there. I tried to talking to him about it. He wouldn't listen to me at all. I tried to pet him and be sweet to him but no matter what I did he had no interest in go in there. Finally I decided to just force him to go in there. He was so freaked out. I felt bad about it. He was crying about it and was looking at me all mad. He ended up tackling me. My wife laughed at both of us over it. I guess he's not going to go in there anymore.,,3WI0P0II62EXHMGY926Z0UKWHALDRK,0.0
0,3R6BYFZZP8YEC2G6977HDC952S3FXU,1.3467669078648643,"[-0.010298295454545454, 0.554150390625, 2.291232638888889, 2.85546875, 0.9821614583333333, 2.1265625, 0.8368566176470589, 2.3681640625, 0.9027679443359375, 0.798974609375, 1.259033203125, 2.2015625, 0.23759765625, 1.5411716037326388, 2.2060922475961537, 0.7609375, 1.5377022879464286, 0.7916666666666666]","[-56.70703125, -37.064453125, -34.44921875, -9.94921875, -39.43359375, -15.259765625, -59.3359375, -10.27734375, -16.632476806640625, -47.64453125, -32.8974609375, -15.3828125, -113.33251953125, -18.60943603515625, -28.22998046875, -7.09765625, -12.0947265625, -14.9375]","[-56.59375, -42.60595703125, -55.0703125, -29.9375, -54.166015625, -36.525390625, -73.5625, -19.75, -25.66015625, -63.6240234375, -48.005859375, -26.390625, -121.6484375, -32.47998046875, -56.9091796875, -10.90234375, -22.858642578125, -19.6875]",I will still be so worried about her at colllege. Of all the rape stories happening in the news lately. The men at college seem so psychotic and aggressive. I will be so worried about her. I'm worried if something like that happens she will lie to me about it. I'm so concerned about her going away to college. She was staying with friends in California but still when she got back she still acts different... like something weird happened. But she's not willing to share it with me. I'm so concerned that she will grow up to be an evil woman because of some of her actions. Her visit to Cali really turned her into a bad girl. She seems so much different. I hope that at the end of college she can get a decent job because those student loans to burden onto a husband with his own job are too much for a man to handle. She will probably end up marrying a sugar daddy. A sugar daddy that she meets that will pay off her student loans. I can see it now. It's going to be so embarrassing. I wish I had a son.,,3ZSANO2JCGT6GLU7FX1UE4SDN51FS6,0.0
0,3SITXWYCNWVOZL4Q45LLUMILDDPBXG,1.097078379484998,"[-0.0703125, 0.45877511160714285, 0.15748697916666668, 0.7805088588169643, 1.7466192245483398, 1.2022298177083333, 0.7213763068704044, 1.6893281069668857, 1.2925347222222223, 1.5801289876302083, 1.4649271647135416, 1.7933772160456731, 1.8834784371512276, 1.0696461995442708, 0.6860710592830882]","[-13.484375, -34.630859375, -23.87646484375, -12.90264892578125, -7.167671203613281, -21.613525390625, -30.885040283203125, -12.848299026489258, -25.59375, -23.4134521484375, -25.384002685546875, -22.25103759765625, -11.998489379882812, -23.07830810546875, -28.292236328125]","[-13.203125, -41.0537109375, -26.23876953125, -18.3662109375, -21.140625, -36.040283203125, -43.1484375, -31.430908203125, -37.2265625, -42.375, -47.35791015625, -45.56494140625, -38.3671875, -35.9140625, -39.9554443359375]","Here I am again. It seems like there are times when the world decides to dump on me. I always knew that this day would come, but I still wasn't prepared. Three weeks ago I lost my dog. She was my best friend and constant companion. I raised her from a pup, almost like my own child. I know a lot of people scoff when you say that, but I don't care. She was family to me and I miss her so much. She always loved going outside and chasing the ball. Man, was she fast, and great at catching the ball. It was a shock to me when she was no longer able to run around. I knew something was wrong but thought maybe she just had a bug. I took her to the vet and received the worst news I could imagine. Cancer, and she wouldn't make it longer than a week. It's a strange feeling when all you can do is wait for someone to pass on.",,3BF51CHDTWWQT8111L6A7JY78S2H0Q,0.0
0,3RANCT1ZVG3WIHAVZ0AYAFJHKMWUBE,2.0584183087149395,"[0.3676060267857143, 1.49560546875, 2.0764715021306817, 2.3373514811197915, 2.026332310267857, 1.8565848214285714, 2.246742942116477, 1.85546875, 1.4677734375, 1.24365234375, 1.94921875, 5.3291015625, 2.78056640625, 2.525927734375, 1.31787109375]","[-35.48046875, -24.98828125, -23.8668212890625, -25.62646484375, -27.94189453125, -16.15234375, -18.73504638671875, -29.609375, -25.2734375, -67.5908203125, -36.4765625, -11.759765625, -25.921875, -20.33837890625, -36.7578125]","[-38.0537109375, -36.953125, -46.7080078125, -53.6746826171875, -56.310546875, -29.1484375, -43.44921875, -48.1640625, -37.015625, -89.9765625, -59.8671875, -43.734375, -53.7275390625, -45.59765625, -47.30078125]","I want to relocate my home place. Because i got better job in another state. It was very tough to relocate one state to another state. We have to change each and every small things to another place. Like we have to change our passport address, license address, and etc. But i have to change my location. Physically it was very hard to relocate with our things. and also financially it cost very much to our budget. But i can handle this situation very smart. at the end i was sell my home products and big things in my house to local mart. After i sell it i can get a enough and reasonable money. Then i relocate with small things. It was slightly easy than moving with lot of things. I can buy some new products in my new place. It could be less amount for transport charge.",,37W3JXSD67U5NTSB4S3J0E2EBB6WYU,0.0
0,31IBVUNM9TLM8DBB9S6ZPRCLCDOFV4,1.6055113881572425,"[-0.007737379807692308, 2.5025111607142856, 1.030633544921875, 1.8250177556818181, 2.1767578125, 1.2820046164772727, 1.8953382703993056, 1.6864559467022235, 0.7926076253255209, 1.5166005221280185, 2.4607443809509277, 1.8291749500093006, 2.0353557586669924, 1.9639461741727942, 1.0047260781993037, 1.6940449934739332]","[-41.5224609375, -11.439453125, -54.2794189453125, -32.0986328125, -19.888671875, -23.43994140625, -14.77642822265625, -17.900657653808594, -35.655426025390625, -48.893577575683594, -23.328347206115723, -49.57658386230469, -29.294837951660156, -18.11846923828125, -35.779972076416016, -42.973384857177734]","[-41.421875, -28.95703125, -74.89208984375, -52.173828125, -48.1865234375, -37.5419921875, -31.83447265625, -39.8245849609375, -49.92236328125, -82.2587890625, -47.935791015625, -87.9892578125, -70.001953125, -51.50555419921875, -58.888671875, -87.0185546875]","Two weeks ago our cat, Baby Kitty, disappeared for several days.  Our family went crazy looking for her.  It got so bad that I was trying to think of how to gently break her disappearance to our daughter.  Baby Kitty could usually be found in our daughter's presence.   Whenever she would get upset, Baby Kitty would help calm her down.  When we finally found her she couldn't even stand up.  We got her to an emergency vet right away.  He told us we were lucky we got to her when we did.  With the snowstorm coming, it wouldn't have been good if she got caught in it.  The vet made a splint for her hind leg, apparently Baby Kitty broke it, we don't know how.  The vet believes a car might have nicked her.  My daughter brought in a notepad to the vet so she could take down notes for Baby Kitty's recovery.  At home, my daughter declared that she will take care of Baby Kitty to make sure she gets better.  Two weeks have gone by since the incident, and Baby Kitty is doing a lot better.  The vet wants to see us in another two weeks to take some x-rays to make sure the bones are healing well.  True to my daughter's words, she has taken care of Baby Kitty and sees to her every need, when Baby Kitty lets her.",,3P529IW9KZ7JC8ZHVO4T2IEIYUGLFQ,0.0
0,3ZOTGHDK5JX0MY70E0KK1Y1RH1POSQ,0.9160776355260724,"[0.0953125, 0.6243235270182291, 2.796875, 0.23212687174479166, 0.67823486328125, 1.044140625, 0.9136595549406828, 0.6564585367838541, 0.9185405530427632, 0.6802549008969907, 1.1244439019097223, 0.9443708147321429, 0.8690897623697916, 1.1111803327287946, 0.7025800432477679, 1.179962158203125, 1.001765858043324]","[-19.640625, -26.2132568359375, -10.1982421875, -40.6746826171875, -35.50616455078125, -30.095703125, -77.33802795410156, -56.45355224609375, -43.9110107421875, -51.033447265625, -40.584228515625, -43.014892578125, -43.91943359375, -62.64659118652344, -45.52813720703125, -31.93408203125, -15.070419311523438]","[-20.1171875, -33.70513916015625, -26.9794921875, -46.2457275390625, -45.6796875, -45.7578125, -102.0068359375, -72.20855712890625, -61.36328125, -69.40032958984375, -60.82421875, -62.8466796875, -64.777587890625, -101.53790283203125, -60.282318115234375, -55.5333251953125, -26.08984375]","My heart is utterly broken. Two months ago in May, my sister-in-law passed away. It was sudden and very tragic. She was driving home from work in the rain when she lost control of her car and get into an accident on the interstate. It feels like I was just talking to her and planning our next get together. We'd planned to go to a concert with my brother and sister in July. I didn't like the artist that we were going see, but it was for her birthday that we'd missed doing something for in February. She had been waiting to go that concert for years but hadn't been able to because our work schedules didn't line up. I considered my sister-in-law as much one of my actual siblings as my brother and sister are. She'd been there for my wife and I through some hard times and was always willing to lend a hand to help us with the children. I can't believe that she's gone and I know that it's tougher on my wife. This is a very tragic time for both of our families, because she was really a light in our lives. My family is pulling through as best we can and are making sure that we are there for each other in this trying time. The funeral was difficult, but it was attended by so many people and my sister-in-law would've really been happy to know how many lives she touched when she was still here. I think that if anything good can come out of this is that we'll be more of a bonded family. We know that's what she would've wanted us to do and we'll honor her in this way. But I don't think I'll ever stop missing her.",,324G5B4FB4UT0JVPOCKYG69DW6870G,0.0
