,AssignmentId,scalar_text_sequentiality,sentence_total_sequentialities,sentence_contextual_sequentialities,sentence_topic_sequentialities,story,recAgnPairId,recImgPairId,Unnamed: 0
0,3I33IC7ZWGOIFVW1A20W9L4IUF6A28,1.3648078597931284,"[0.13563603940217392, 0.762109375, 0.3800323659723455, 1.6314290364583333, 1.185546875, 2.6171875, 1.09716796875, 1.94921875, 2.803466796875, 0.419921875, 2.7921875, 0.7750289351851852, 0.7532410254845252, 1.422914777483259, 1.9111328125, 0.8585771833147321, 3.0364583333333335, 1.6958801481458876, 1.7890625, 0.622586543743427, 1.229736328125, 0.77010498046875, 0.751953125]","[-79.891357421875, -12.2535400390625, -66.15731811523438, -19.65283203125, -36.34912109375, -10.46875, -33.12255859375, -24.8125, -5.7705078125, -21.345703125, -23.86328125, -79.54931640625, -33.58514404296875, -14.0733642578125, -17.4296875, -45.78387451171875, -8.375, -59.02142333984375, -12.8671875, -39.05780029296875, -12.973876953125, -68.403076171875, -34.73828125]","[-83.010986328125, -16.0640869140625, -74.51803016662598, -29.44140625, -51.76123046875, -23.5546875, -45.19140625, -44.3046875, -16.984375, -23.4453125, -37.82421875, -100.47509765625, -43.37727737426758, -24.033767700195312, -38.4521484375, -57.803955078125, -17.484375, -89.54726600646973, -21.8125, -47.1514253616333, -21.58203125, -83.80517578125, -41.505859375]","Thanks to my pals constantly remonding me to show up, I gave in and drove out to the game. The weather was lovely. I found out, suddenly that the traffic was being rerouted and I was forced to park far away. I walked to the north entrance.  Walking felt awful because the sun was bright and was getting hot. there were cops everywhere. One policeman was very kind to a couple of ladies. I asked him about the north entrance to the game. He gave me directions. the he did something unexpected. Cops dot do that. He told me how to get there, he told me that the game would start a little later because they knew about teh detour. He also pointed to some other pedestrians who were walking. He motioned them to come over. He told them that I was going to the game too.  I thanked him so mnay times that he started giggling. and blushing. I walked to the stadium with my new found guides and was teher before long.  Then my friends found me. We all sat close to each other, after exchanging seats. We rooted for the same team. I expected to be miserable, but that was so fun that I am looking to another game again. I keep thinking of how kind the cop was.",,,0.0
0,38JBBYETQPWV8MS0ULL6YJR7Y83E45,1.5167723647648037,"[-0.06351579938616071, 0.605120849609375, 1.1729248563448589, 1.3119840621948242, 1.8503636360168456, 2.4173177083333335, 3.0064174107142856, 1.580484962463379, 2.690860054709695, 1.1197519302368164, 1.1168212890625, 2.4761962890625, 0.6935369318181818, 1.179206339518229, 1.8165690104166667, 1.2943183051215277]","[-54.34651184082031, -40.5426025390625, -39.73688840866089, -19.37295150756836, -28.969289779663086, -12.51171875, -14.185546875, -40.12076950073242, -19.419368743896484, -37.26362609863281, -10.28466796875, -11.0087890625, -23.9345703125, -38.31843566894531, -7.7646484375, -15.86480712890625]","[-53.45729064941406, -52.64501953125, -67.8870849609375, -35.11676025390625, -65.9765625, -27.015625, -35.23046875, -71.73046875, -49.018829345703125, -56.29940891265869, -19.21923828125, -30.818359375, -31.5634765625, -56.00653076171875, -18.6640625, -27.513671875]","I was out at brunch and a bar for my friends birthday. I saw a lot of friends I had not seen in a long time, and my brother and sister. The majority of the time we spent at brunch was spent catching up with each other and telling each other jokes. We did not spend that much time eating and drinking. After about 2 or so hours, we left the brunch restaurant and went to a nearby bar. My brother and sister accompanied us. Some of my brothers friends came too. They were not at the brunch earlier because we did not have enough spots for all of them. At the bar, we spent quite more time drinking. There were some games we could play like basketball, cornhole, and jenga. We had a good time at the bar. After that, we went to another bar. We spent quite a lot of time out in the city. Some friends had to leave, but the majority were able to stay out long. I had a really good time. I was surprised at how many people showed up.",,,0.0
0,369J354OFEW77NS5J449VKWXIEIG6C,0.7570734900344119,"[-0.08451080322265625, 0.19871051494891828, 0.7128082275390625, 0.7433661099137931, 0.9689867743130388, 0.8943314985795454, 0.6564229329427084, 0.7822550898012908, 0.9767552330380395, 1.37744140625, 0.6560487747192383, 0.6062875423791274, 0.5363712310791016, 0.8873595457810622, 0.573828125, 1.414453125, 1.2281960880055147, 0.49821140455163043]","[-44.995849609375, -25.214153289794922, -47.325347900390625, -88.1767578125, -69.06794738769531, -58.6728515625, -50.641357421875, -70.83357238769531, -60.510684967041016, -27.09033203125, -24.69676971435547, -158.27984619140625, -130.10516357421875, -49.11631393432617, -32.22265625, -37.73046875, -50.78717041015625, -112.9012451171875]","[-43.6436767578125, -27.79738998413086, -61.581512451171875, -109.734375, -97.16856384277344, -78.34814453125, -66.3955078125, -88.825439453125, -81.02254486083984, -42.2421875, -29.945159912109375, -190.4130859375, -155.85098266601562, -72.18766212463379, -37.9609375, -58.947265625, -71.66650390625, -135.8189697265625]","A few weeks ago, a friend of mine, and I, had split up. We both go to college and live in the same dorm building. She always had this pattern of making up excuses for not seeing me, or communicating with me. It has gone on since the begining of last year, we would try to do something of a routine together but she would always fail to commit. Last year it was running, then the next semester was going to gym, then this fall we decided we would try going to yoga. She had gone the first night with me, but she evaded it 3 times in a row after that. I told her over the summer that she would have to actually make an effort to reach out to me and be my friend. She claims I would never text her but I made my attempts and she did not reciprocate like a friend would. She would also get back together with her abusive ex multiple times, like my advice did not matter. She would also hang out with people she claimed to hate. She did this out of lonliness. She made me feel used, where before she would invite me to her room all last year to complain about her ex, which I would listen to, when they are both okay after the 4th time getting back together, I was cast to the side. So when she kept avoiding me, I gave it to her straight over text that I miss her friendship and that I did not need this support in my life right now, and that we were growing apart, she lashed out at me. She claimed I was too sensitive and how I was the problem and that we would still be friends if I wasn't so sensitive. She said it in a much ruder tone though. I avoid her now, and I still feel the hurt from all of that. I only wish it could have ended more amicably because thats how I approached her. I approached it like how my counselor told me to, and she said I have to realize that it may not go the way it is intended to, and she was right, and that is why it hurt all the more.",,,0.0
0,3IGI0VL648636LFV643Y24RLS7LNOP,1.0598981896282087,"[-0.16319005629595587, 0.5931015014648438, 1.0673828125, 1.7550603693181819, 0.8515091159126975, 1.3395182291666667, 1.7392578125, 2.3338068181818183, 0.342498779296875, 1.40827390882704, 0.9611670754172585, 1.0267740885416667, 1.0908571879069011, 0.3762734586542303, 1.2043571472167969, 1.01416015625, 1.0774608188205295]","[-48.80889892578125, -41.35003662109375, -27.46484375, -27.4111328125, -43.555384159088135, -23.7412109375, -36.81640625, -42.142578125, -50.58984375, -34.81000518798828, -57.79609680175781, -27.2099609375, -50.5745735168457, -36.98064041137695, -16.837799072265625, -48.42724609375, -31.461864471435547]","[-46.03466796875, -53.212066650390625, -40.2734375, -46.716796875, -62.28858470916748, -35.796875, -57.6875, -93.486328125, -56.75482177734375, -60.158935546875, -78.9417724609375, -39.53125, -76.75514602661133, -41.119648456573486, -26.47265625, -62.62548828125, -41.15901184082031]","This past June, my wife and I went to Indianapolis IN to visit our friends.  We loaned them some money to help them start a business in the t-shirt printing industry.  Over the years they worked hard to increase sales and their reputation.  They paid us back in full in May 19.  One evening we were sitting on lawn chairs on the driveway; enjoying some adult beverages.  I pulled out some paperwork from a folder.  My friends asked ""What is all that paperwork you have.""  I explained that it was the spreadsheet I made to track their payments to us over the years.  My friend likes to smoke cigars, so I told him to use his torch.  He looked quizzically at me but complied with my request and lit the paperwork.  We ceremoniously burned the loan paperwork and dubbed it the burning of the business mortgage.  We all had a good laugh about the event for two reasons.  We were all happy that the mortgage was paid off and the excellent single malt whiskey we were drinking.  Word of caution: Don't drink and dri...burn mortgages at the same time.  What a grand feeling it is to get item off of your bucket list.  It's a tradition few people do now.",,,0.0
0,3SKEMFQBZ4RZDN7C2AMMDQKHCV68K1,1.4057515090669193,"[0.01396866848594264, 1.1763905021879408, 1.269106149673462, 1.3386896306818181, 1.616815185546875, 1.4582737513950892, 1.0001627604166667, 0.5559815317392349, 0.9834425789969308, 0.2341358787135074, 1.5336538461538463, 2.0626627604166665, 1.0682552562040442, 1.4102228338068181, 2.0885162353515625, 1.4305308948863635, 2.441986083984375, 2.7824935913085938, 0.9075251988002232, 1.1392295143821023, 1.0601632254464286, 2.1138780381944446, 1.690650463104248, 1.397033615545793, 2.37001953125]","[-37.24385356903076, -38.94457697868347, -58.149423599243164, -25.7666015625, -21.14288330078125, -19.582855224609375, -36.857421875, -51.18364095687866, -20.160110473632812, -31.7552547454834, -36.20703125, -25.8203125, -41.73468017578125, -21.546142578125, -30.91436767578125, -18.250732421875, -6.438720703125, -7.98541259765625, -33.412818908691406, -40.0662841796875, -26.58154296875, -19.63134765625, -32.12116527557373, -8.738107681274414, -3.91162109375]","[-37.50925827026367, -60.119606018066406, -88.60797119140625, -40.4921875, -37.31103515625, -39.998687744140625, -48.859375, -68.97504997253418, -33.928306579589844, -36.20383644104004, -56.14453125, -44.38427734375, -59.89501953125, -37.05859375, -55.9765625, -33.986572265625, -25.974609375, -30.245361328125, -46.11817169189453, -65.12933349609375, -41.423828125, -38.65625, -55.7902717590332, -24.105477452278137, -15.76171875]","My dog was diagnosed with lymphoma a year ago and was on chemotherapy. She was responding quite well to it and her lymph nodes reduced greatly in size. But then a few months ago,, overnight the lymph nodes doubled in size and she looked so miserable. I decided that she was not having a good life anymore. It would be selfish for me to hold on. I brought her to the vets where she was euthanized. I remember being in the room and seeing her close hers eyes. I tried so hard not to cry, cause I didn't want her to see me like that as her last memory, but I couldn't help it. I was so devastated knowing that I would never see her again. That day, I went out for a walk because I couldn't stand staying at home. On that walk, my normal path was under construction for some reason. I decided to go down random streets this time. While I was passing a bush, I heard some noises of crunching leaves. When I turned, there was a kitten standing there. I bent down and the kitten cam running into my hands. She was so small and dirty, covered in fleas. I decided to take her home with me. I cleaned her up and fed her. She was so well behaved, I thought she was someones pet. Because I just lost my dog that day, I was very scared that I would lose this kitten too. I put off taking her to the vet, but I eventually did. I needed to see if she belonged to someone. When the searched for the microchip, I was so nervous. But it turned out that she didn't have one. I was so relieved.",,,0.0
0,3GM6G9ZBKOJD1VZ3QKAXJZ88P85MTS,1.1819475810582714,"[-0.015673087193415716, 0.6862323467548077, 0.7520240436900746, 0.6031658706210908, 1.111272144317627, 1.7856124877929687, 2.0482584635416665, 1.32887635912214, 1.5589879353841145, 0.8730414708455404, 1.8914817810058593, 1.641042255219959, 0.4645715010793586, 1.668201431632042, 1.0700799190636836, 1.2619902193546295, 1.3639437357584636]","[-43.44495630264282, -71.12580871582031, -42.40438461303711, -106.64162564277649, -55.008108139038086, -14.132568359375, -20.59368896484375, -51.83003616333008, -66.95733833312988, -85.67294692993164, -32.001983642578125, -40.43773651123047, -102.51649475097656, -65.77819108963013, -83.80332946777344, -30.252673625946045, -38.537025451660156]","[-43.24120616912842, -88.96784973144531, -58.94891357421875, -131.9745922088623, -77.23355102539062, -40.91675567626953, -45.17279052734375, -89.03857421875, -104.37304878234863, -119.72156429290771, -69.83161926269531, -74.89962387084961, -120.17021179199219, -119.16063690185547, -119.115966796875, -50.44451713562012, -63.0880126953125]","I finished landscaping my courtyard about two months ago. I bought my condo last year and the courtyard was one thing I had always wanted and had based my purchase on it. I've taken horticulture in college so I'm pretty knowledgeable about how to do it. About 4 years before I purchased the condo, previous owners had hired a landscape company to decorate it with a flowering tree, plants, pond and black river rock stone as mulch. They sold the condo to a retired woman a year later and she never even pulled one weed. So when I bought it, it was an overgrown jungle. My first step was pulling out weeds and dead bushes. My next step, which took about 3 months, was pulling out all the river rock from about 1 foot down in the dirt. From rain and other weather, the rocks had sunken down through the landscape fabric and underneath all the weeds. Every day, I spent 15-30 minutes overturning the dirt, one shovel scoop at a time, then pulling each rock out (from 1 in. to 4 inches wide) and tossing them into huge plastic bins in the garage. I then drew out a new landscape plan, bought the plants, dug the holes and planted them. To my surprise, I called a pond company and I was able to afford their services of rebuilding my broken down pond and adding a filter, pump and some underwater plants. After that was all done, I called a landscape company to drag the bins out of the garage, lay down new landscape fabric and all those black rocks. I also brought out my garden decor, added fish to the pond, added some smaller plants to decorative pots and finally stood back to look at my work. I can't believe how beautiful it is and my neighbors also love it. It's a soothing place to come out to several times a day for relaxation.",,,0.0
0,3R08VXYT7DHM89WAHJDJN1IH79MW7C,0.9485949093706416,"[-0.03251271812539352, 0.5155462449596774, 1.8799099392361112, 1.1915907366522427, 0.3211005869365874, 0.939542463847569, 1.4753287179129464, 1.0021143461528577, 1.0323406566273083, 0.7337154041637074, 0.723982688708183, 0.9279623372214181, 1.0277999074835527, 1.4033203125, 0.9227823045518663, 0.953681230545044, 0.8598836263020834, 1.261636691434043, 0.8835778009323847]","[-94.93043148517609, -81.640625, -27.20263671875, -72.98211097717285, -45.738861083984375, -46.275185108184814, -33.88653564453125, -46.523162841796875, -50.602745056152344, -89.6317138671875, -88.52105331420898, -51.90855813026428, -32.3763427734375, -36.4365234375, -105.79867935180664, -38.10333251953125, -27.314208984375, -37.660645961761475, -52.09016036987305]","[-93.69494819641113, -97.62255859375, -61.041015625, -107.53824234008789, -52.48197340965271, -66.00557684898376, -54.5411376953125, -65.56333541870117, -73.31423950195312, -121.91519165039062, -116.75637817382812, -71.39576721191406, -51.904541015625, -51.873046875, -147.32388305664062, -53.36223220825195, -37.6328125, -72.98647332191467, -70.64529418945312]","A few months ago in July, I had my son and two weeks later, my boyfriend, my son's dad, got shot in the foot during an attempted robbery. I was in the car with him and I was driving and this black male came running at my car on the passenger side with a gun at a stoplight. The windows were down and he stuck the gun in the car and told us to get out. My boyfriend Hunter said no and he stuck the gun in his face so he grabbed it and pulled down and got shot in the foot. I know this didn't happen exactly to me, but it has made a huge impact in my life. I have PTSD and I don't even feel comfortable being in the car that it happened in. My ears ring to this day and every loud noise freaks me out. I am still continuing to figure out parenting on my own while he's recovering. I never got to mentally heal or physically heal since it happened two weeks after I gave birth. Not having my boyfriend at home was really tough because I had to do all the feedings all the diaper changes, figure out a schedule and do all these things on my own while he was at the hospital. Now that he's home, my source of income is mTurk and it's stressful trying to do everything I can and still not make enough money to support a family of three. My boyfriend can't pick up my son without being in pain and it hurts me to see. Every time I close my eyes I can see the look on his face when the bullet hit him. The bullet was a hollow point and destroyed his foot. I suddenly had to become a nurse and get taught how to give him injections for the pain medication and learn how to change out his IV bag at home and change the dressings on his foot until it closed up. Being a young mother and now becoming a caregiver as well drains me. I am very depressed, very anxious, and losing hope. I don't sleep because I'm terrified that my boyfriend will stop breathing because he's in so much pain. And on top of that, being paranoid about my newborn son stop breathing in his sleep.",,,0.0
0,31IBVUNM9TLM8DBB9S6ZPRCKYQCVFI,1.469126254964511,"[0.01851806640625, 1.2440104166666666, 1.2615792410714286, 1.409578800201416, 1.7216593424479167, 0.6574435763888888, 0.6708610516328078, 2.5011160714285716, 1.6086154513888888, 3.35234375, 1.4250192642211914, 1.5719401041666667, 1.2890625, 2.3785511363636362, 0.9265950520833334]","[-27.0667724609375, -36.25390625, -31.1142578125, -46.424644470214844, -20.969970703125, -38.39794921875, -68.01715517044067, -16.01171875, -19.8330078125, -22.33203125, -35.07904052734375, -24.73028564453125, -11.09375, -37.2265625, -19.150390625]","[-27.251953125, -54.9140625, -39.9453125, -68.9779052734375, -41.6298828125, -50.23193359375, -85.45954251289368, -33.51953125, -34.310546875, -39.09375, -57.87934875488281, -43.59356689453125, -17.5390625, -63.390625, -24.7099609375]","A few weeks ago, my boss was fired. Being the second highest ranking person, I should have been promoted to her position. At least on a Interim basis. Unfortunately, the Board decided to hire a extremely under qualified part time staff member. He was hired because he is friends with the board chair. This has been especially concerning since I have been at this job for over 15 years. This has me thinking that our board is actually not very fair and doesn't actually uphold the ideals of the organization. I am now thinking of changing jobs. the problem is I am good at my job. I also Like my Job. It is disappointing to have to look for another job due to cronyism. The organization I work for is suppose to be trustworthy. I guess I was wrong. Again this causes concern because I believed in the organization mission. It is what it is though.",,,0.0
0,3C8HJ7UOP8G9N782WCZF5N9P7BRZMW,0.7004213856689578,"[-0.07916329123757103, 0.9087553891268644, 0.4145406087239583, 0.6534412384033204, 0.6614709802576013, 1.0112613439559937, 0.9089384533110119, 1.0361282913773149, 0.8086412217881944, 0.724792934045559, 0.4272761206294215, 0.6985365292605232, 0.761546770731608, 0.7515157290867397, 0.8437351634105047, 0.6753246878322802]","[-45.00419616699219, -55.09131622314453, -47.54901123046875, -95.89610290527344, -86.59564208984375, -78.19478225708008, -45.06585693359375, -49.727294921875, -70.84176635742188, -75.66043424606323, -88.30396056175232, -85.63021945953369, -58.330565333366394, -69.295654296875, -37.942654967308044, -92.84463119506836]","[-43.262603759765625, -75.08393478393555, -55.0107421875, -122.03375244140625, -111.070068359375, -110.55514526367188, -64.153564453125, -77.7027587890625, -92.67507934570312, -105.37694454193115, -106.67683374881744, -109.38046145439148, -83.46160876750946, -90.33809471130371, -58.192298889160156, -118.50696933269501]","About a year ago, I went out on a few dates with someone I met online in a dating app. I did not enjoy his company very much, I continued dating him out of a sense of boredom. He started to really develop deep feelings for me, feelings that I did not return in kind. I still continued to date him for a time just to hang out as friends, but then about six months ago I broke up with him as a romantic dating partner to move on with someone else. He was very confused and hurt by this event, and accused me of leading him on and giving him false encouragement, so I ended out friendship and I cut off all contact with him. I felt very guilty for presuming to continue to spend time with someone that I knew I felt zero chemistry with just to have a friend to spend time with. I regretted having to be so abrupt and cold when I broke up with this person, too. I wish there would have been a way to remain friends, because he was a nice person and I enjoyed his company on a friendship level. I was resigned to the fact that this would not be possible after the way things happened and evolved with the break up, though. At first I felt bad for being unable to conjure up feelings that just weren't there for him and for hurting his feelings, but eventually I began to see things in a slightly different way. I think it is quite common for people to have a variety of dating experiences that aren't ideal in some form or other while they're out there searching for people they want to be with romantically. There are never any guarantees or promises in romantic situations in the early stages, before there is any kind of commitment made and while feelings are still developing or unclear. Even if I am not the best judge of chemistry, it is not wrong to end a relationship with someone you don't feel a romantic attraction to. I feel that trying to compromise or settle in dating relationships will cause everyone involved to have unnecessary pain and heartache in the end. So I was sorry for hurting anyone's feelings, but I do not regret doing what I did in the end. I did not wrong anyone by dating them and giving them a fair chance, and by being their friend, simply because I didn't ultimately develop romantic feelings for them in the end.",,,0.0
