,AssignmentId,scalar_text_sequentiality,sentence_total_sequentialities,sentence_contextual_sequentialities,sentence_topic_sequentialities,story,recAgnPairId,recImgPairId,Unnamed: 0
0,3IAS3U3I0G2NY51TGG0S4WOOMRJ2BL,0.7615432149465442,"[-0.04401041666666667, 0.6345113118489584, 1.137744140625, 0.7361701516544118, 0.09379438920454546, 0.34033203125, 1.974957275390625, 0.4860975477430556, 1.1234261648995536, 1.7039794921875, 0.5839436848958334, 0.3696167685768821, 1.2816808363970589, 0.6091796875, 0.39172515869140623]","[-44.69140625, -28.8497314453125, -14.9189453125, -38.068603515625, -36.32666015625, -23.17041015625, -16.57269287109375, -25.469970703125, -33.381927490234375, -27.3822021484375, -37.501220703125, -61.393821716308594, -38.7178955078125, -23.783203125, -45.7818603515625]","[-44.03125, -36.4638671875, -26.29638671875, -50.58349609375, -37.3583984375, -28.275390625, -36.322265625, -34.2197265625, -56.973876953125, -49.533935546875, -48.01220703125, -69.525390625, -60.5064697265625, -29.875, -53.616363525390625]","The event that happened in my life was receiving a great promotion at my job. I have worked with this company for almost 19 years now. I have always been a very loyal and dedicated employee. I have put forth a lot of time and effort in everything that I have done there. I kept the same position for many years and never complained. About three months ago, I was called into my managers office for a meeting. My manager was there as well as a HR representative. I was told that I was going to be promoted to a much higher position in the company. This job would come with a huge pay increase and I would now be in charge of a team of people. It would also come with added responsibilities but I was fine with that. I was extremely happy and felt very proud of myself for finally achieving the job that I wanted. After I immediately accepted the job offer and promotion, I was congratulated by the two other people in the room. I left the meeting and went straight to the phone to message my partner the great news. After work I went out to celebrate with my family. The next day the announcement was made to the rest of my coworkers of my new position in the company.",,,0.0
0,3X0H8UUIT2A8R7G25MBUISEDI8RSWH,1.060209622527967,"[-0.1759765625, 1.2980018028846154, 1.3285577947443181, 1.7421061197916667, 1.663818359375, 0.7718994140625, 2.1859375, 1.6989179338727678, 0.4922688802083333, 1.24296875, 1.20166015625, 0.36160714285714285, 1.0837673611111112, 0.006184895833333333, 1.001424789428711]","[-29.939453125, -33.2236328125, -18.49065399169922, -19.237060546875, -18.541015625, -37.39990234375, -16.95703125, -11.540679931640625, -36.23046875, -24.10546875, -23.708984375, -35.609375, -27.05859375, -53.3203125, -30.76068115234375]","[-28.1796875, -50.09765625, -33.10478973388672, -34.916015625, -31.8515625, -45.118896484375, -27.88671875, -23.43310546875, -42.1376953125, -36.53515625, -38.12890625, -38.140625, -36.8125, -53.39453125, -38.77207946777344]","This morning I fixed breakfast for my wife and daughter. I made them an English muffins with eggs, cheese and sausage. I decided to cook the sausages in the microwave. I toasted the English muffins in the toaster. I cooked the eggs in my egg cooker. We had an assortment of Grape and Strawberry Jams. Everyone enjoyed the breakfast sandwiches. I also had a cup of coffee.  After breakfast we decided to relax for a moment and catch up. Later that morning we sat down and watched a move. After the movie we will all decide on what to do next. We called my older daughter in California. We spoke to our grand daughter with great enthusiasm. Now I will decide how long to spend om my computer today. After spending some time on MTURK.",,,0.0
0,3I33IC7ZWGOIFVW1A20W9L4IUF6A28,0.8362218700830191,"[0.006036931818181818, 0.4716796875, 0.14391632080078126, 1.3611653645833333, 0.4894205729166667, 1.17578125, 0.382421875, 0.525390625, 2.196044921875, 1.23671875, 1.3375, 0.13242750901442307, 0.826953125, 1.4454214913504464, 0.5861150568181818, 0.5044962565104166, 2.5843098958333335, 0.26214599609375, 1.181640625, 0.33900035511363635, 1.1731770833333333, 0.4447985197368421, 0.4265407986111111]","[-81.06396484375, -12.046875, -64.54562377929688, -20.2734375, -44.955078125, -13.6171875, -39.109375, -39.955078125, -8.6767578125, -20.69140625, -23.96875, -89.333251953125, -36.25390625, -12.42236328125, -32.5283203125, -42.194091796875, -8.8408203125, -83.7578125, -14.279296875, -43.72265625, -16.765625, -67.50390625, -37.501953125]","[-81.19677734375, -13.93359375, -67.4239501953125, -28.4404296875, -50.828125, -18.3203125, -42.93359375, -45.208984375, -17.4609375, -26.875, -30.65625, -92.7763671875, -44.5234375, -22.540313720703125, -38.9755859375, -48.248046875, -16.59375, -87.9521484375, -20.1875, -47.45166015625, -23.8046875, -75.955078125, -41.3408203125]","Thanks to my pals constantly remonding me to show up, I gave in and drove out to the game. The weather was lovely. I found out, suddenly that the traffic was being rerouted and I was forced to park far away. I walked to the north entrance.  Walking felt awful because the sun was bright and was getting hot. there were cops everywhere. One policeman was very kind to a couple of ladies. I asked him about the north entrance to the game. He gave me directions. the he did something unexpected. Cops dot do that. He told me how to get there, he told me that the game would start a little later because they knew about teh detour. He also pointed to some other pedestrians who were walking. He motioned them to come over. He told them that I was going to the game too.  I thanked him so mnay times that he started giggling. and blushing. I walked to the stadium with my new found guides and was teher before long.  Then my friends found me. We all sat close to each other, after exchanging seats. We rooted for the same team. I expected to be miserable, but that was so fun that I am looking to another game again. I keep thinking of how kind the cop was.",,,0.0
0,3K9FOBBF2I5V00CYTCN6ANNR9GQNLM,0.7157421132411538,"[0.014271129261363636, 0.020833333333333332, 0.43057411595394735, 0.9754669189453125, 0.8358677455357143, 0.5073686079545454, 0.4077853498787716, 1.4162529839409723, 0.5256090666118421, 0.5842660757211539, 0.954193115234375, 0.5647098935883621, 0.8442437065972223, 1.3666248321533203, 0.5896199544270834, 0.6130680356706891, 1.5928387967022983, 0.8739797973632812, 0.4815266927083333]","[-22.72021484375, -22.25, -46.6044921875, -21.694061279296875, -46.64599609375, -64.072265625, -46.181488037109375, -14.42706298828125, -40.2720947265625, -49.3311767578125, -45.615081787109375, -68.0726318359375, -104.7689208984375, -29.754852294921875, -50.70257568359375, -85.65043449401855, -34.12006402015686, -26.457313537597656, -53.515380859375]","[-22.877197265625, -22.375, -54.785400390625, -31.44873046875, -64.19921875, -75.234375, -58.00726318359375, -27.17333984375, -50.2586669921875, -64.5220947265625, -69.46990966796875, -84.44921875, -142.7598876953125, -51.620849609375, -59.546875, -111.3992919921875, -69.16251754760742, -48.30680847167969, -63.62744140625]","Two months ago, the best day of my life happened. I should start with some backstory. I met my girlfriend in 2017, we had some mutual friends and became friends through them. We instantly hit it off and started a great friendship. That quickly evolved into a romantic relationship within about a month and we began dating in August of 2017. We have had a pretty incredible relationship, obviously not perfect but we always come out of situations on top, together. I knew that I wanted to marry her pretty early into our relationship, but I also knew it was something that I didn't want to rush into. She didn't want to rush into it either. We very much wanted to take our time getting to know one another and just enjoying our lives together. Earlier this year, I decided I wanted to propose on our two year anniversary, and I started getting things set up to do so. I picked out the ring with the help of her sister, who is her best friend, and got on with planning the proposal. I decided the most important place to us would be the perfect place to propose, and that's at a local park where we shared our first kiss. In order to ensure that she didn't suspect anything, I had her sister suggest to her that we go on a double picnic date in that park with her and her husband before we went for our anniversary dinner alone later that night. We would then take some photos together as a group and just the two of us. Since she believed it was her sister's idea, my girlfriend suspected absolutely nothing. When it came time, my girlfriend's sister suggested that my girlfriend and I pose for a couples photo, and as we were stood next to each other, I stepped back, got down on one knee and proposed. She was shocked and overjoyed, and after realizing what was happening, jumped into my arms and said yes. It was one of the happiest moments of my life, knowing that I will be spending the rest of my life with this woman. I know our wedding day will top this, but it was such an amazing day that we will never forget.",,,0.0
0,3IGI0VL648636LFV643Y24RLS7LNOP,0.5862950103877561,"[-0.0666961669921875, 0.4405517578125, 1.3240559895833333, 0.0921875, 0.53515625, 1.14990234375, 1.3860085227272727, 1.0169921875, 0.012581380208333333, 0.5514087677001953, 1.0695419311523438, 0.2720540364583333, 0.8393811677631579, 0.92578125, 0.1220703125, 0.13685825892857142, 0.1591796875]","[-51.6407470703125, -43.997802734375, -26.890625, -39.2734375, -51.103515625, -23.16796875, -35.94921875, -57.1015625, -52.7802734375, -52.856842041015625, -58.1466064453125, -34.0302734375, -55.3076171875, -30.234375, -27.697265625, -48.31201171875, -35.5078125]","[-50.5736083984375, -51.927734375, -42.779296875, -40.1953125, -59.666015625, -32.3671875, -51.1953125, -77.44140625, -52.968994140625, -61.67938232421875, -75.25927734375, -37.294921875, -71.255859375, -38.56640625, -28.4296875, -50.22802734375, -36.78125]","This past June, my wife and I went to Indianapolis IN to visit our friends.  We loaned them some money to help them start a business in the t-shirt printing industry.  Over the years they worked hard to increase sales and their reputation.  They paid us back in full in May 19.  One evening we were sitting on lawn chairs on the driveway; enjoying some adult beverages.  I pulled out some paperwork from a folder.  My friends asked ""What is all that paperwork you have.""  I explained that it was the spreadsheet I made to track their payments to us over the years.  My friend likes to smoke cigars, so I told him to use his torch.  He looked quizzically at me but complied with my request and lit the paperwork.  We ceremoniously burned the loan paperwork and dubbed it the burning of the business mortgage.  We all had a good laugh about the event for two reasons.  We were all happy that the mortgage was paid off and the excellent single malt whiskey we were drinking.  Word of caution: Don't drink and dri...burn mortgages at the same time.  What a grand feeling it is to get item off of your bucket list.  It's a tradition few people do now.",,,0.0
0,3C8HJ7UOP8G9N782WCZF5N9P7BRZMW,0.4391972796885686,"[-0.07911609468005952, 0.394814742238898, 0.8818884955512153, 0.36388196443256576, 0.6450458102756076, 0.4987891412550403, 0.6241390830592105, 0.5792507595486112, 1.1765234375, 0.25301842940481084, 0.18669563684708032, 0.46207403367565525, -0.028050915948275863, 0.59046630859375, 0.15615012428977273, 0.3215855189732143]","[-40.14410400390625, -51.67027282714844, -39.770538330078125, -105.0567626953125, -87.83584594726562, -82.68023681640625, -54.873046875, -51.579345703125, -62.560546875, -85.06938171386719, -97.41658592224121, -90.19618225097656, -74.3642578125, -73.67657470703125, -58.352783203125, -95.730224609375]","[-38.482666015625, -59.1717529296875, -55.64453125, -118.88427734375, -111.0574951171875, -98.1427001953125, -66.731689453125, -67.2191162109375, -91.9736328125, -94.68408203125, -104.69771575927734, -104.52047729492188, -73.55078125, -88.438232421875, -61.7880859375, -106.9857177734375]","About a year ago, I went out on a few dates with someone I met online in a dating app. I did not enjoy his company very much, I continued dating him out of a sense of boredom. He started to really develop deep feelings for me, feelings that I did not return in kind. I still continued to date him for a time just to hang out as friends, but then about six months ago I broke up with him as a romantic dating partner to move on with someone else. He was very confused and hurt by this event, and accused me of leading him on and giving him false encouragement, so I ended out friendship and I cut off all contact with him. I felt very guilty for presuming to continue to spend time with someone that I knew I felt zero chemistry with just to have a friend to spend time with. I regretted having to be so abrupt and cold when I broke up with this person, too. I wish there would have been a way to remain friends, because he was a nice person and I enjoyed his company on a friendship level. I was resigned to the fact that this would not be possible after the way things happened and evolved with the break up, though. At first I felt bad for being unable to conjure up feelings that just weren't there for him and for hurting his feelings, but eventually I began to see things in a slightly different way. I think it is quite common for people to have a variety of dating experiences that aren't ideal in some form or other while they're out there searching for people they want to be with romantically. There are never any guarantees or promises in romantic situations in the early stages, before there is any kind of commitment made and while feelings are still developing or unclear. Even if I am not the best judge of chemistry, it is not wrong to end a relationship with someone you don't feel a romantic attraction to. I feel that trying to compromise or settle in dating relationships will cause everyone involved to have unnecessary pain and heartache in the end. So I was sorry for hurting anyone's feelings, but I do not regret doing what I did in the end. I did not wrong anyone by dating them and giving them a fair chance, and by being their friend, simply because I didn't ultimately develop romantic feelings for them in the end.",,,0.0
0,3GM6G9ZBKOJD1VZ3QKAXJZ88P85MTS,0.8656802716735229,"[-0.16971842447916666, 0.7052904211956522, 0.2743598090277778, 0.24917560153537327, 1.2030707465277777, 1.4485677083333333, 1.70078125, 0.8703342013888888, 1.581510997953869, 0.4729820489883423, 1.8192138671875, 0.6751644736842105, 0.3767126834753788, 0.6489583333333333, 0.7322916666666667, 1.3374720982142858, 0.7903971354166667]","[-41.1712646484375, -65.8271484375, -50.0322265625, -124.86074829101562, -48.2607421875, -19.365234375, -28.1015625, -62.681640625, -65.33514404296875, -97.82387924194336, -40.3828125, -50.728515625, -103.14315795898438, -92.189453125, -95.3701171875, -34.033203125, -44.51904296875]","[-39.643798828125, -82.048828125, -54.970703125, -133.83106994628906, -69.916015625, -36.748046875, -45.109375, -86.1806640625, -98.546875, -112.95930480957031, -69.490234375, -63.556640625, -115.57467651367188, -111.658203125, -117.3388671875, -52.7578125, -56.375]","I finished landscaping my courtyard about two months ago. I bought my condo last year and the courtyard was one thing I had always wanted and had based my purchase on it. I've taken horticulture in college so I'm pretty knowledgeable about how to do it. About 4 years before I purchased the condo, previous owners had hired a landscape company to decorate it with a flowering tree, plants, pond and black river rock stone as mulch. They sold the condo to a retired woman a year later and she never even pulled one weed. So when I bought it, it was an overgrown jungle. My first step was pulling out weeds and dead bushes. My next step, which took about 3 months, was pulling out all the river rock from about 1 foot down in the dirt. From rain and other weather, the rocks had sunken down through the landscape fabric and underneath all the weeds. Every day, I spent 15-30 minutes overturning the dirt, one shovel scoop at a time, then pulling each rock out (from 1 in. to 4 inches wide) and tossing them into huge plastic bins in the garage. I then drew out a new landscape plan, bought the plants, dug the holes and planted them. To my surprise, I called a pond company and I was able to afford their services of rebuilding my broken down pond and adding a filter, pump and some underwater plants. After that was all done, I called a landscape company to drag the bins out of the garage, lay down new landscape fabric and all those black rocks. I also brought out my garden decor, added fish to the pond, added some smaller plants to decorative pots and finally stood back to look at my work. I can't believe how beautiful it is and my neighbors also love it. It's a soothing place to come out to several times a day for relaxation.",,,0.0
0,31IBVUNM9TLM8DBB9S6ZPRCKYQCVFI,1.0371041801644112,"[0.05349392361111111, 1.4837239583333333, 2.912623814174107, 0.49895833333333334, 1.9358908913352273, 0.21180635340073528, 0.5696910511363636, 1.0558035714285714, 1.5341254340277777, 2.1875, 0.37505696614583334, 1.3213134765625, 0.8484375, -0.03977272727272727, 0.60791015625]","[-27.5205078125, -28.27734375, -18.31866455078125, -55.4609375, -20.6182861328125, -48.5531005859375, -71.138671875, -22.75, -19.36572265625, -23.46875, -45.5654296875, -28.397216796875, -11.9765625, -59.75, -17.0341796875]","[-28.001953125, -50.533203125, -38.70703125, -62.9453125, -41.9130859375, -52.15380859375, -83.671875, -30.140625, -33.1728515625, -34.40625, -51.1912841796875, -41.6103515625, -16.21875, -59.3125, -20.681640625]","A few weeks ago, my boss was fired. Being the second highest ranking person, I should have been promoted to her position. At least on a Interim basis. Unfortunately, the Board decided to hire a extremely under qualified part time staff member. He was hired because he is friends with the board chair. This has been especially concerning since I have been at this job for over 15 years. This has me thinking that our board is actually not very fair and doesn't actually uphold the ideals of the organization. I am now thinking of changing jobs. the problem is I am good at my job. I also Like my Job. It is disappointing to have to look for another job due to cronyism. The organization I work for is suppose to be trustworthy. I guess I was wrong. Again this causes concern because I believed in the organization mission. It is what it is though.",,,0.0
0,3EQHHY4HQTEBOJSRELU43EIXA1A5GC,0.6894338816995784,"[0.0076904296875, 0.8367919921875, 0.12978617350260416, 1.1212005615234375, 0.0625, 4.279296875, 0.4505208333333333, 0.074951171875, 0.4446614583333333, 0.5334329044117647, 0.8415178571428571, 0.059564208984375, 0.37349076704545453, 0.9019818987165179, 0.22412109375]","[-20.625, -25.00390625, -59.98164367675781, -41.7109375, -15.671875, -5.94140625, -30.3046875, -43.11669921875, -72.119140625, -51.64501953125, -16.16796875, -62.6005859375, -48.77587890625, -15.828582763671875, -10.1357421875]","[-20.6865234375, -31.6982421875, -62.7071533203125, -59.650146484375, -15.921875, -14.5, -33.0078125, -44.091064453125, -78.7890625, -60.71337890625, -22.05859375, -63.7918701171875, -56.99267578125, -22.1424560546875, -11.48046875]","It was when I first met my wife. It was quite a bizarre and memorable moment. We were in a bus when all of a sudden one of the passengers started throwing homophobic jabs at me. It was bizarre in the sense that I never did anything whatsoever to provoke this passenger. He was so mean. Very aggressive. Out of nowhere stood my defender. She was so blunt and candid that I got attracted to her immediately. Her courage to speak up was impeccable  She cautioned my abuser at length. She made it clear that he was the type that brings a bad name to the USA. Made him realize how wrong he was. He eventually apologized for his unruly behavior, and we had a peaceful trip until we reached out destination. It was an unforgettable experience because that was how I got to meet the lady that turned out to be my wife. We've been living together ever since. I'll never forget that day.",,,0.0
0,3SB5N7Y3O4QCTC6QHFOSMJM6V9K0G5,0.801905843091465,"[0.0908203125, 0.36261307565789475, 0.3662228467987805, 1.212176513671875, 0.640625, 0.6883370535714286, 1.0812406994047619, 1.074923833211263, 1.88125, 1.0048177083333334, 0.862091064453125, 0.552734375, 0.52265625, 1.7736253004807692, 0.50830078125, 0.20805867513020834]","[-21.041015625, -75.8427734375, -146.04345703125, -35.244354248046875, -49.35546875, -51.09375, -71.3525390625, -63.125606536865234, -7.859375, -38.0166015625, -30.942138671875, -40.5, -67.75, -36.37255859375, -53.6787109375, -23.443817138671875]","[-21.6767578125, -82.732421875, -161.05859375, -53.427001953125, -56.40234375, -60.73046875, -94.05859375, -82.47423553466797, -17.265625, -53.0888671875, -37.8388671875, -44.921875, -75.58984375, -59.4296875, -61.8115234375, -25.31634521484375]","Dear Diary, I just got fired! I was called into the back where the new supervisor and manager were sitting (super was on vacation). They said that my supervisor said I hadn't' cleaned the hood, and after like 10 minutes of us running around and me poking holes in the stories they were spouting I got my shit and left. It was pretty funny actually, they like expected me to be sad or something. The HR guy was on the line through a remote location. They basically just sat me down and said I didn't clean the hood. I told them that yes I did, and told them they should look to whatever day I cleaned the bins. Then I asked when they were asking people if I cleaned if they asked my other coworker. They said they had not. When I asked to review the tapes myself, the tapes didn't exist anymore. Like seriously how sketchy is that lol. I was so mad just about that really. Also they noted the hood was dirty 22 days after I supposedly cleaned it. They addressed it to me almost 45 days after I cleaned it. And by the time they were firing me over it, the tape didn't exist. what a bunch of malarkey, really.",,,0.0
