,AssignmentId,scalar_text_sequentiality,sentence_total_sequentialities,sentence_contextual_sequentialities,sentence_topic_sequentialities,story,recAgnPairId,recImgPairId,Unnamed: 0
0,3TK8OJTYM27YZQ05NV241LQOG8WVPM,1.0277866649765302,"[0.0400390625, 1.746484375, 0.88671875, 1.7314995659722223, 0.8677455357142857, 0.6469282670454546, 1.060150146484375, 1.4996337890625, 0.2814737955729167, 1.8778409090909092, 1.0760498046875, 1.18984375, 0.9702962239583334, 1.255078125, 0.9311930338541666, 0.3836115056818182]","[-25.97265625, -21.0234375, -28.171875, -19.41796875, -25.7265625, -29.109375, -19.663330078125, -10.845703125, -69.961669921875, -15.1162109375, -14.572021484375, -13.20703125, -36.6923828125, -19.86328125, -28.4454345703125, -34.10546875]","[-26.3330078125, -38.48828125, -37.0390625, -35.00146484375, -31.80078125, -36.2255859375, -28.14453125, -22.8427734375, -76.717041015625, -35.7724609375, -21.0283203125, -19.15625, -48.3359375, -26.138671875, -36.826171875, -38.3251953125]",My dog doesn't like being in small spaces. Sadly my daughter's room is too small for him. We needed him to go in there for the night. Didn't want him bothering me and the wife. I tried to convince him with treats. He wouldn't listen to me and just go in there. I tried to talking to him about it. He wouldn't listen to me at all. I tried to pet him and be sweet to him but no matter what I did he had no interest in go in there. Finally I decided to just force him to go in there. He was so freaked out. I felt bad about it. He was crying about it and was looking at me all mad. He ended up tackling me. My wife laughed at both of us over it. I guess he's not going to go in there anymore.,,3WI0P0II62EXHMGY926Z0UKWHALDRK,0.0
0,3A1COHJ8NKH8BX64WPJP0Y4PSWB8HE,0.859541969438115,"[0.08508682250976562, 1.4117259979248047, 0.168359375, 0.8202311197916666, 1.5832926432291667, 0.6290838068181818, 0.6238606770833334, 0.9810546875, 1.509765625, 0.12449244449013158, 0.8195963541666667, 1.1848226693960338, 0.913956351902174, 1.2451171875, 0.30489501953125, 1.3473307291666667]","[-51.98193359375, -17.254165649414062, -37.35888671875, -38.79833984375, -32.16845703125, -27.857421875, -42.20654296875, -58.16015625, -5.93359375, -41.2957763671875, -38.1953125, -60.690704345703125, -50.4580078125, -11.888427734375, -54.729736328125, -28.83203125]","[-53.34332275390625, -28.5479736328125, -39.04248046875, -53.5625, -51.16796875, -34.77734375, -55.3076171875, -72.8759765625, -8.953125, -43.6611328125, -50.4892578125, -91.49609375, -71.47900390625, -16.868896484375, -60.82763671875, -45.0]","Everyone knows that my 1995 Geo Tracker has been completely run into the ground. I get jokes about it all the time. It even has 279,000 miles on it! Some of my good friends even have a running bet on when it will finally die for good. I kept telling them they were foolish and it would live forever. Sadly, though, about two months ago it finally happened. I was driving on the highway back home from work when I heard a bad clunking from the engine. After some recent repairs by my husband I knew it was probably a transmission failure.  Not good. I had to call my husband at work and he came to pick me up to take me home. But instead of going back to our house, he pulled into the Hyundai dealer! He had already arranged a test drive for a brand new Santa Fe, the car we had been talking about recently as wanting to own. After a great test drive and some consultation, my husband walked back into the dealership and handed the salesman his credit card. I was blown away! I had no idea he was prepared to get me a new car, so this totally blew me away! From one bad car to a great new car in one day!",,3IXEICO7935BCSEB343GU3BMXLX6TX,0.0
0,3R6BYFZZP8YEC2G6977HDC952S3FXU,0.5745468057652112,"[-0.010298295454545454, 0.554150390625, 1.0737847222222223, 0.7366071428571429, 0.861328125, 1.042578125, 0.5935202205882353, -0.12109375, -0.092431640625, 0.15791015625, 0.2897135416666667, 1.0, 0.1244140625, 1.2480740017361112, 1.9139498197115385, 0.241015625, 0.9502999441964286, -0.2216796875]","[-56.70703125, -37.064453125, -45.40625, -24.78125, -41.24609375, -26.099609375, -63.47265625, -20.234375, -26.58447265625, -60.4658203125, -44.529296875, -21.390625, -117.2939453125, -21.247314453125, -32.02783203125, -9.697265625, -16.20654296875, -21.017578125]","[-56.59375, -42.60595703125, -55.0703125, -29.9375, -54.166015625, -36.525390625, -73.5625, -19.75, -25.66015625, -63.6240234375, -48.005859375, -26.390625, -121.6484375, -32.47998046875, -56.9091796875, -10.90234375, -22.858642578125, -19.6875]",I will still be so worried about her at colllege. Of all the rape stories happening in the news lately. The men at college seem so psychotic and aggressive. I will be so worried about her. I'm worried if something like that happens she will lie to me about it. I'm so concerned about her going away to college. She was staying with friends in California but still when she got back she still acts different... like something weird happened. But she's not willing to share it with me. I'm so concerned that she will grow up to be an evil woman because of some of her actions. Her visit to Cali really turned her into a bad girl. She seems so much different. I hope that at the end of college she can get a decent job because those student loans to burden onto a husband with his own job are too much for a man to handle. She will probably end up marrying a sugar daddy. A sugar daddy that she meets that will pay off her student loans. I can see it now. It's going to be so embarrassing. I wish I had a son.,,3ZSANO2JCGT6GLU7FX1UE4SDN51FS6,0.0
0,3SITXWYCNWVOZL4Q45LLUMILDDPBXG,0.8106940924762921,"[-0.0703125, 0.45877511160714285, 0.08408203125, 0.17616489955357142, 1.7290992736816406, 0.8270263671875, 0.4680032169117647, 0.7559259588068182, 0.7899305555555556, 1.469482421875, 0.98931884765625, 1.5152869591346154, 1.3211495535714286, 1.1920827229817708, 0.45439596737132354]","[-13.484375, -34.630859375, -24.9775390625, -17.133056640625, -7.307830810546875, -26.115966796875, -35.1923828125, -23.11572265625, -30.1171875, -24.7412109375, -32.51812744140625, -25.8662109375, -19.87109375, -21.60906982421875, -32.230712890625]","[-13.203125, -41.0537109375, -26.23876953125, -18.3662109375, -21.140625, -36.040283203125, -43.1484375, -31.430908203125, -37.2265625, -42.375, -47.35791015625, -45.56494140625, -38.3671875, -35.9140625, -39.9554443359375]","Here I am again. It seems like there are times when the world decides to dump on me. I always knew that this day would come, but I still wasn't prepared. Three weeks ago I lost my dog. She was my best friend and constant companion. I raised her from a pup, almost like my own child. I know a lot of people scoff when you say that, but I don't care. She was family to me and I miss her so much. She always loved going outside and chasing the ball. Man, was she fast, and great at catching the ball. It was a shock to me when she was no longer able to run around. I knew something was wrong but thought maybe she just had a bug. I took her to the vet and received the worst news I could imagine. Cancer, and she wouldn't make it longer than a week. It's a strange feeling when all you can do is wait for someone to pass on.",,3BF51CHDTWWQT8111L6A7JY78S2H0Q,0.0
0,3RANCT1ZVG3WIHAVZ0AYAFJHKMWUBE,1.3253968987916742,"[0.3676060267857143, 1.49560546875, 1.7190607244318181, 1.966705322265625, 1.3240792410714286, 0.7991071428571429, 0.4826882102272727, 1.70390625, 1.125, 0.6905381944444444, 1.7516276041666667, 2.2734375, 1.91201171875, 1.4919921875, 0.777587890625]","[-35.48046875, -24.98828125, -27.79833984375, -30.07421875, -37.7734375, -23.5546875, -38.1396484375, -31.125, -28.015625, -77.546875, -38.84765625, -30.09375, -34.607421875, -30.677734375, -41.080078125]","[-38.0537109375, -36.953125, -46.7080078125, -53.6746826171875, -56.310546875, -29.1484375, -43.44921875, -48.1640625, -37.015625, -89.9765625, -59.8671875, -43.734375, -53.7275390625, -45.59765625, -47.30078125]","I want to relocate my home place. Because i got better job in another state. It was very tough to relocate one state to another state. We have to change each and every small things to another place. Like we have to change our passport address, license address, and etc. But i have to change my location. Physically it was very hard to relocate with our things. and also financially it cost very much to our budget. But i can handle this situation very smart. at the end i was sell my home products and big things in my house to local mart. After i sell it i can get a enough and reasonable money. Then i relocate with small things. It was slightly easy than moving with lot of things. I can buy some new products in my new place. It could be less amount for transport charge.",,37W3JXSD67U5NTSB4S3J0E2EBB6WYU,0.0
0,31IBVUNM9TLM8DBB9S6ZPRCLCDOFV4,1.1199829612985566,"[-0.007737379807692308, 2.5025111607142856, 0.786468505859375, 0.9193004261363636, 2.192418025090144, 0.3525390625, 1.1490614149305556, 1.4953636756310096, 0.8794216579861112, -0.009439641779119318, 2.2555770874023438, 0.8523530505952381, 1.54364013671875, 1.6896649528952206, 0.870497993800951, 0.44808725210336536]","[-41.5224609375, -11.439453125, -59.1627197265625, -42.0615234375, -19.685089111328125, -33.6640625, -21.492919921875, -20.384857177734375, -34.0927734375, -82.46646118164062, -25.380020141601562, -70.08984375, -39.129150390625, -22.78125, -38.867218017578125, -75.3682861328125]","[-41.421875, -28.95703125, -74.89208984375, -52.173828125, -48.1865234375, -37.5419921875, -31.83447265625, -39.8245849609375, -49.92236328125, -82.2587890625, -47.935791015625, -87.9892578125, -70.001953125, -51.50555419921875, -58.888671875, -87.0185546875]","Two weeks ago our cat, Baby Kitty, disappeared for several days.  Our family went crazy looking for her.  It got so bad that I was trying to think of how to gently break her disappearance to our daughter.  Baby Kitty could usually be found in our daughter's presence.   Whenever she would get upset, Baby Kitty would help calm her down.  When we finally found her she couldn't even stand up.  We got her to an emergency vet right away.  He told us we were lucky we got to her when we did.  With the snowstorm coming, it wouldn't have been good if she got caught in it.  The vet made a splint for her hind leg, apparently Baby Kitty broke it, we don't know how.  The vet believes a car might have nicked her.  My daughter brought in a notepad to the vet so she could take down notes for Baby Kitty's recovery.  At home, my daughter declared that she will take care of Baby Kitty to make sure she gets better.  Two weeks have gone by since the incident, and Baby Kitty is doing a lot better.  The vet wants to see us in another two weeks to take some x-rays to make sure the bones are healing well.  True to my daughter's words, she has taken care of Baby Kitty and sees to her every need, when Baby Kitty lets her.",,3P529IW9KZ7JC8ZHVO4T2IEIYUGLFQ,0.0
0,3ZOTGHDK5JX0MY70E0KK1Y1RH1POSQ,0.6798278095433842,"[0.0953125, 0.6243235270182291, 2.7462565104166665, 0.2777201334635417, 0.23248697916666666, 0.446484375, 0.8805903682002315, 0.45305538177490234, 0.09516344572368421, 0.5036604139539931, 1.09521484375, 0.8858584449404762, 0.6614278157552084, 0.6556217738560268, 0.34964570545014884, 0.7049407958984375, 0.8493097478693182]","[-19.640625, -26.2132568359375, -10.501953125, -39.5804443359375, -42.1923828125, -39.060546875, -78.23089599609375, -61.335227966308594, -59.55517578125, -55.80149841308594, -41.1103515625, -44.24365234375, -48.9033203125, -78.59114074707031, -52.93975830078125, -41.43450927734375, -16.7474365234375]","[-20.1171875, -33.70513916015625, -26.9794921875, -46.2457275390625, -45.6796875, -45.7578125, -102.0068359375, -72.20855712890625, -61.36328125, -69.40032958984375, -60.82421875, -62.8466796875, -64.777587890625, -101.53790283203125, -60.282318115234375, -55.5333251953125, -26.08984375]","My heart is utterly broken. Two months ago in May, my sister-in-law passed away. It was sudden and very tragic. She was driving home from work in the rain when she lost control of her car and get into an accident on the interstate. It feels like I was just talking to her and planning our next get together. We'd planned to go to a concert with my brother and sister in July. I didn't like the artist that we were going see, but it was for her birthday that we'd missed doing something for in February. She had been waiting to go that concert for years but hadn't been able to because our work schedules didn't line up. I considered my sister-in-law as much one of my actual siblings as my brother and sister are. She'd been there for my wife and I through some hard times and was always willing to lend a hand to help us with the children. I can't believe that she's gone and I know that it's tougher on my wife. This is a very tragic time for both of our families, because she was really a light in our lives. My family is pulling through as best we can and are making sure that we are there for each other in this trying time. The funeral was difficult, but it was attended by so many people and my sister-in-law would've really been happy to know how many lives she touched when she was still here. I think that if anything good can come out of this is that we'll be more of a bonded family. We know that's what she would've wanted us to do and we'll honor her in this way. But I don't think I'll ever stop missing her.",,324G5B4FB4UT0JVPOCKYG69DW6870G,0.0
0,3C44YUNSI2BC590JWA2AVZKHO8EDPD,0.9906032606767236,"[-0.1264892578125, 1.15859375, 0.481536865234375, 0.46353759765625, 0.8865685096153846, 0.7571478949652778, 2.51953125, 0.6680094401041666, 0.567838134765625, 0.4411529541015625, 0.5720486111111112, 0.17578125, 1.3152018229166667, 0.5227461594801682, 0.7701480263157895, 0.4320746527777778, -0.099029541015625, 1.565234375, 5.734375, -0.03698000700577446, 1.46337890625, 0.9131944444444444, 1.3798828125, 1.6971958705357142, 0.5424019949776786]","[-20.265380859375, -10.58203125, -27.0234375, -22.781982421875, -38.8125, -49.309326171875, -9.4921875, -30.94189453125, -89.53622436523438, -19.2801513671875, -41.3046875, -49.537109375, -24.40673828125, -69.7109375, -69.501953125, -18.68359375, -56.970703125, -15.267578125, -1.390625, -79.37698364257812, -16.8720703125, -42.708984375, -41.1015625, -24.37255859375, -38.6898193359375]","[-19.00048828125, -16.375, -34.72802734375, -27.4173583984375, -50.337890625, -62.93798828125, -19.5703125, -38.9580078125, -103.732177734375, -23.691680908203125, -46.453125, -52.525390625, -44.134765625, -83.30233764648438, -84.134765625, -22.572265625, -55.38623046875, -23.09375, -7.125, -78.52644348144531, -31.505859375, -50.927734375, -52.140625, -36.2529296875, -46.283447265625]","My father-in-law passed away a few weeks ago.  He had a heart attack.  My story is going to be about him and the impact he had on my life.  I grew up in Pittsburgh and went to school there.  I moved to California, worked, and met my girlfriend at Stanford.  She had family in Georgia and we eventually moved out here to work and live close to them.  Her family is amazing!  Her father, Craig, has traveled the world as a missionary.  He did a few stints in Indonesia teaching poor people how to setup their village, collect clean water, and rear their children.  I loved this man from the moment I met him.  Selfless and very giving Craig would help everyone.  In fact, during my move to Georgia one of the tires on my car blew out.  I tried to put the spare on but the lug nuts were not coming off.  I was in the middle of nowhere, on the highway, with all of my worldly possessions, pets, and girl and completely stuck.  Well, Craig drove on out probably 150 miles or more, and helped us get going again.  That's the first time I met the man! After living in Georgia for awhile I soon learned that it was NOT anything like California.  Church is big around here.  BIG.  So I got involved with the Church, through Craig, and we started helping put roofs on the houses of widows.  Tough work for sure, but it was extremely rewarding.  I learned so much for the other men helping.  After Craig passed the entire community rallied together.  It was sad of course but amazing.  I am thankful I got to know such a great man and role model.",,3C44YUNSI2BC590JWA2AVZKHO8EDPD,0.0
0,3R5F3LQFV36XNATE9SESXRYUW6EOZS,0.7270449840665051,"[0.2265625, 0.7286294790414664, 0.6192310474537037, 0.88895263671875, 0.6985270182291666, 0.5580037434895834, 0.6709090523097826, 1.2031282123766447, 1.3049290974934895, 0.8087713068181818, 2.3333333333333335, 0.41203025535300924, 0.51739501953125, 0.24148995535714285, 0.1555572509765625, 0.20064815398185484, 0.7916666666666666]","[-33.125, -49.92042541503906, -49.61004638671875, -34.333251953125, -35.37109375, -79.01025390625, -72.018798828125, -44.90618896484375, -28.792388916015625, -32.3095703125, -16.9765625, -87.35498046875, -37.62939453125, -23.3818359375, -60.48175048828125, -97.45648193359375, -17.609375]","[-35.6171875, -68.86479187011719, -66.32928466796875, -52.1123046875, -47.944580078125, -92.40234375, -87.44970703125, -67.765625, -44.4515380859375, -41.2060546875, -30.9765625, -98.47979736328125, -45.90771484375, -25.072265625, -63.5928955078125, -103.67657470703125, -24.734375]","I just started my own business in the last couple months. It's emotional for me because I've always wanted to be a business owner but I didn't think that would ever happen to me. I am a stay at home mom and thought that would be what my life would be until my children got older and out of the house. I want to stay at home with them but at the same time I want something that is mine alone. I wanted to be more than ""just a mom"" and now I get to do that. I love my clients and their businesses become my interest which is so interesting to me and makes things so much fun for me. My goal is to start earning enough my husband can slow down and be home more with us which would just be amazing. I get emotional just thinking about what our family can be in a few years thanks to this business. I can work remotely so I never have to leave my kids. I get to have the best of both lives this way. A mother and a business owner. I am so excited to help more businesses because the few that I have helped so far have actually grown thanks to my tracking of their money. They get more time at home with their families and can just focus on their business. This is such a passion for me. When I first started this business, I really never thought this whim of mine was going to come true. I was just looking for ways to make a little money as a side hustle for our Dave Ramsey budget and bookkeeping came up as a work at home idea. Wow, I am so glad I found that .",,3R5F3LQFV36XNATE9SESXRYUW6EOZS,0.0
0,3KJYX6QCMAX2DFX7SIXK4P4CHB9JV7,0.75094345396773,"[0.24287923177083334, 0.6890716552734375, 0.22663225446428573, 1.3125813802083333, 1.95048828125, 0.4556488037109375, 0.25961538461538464, 0.6643612510279605, 1.552490234375, 0.6467274983723958, 0.2491455078125, 0.8160006615423387, 1.9395616319444444, -0.040556202764096466, 0.3519850510817308, 0.763201261821546, 0.682135264078776, 0.7550130208333333]","[-27.383544921875, -64.78445434570312, -62.24755859375, -34.6904296875, -26.8369140625, -107.41012573242188, -40.236328125, -36.72149658203125, -30.322265625, -34.69563293457031, -76.9560546875, -64.207763671875, -20.9541015625, -66.41929912567139, -59.348388671875, -35.718658447265625, -63.149017333984375, -34.5458984375]","[-30.298095703125, -84.07846069335938, -67.0068359375, -50.44140625, -46.341796875, -121.07958984375, -43.611328125, -49.3443603515625, -42.7421875, -44.39654541015625, -83.93212890625, -89.5037841796875, -38.41015625, -65.48650646209717, -68.5, -50.219482421875, -79.520263671875, -45.87109375]","I have been trying to get out and be more active lately. My doctor initially told me it would be a good idea to help ease my symptoms, but I'm starting to really enjoy being out and about. About three months ago I was especially restless one morning and opted to take myself out for a day of fun. I hit the local mall and walked all through my favorite stores. I probably spent a full hour in Macy's alone. I bought a pair of new sandals and a really cute beach hat too, which are things that coincidentally help reinforce this new lifestyle I'm trying out. After shopping I stopped into a new restaurant that opened near the mall. It felt odd to eat by myself, but after a few minutes I really started to enjoy it. I almost felt like some important business person. My steak was perfectly cooked and I even had a margarita to drink. By this point I really started to feel my legs getting achy, and the 100 degree temperatures outside didn't exactly help things too much. Against my better judgement I ended up deciding to see a movie to cool down, but found myself frustrated when I realized the theater's air conditioning was turned off. Who turns off AC in 100 degree heat?!? I ended up finishing the movie, but my legs were not in great shape and I was feeling quite dehydrated. After sitting on a bench for a bit to gather my thoughts, I determined that I should not try to get home in this shape. Thankfully my good friend Judith answered her phone and was willing to come get me and take me home. I apologized to her for overextending myself on this day, but I think she understood how much I enjoyed my independence. Next time I might have to take it a little easier on these hot days!",,34J10VATJGKEDWHKO1IAM1Q4NR7QIK,0.0
0,324G5B4FB4UT0JVPOCKYG69DWL3705,0.7225972897336889,"[0.10714285714285714, 0.5054837740384616, 1.4282670454545454, 0.03404947916666667, -0.018694196428571428, 1.1171875, 0.99658203125, 0.298828125, 0.5240885416666666, 0.9689555921052632, 0.9938616071428571, 0.3615451388888889, 1.2841949462890625, 0.16002236643145162, 1.2371744791666666, 0.36944901315789475, 1.916015625]","[-30.375, -41.7529296875, -28.61328125, -30.6923828125, -57.05859375, -37.0546875, -30.38671875, -35.171875, -54.65625, -67.18359375, -48.9453125, -59.22265625, -17.8021240234375, -86.182861328125, -52.4248046875, -61.787109375, -27.57421875]","[-31.125, -48.32421875, -44.32421875, -31.203125, -56.796875, -48.2265625, -38.359375, -37.5625, -60.9453125, -85.59375, -62.859375, -65.73046875, -28.07568359375, -91.1435546875, -70.982421875, -68.806640625, -46.734375]","It all happens on one sunny Saturday. That I went out with the kids to pick something at the supermarket. The kids was excited as they will be getting new toys. It took us two hours to get to the supermarket because of the traffic jam. Luckily for me and the kids we pick so many items in the supermarket. I had to even caution them on what to buy. After the kids are done with there shopping. We Both went together to pay our bills. As at these time I use three credit card of different banks. So I gave one of them to the cashier she later returned it, that it an insufficient balance. So in my mind if one is not going through the other should do. I gave her the second one also the same story not until I gave her the third one. And it turned out to be same story. I was so devastated I don't know what next to do or what action to take, I looked at the kids they were so happy with what they got. Now i began to think of returning those item we bought including the kids toys. Then the cashier turn back to me and helped me out as she paid for the grocery for me. I was so happy and surprise of this kind person.",,36DSNE9QZ6K7NVOAR6B69XA4L4IOJO,0.0
0,3JBT3HLQF9OF8A5FOSR7MR3KF95PZA,0.9175354816825356,"[0.052931565504807696, 0.6361860795454546, -0.050083705357142856, 1.84814453125, 0.7223011363636364, 1.0564239501953125, 0.9539484484442349, 2.6175340924944197, 0.98193359375, 1.7379557291666667, 0.9061745091488487, 0.15209491436298078, 0.5098741319444444, 0.6865808823529411, 0.9510323660714286]","[-30.966552734375, -31.212890625, -60.9140625, -31.2353515625, -82.19140625, -66.07098388671875, -76.31291198730469, -30.960968017578125, -42.28076171875, -36.021728515625, -79.06539916992188, -97.77703857421875, -72.4921875, -49.828125, -33.875]","[-31.6546630859375, -38.2109375, -60.212890625, -57.109375, -98.08203125, -97.76370239257812, -103.9774169921875, -67.6064453125, -53.08203125, -56.877197265625, -96.28271484375, -101.73150634765625, -86.2587890625, -61.5, -47.189453125]","A few weeks ago we decided to go to the apple orchard. The day was bright and sunny but felt chilly for summer. We went planning to see the animals, pick apples, ride the wagon. This year they added a big jump pad for the kids to play in! When we go there we played in the little wood houses they have first, then went to the yearly wagon ride! On the wagon ride the guide told us all about the farm and how much water it takes, how many apples they produce, and all sorts of information. After the wagon ride we were able to get lost in the corn maze, they added fun trivia to help point you in the right way this year. Then at the exit we were able to jump on the giant pumpkin pad. We of course gathered a bag of apple to bring home. The kids loved eating the fresh apples instead of bagging them. The little one was able to ride around on my solders while we walked around eating our apples. They also took away the pedal bike races and replaced it with a mine shaft play area where you could purchase bags of sand with gems. To finish up our day we looks at the animals, we saw little pigs, lamas, goats, and lots of other farm animals. We will probably be back again in the next couple weeks to go play for a while. I can not wait to go next year and see what else they add!",,3JBT3HLQF9OF8A5FOSR7MR3KF95PZA,0.0
