,AssignmentId,scalar_text_sequentiality,sentence_total_sequentialities,sentence_contextual_sequentialities,sentence_topic_sequentialities,story,recAgnPairId,recImgPairId,Unnamed: 0
0,3U088ZLJVLF8QYWQWKSA8M8U0YE0WL,0.6250247589910224,"[0.0783547794117647, 0.46781099759615385, 0.1495694247159091, 1.3736201695033483, 0.4376077651977539, 0.5745849609375, 2.0483779907226562, -0.13982599431818182, 0.5981903076171875, 0.4904838230298913, 0.41466090990149457, 0.6513468424479166, -0.28857421875, 0.9468279751864347, 0.690648078918457, 0.658383296086238, 1.4733537946428572]","[-60.015625, -22.439453125, -82.53662109375, -30.358306884765625, -105.23104858398438, -103.0396728515625, -33.00513458251953, -42.12353515625, -40.323974609375, -65.155029296875, -60.30035400390625, -43.536865234375, -48.41259765625, -57.68739318847656, -102.79635620117188, -59.62791442871094, -21.9208984375]","[-61.34765625, -28.52099609375, -85.8271484375, -49.5889892578125, -119.2344970703125, -122.0009765625, -55.53729248046875, -40.58544921875, -49.89501953125, -76.4361572265625, -69.83755493164062, -55.2611083984375, -44.083984375, -78.51760864257812, -124.8970947265625, -76.74588012695312, -32.234375]","Mom startled me one day early this year and made me very worried about her mental state. It's been a long time since I've seen her so sad. She had recently finished speaking to Aunt Rue in New Jersey on the phone when I noticed how low her mood was. When I asked, she told me she had just learned really disturbing news. According to Aunt Rue, my cousin Deena -- who is my mother's and aunt's niece -- has apparently joined what other family members described as a ""cult."" We don't live in the same state and visit close to never, so it's not surprising that all of us up East were a bit suspicious of the claims. We thought the family Down South was exaggerating the situation... that is, until we went down to see for ourselves. Shockingly, we soon learned, they were not stretching the truth in the least. Deena, always a husky if not somewhat fat person, had lost so much weight we could barely recognize her. Her house, always pristine and inviting, was now a veritable dump with stuff just thrown haphazardly everywhere. The saddest part was that she seemed oblivious to how all of this looked to other people. Months later we still have not figured out how to get through to Deena.  She has resisted every attempt to break through her wall and help her understand how dangerous and unhealthy her predicament is. The family Down South continues to monitor her as closely as possible while attempting to not appear like they are stalking her, which makes her defensive, angry and argumentative. Meanwhile, the rest of us are seeking professional advice because it has become increasingly certain that we cannot get through to her on our own. Sad, perplexing situation all around.",31LM9EDVOMEP5AOYQRBTU8AZVWPNJO,,0.0
0,3MMN5BL1W0Q82E19B5461M4BIJQ3MZ,0.5173572194614733,"[0.07628598420516304, 0.7686767578125, 0.4948674982244318, -0.0965576171875, 0.918134765625, 0.9113595145089286, 0.22801844278971353, 0.29153645833333336, 0.598046875, 0.15578049879807693, 0.37647761855014533, 0.5372869318181818, 1.04962158203125, 0.7166791643415179, 0.9209908878102022, 0.3722527082576308, 0.47561465992647056]","[-61.02447509765625, -30.40478515625, -56.4945068359375, -33.6689453125, -43.808349609375, -26.683837890625, -65.98971557617188, -54.212890625, -32.3359375, -97.62744140625, -110.38278198242188, -49.1953125, -56.556640625, -79.062255859375, -39.43104553222656, -123.26681518554688, -37.9501953125]","[-62.779052734375, -42.70361328125, -67.381591796875, -32.896484375, -66.76171875, -39.44287109375, -71.462158203125, -58.5859375, -38.31640625, -101.677734375, -126.57131958007812, -55.10546875, -73.3505859375, -99.1292724609375, -55.087890625, -139.273681640625, -46.03564453125]","When my friend and I met for the first time one of the things we really enjoyed was sitting around the bonfire. We enjoyed the flames licking at the logs and the warmth spreading out from the fire. We made smores and had a few drinks, spending most of our time just talking laughing and joking about life. At my house I have motion sensor lights. One night when we were sitting in the back yard around the bonfire one of the motion sensor lights kept going on and off. The odd thing about this was that it had never acted that way before. Talk around the bonfire went to ghosts and spirits, we joked that there may be a ghost trying to get our attention. Laughingly she said ""We see that you are here and recognize your presence."" After that the light did not go on again. This was something that we both found interesting, it's like she acknowledged whatever was going on and it was happy to be acknowledged it. The night was uneventful after that but it was the topic of conversation for the next few days, even though we had bonfires after that, we didn't experience that situation for any of those other bonfires. The other thing we enjoyed tremendously was going to Ren Fest. It was hot and humid that day but we both dressed as different Steam Punk characters. There were so many different things to look at and enjoy, we got to experience the fire whip, the jousting and the comedy troop. We spent hours just going through the different shops, enjoying the wares that were sold. And the food, don't get me going on the turkey legs, we spent so much time stuffing our faces with the different specialty foods that when we came home we both joked we would need too go on a diet. The sights, sounds and flavors that assaulted our senses were something that I will never forget.",3IUZPWIU1PTA3O3U0D2SR6N31EMWKC,,0.0
0,3RRCEFRB7NYX1JGGKUJGXBLMXALB4X,0.9556701032597412,"[-0.13057215073529413, 0.8798828125, 0.3936767578125, 0.6159104567307693, 0.08413461538461539, 0.5577309348366477, 0.45901925223214285, 0.3978678385416667, 1.0434126420454546, 0.5798171997070313, 0.7972515106201172, 1.1634007504111843, 1.1178163381723256, 0.6579752604166667, 1.1406809488932292, 1.0774489182692308, 1.849853515625, 1.4780649038461537, 0.78369140625, 2.59619140625, 0.8111478365384616, 2.0245225694444446, 0.32280530427631576, 2.5294325086805554, 0.6605890447443182]","[-59.53515625, -33.75, -60.00897216796875, -29.5986328125, -37.625, -28.047515869140625, -45.45654296875, -71.67236328125, -24.5068359375, -51.38709259033203, -73.93820190429688, -57.4755859375, -35.265769958496094, -36.21240234375, -17.48150634765625, -39.4638671875, -33.2001953125, -30.0732421875, -66.43115234375, -14.7724609375, -27.048828125, -15.162109375, -101.7958984375, -22.330810546875, -38.4444580078125]","[-57.3154296875, -40.7890625, -69.85089111328125, -37.60546875, -38.71875, -34.18255615234375, -51.8828125, -81.22119140625, -35.984375, -60.0843505859375, -97.85574722290039, -79.5802001953125, -49.79738235473633, -46.08203125, -31.169677734375, -53.470703125, -55.3984375, -49.2880859375, -86.0234375, -40.734375, -37.59375, -33.3828125, -114.0625, -45.095703125, -45.7109375]","Not long ago, our puppy started going crazy outside and my son went out to investigate. He could hear hissing behind a board. He came in to tell me what was going on and I told him to leave whatever it was alone and bring the dog in. Well, as it turns it out, it was a small kitten. Later, when he let the dog out, he went crazy again. Again, my son went to check what was going on. The kitten did not take the opportunity to leave when the dog was inside. So, my son decided to help this kitten, he removed the board the kitten was hiding behind and pick up the cat. Once the dog saw the cat, he went crazy again. This spooked the kitten and it clawed up and bit my son. My son came inside with cat scratches all over, including a deep one on his lip, and had a rather deep puncture bite wound on his hand. We went to the ER, my son ended up on powerful antibiotics and a few stitches in face. The kitten was captured and sent for quarantine and testing for rabies. Not long after, my son's lymph nodes in his groin area started swelling. We went to the urgent care and they put him on antibiotics. The lymph nodes did not go down, but instead more started swelling.  Our regular doctor put him on a second, more powerful antibiotics. That didn't help and now lymph nodes in his neck started swelling. Doctor sent him for an ultrasound and the lymph nodes were extremely swollen and it was recommended to get a CT from waist to neck. Lymph nodes from groin to neck were all swollen. Our doctor told us he was 85% certain he had cancer. Not just cancer, but an extremely aggressive cancer. The surgeon removed the first, extremely large lymph node and told us it didn't not look like cancer, that he thought it was cat scratch fever, but we had to wait for the results. Our regular doctor was still certain it was cancer. Turns out my son had a massive case cat scratch fever.",3RRCEFRB7NYX1JGGKUJGXBLMXALB4X,,0.0
0,31Z0PCVWUL1UGSSGME880HBIXYV7TK,0.6512956319687602,"[0.021081012228260868, 0.9793893914473685, 0.4936436244419643, 1.0980953216552733, 1.01947021484375, 1.035736083984375, 0.650604248046875, 0.14444732666015625, 1.1251918247767858, 0.4720865885416667, 0.7531912667410714, 0.58013916015625, 0.34591878255208336, 0.5721004161428898, 0.504372816819411, 0.7047124590192523, 0.9305167564978967, 0.2926240808823529]","[-50.9036865234375, -32.4697265625, -61.220947265625, -41.39541816711426, -14.3629150390625, -38.343719482421875, -14.430419921875, -64.4403076171875, -25.540771484375, -51.2861328125, -34.115966796875, -52.119140625, -62.25439453125, -94.38565254211426, -57.67723083496094, -52.48359680175781, -61.53434753417969, -38.2275390625]","[-51.3885498046875, -51.078125, -75.04296875, -68.8478012084961, -26.5965576171875, -60.09417724609375, -17.0328369140625, -66.75146484375, -41.29345703125, -62.6162109375, -44.66064453125, -61.4013671875, -72.6319580078125, -121.27437210083008, -70.79092407226562, -72.21554565429688, -85.727783203125, -43.2021484375]","My husband's 60th birday was approaching, so I decided to do something extra special for him this year.  Since he enjoys staying at hotels, I booked a room at a luxury hotel for a weekend getaway. I did not tell him before we checked-in to the hotel, but I had chosen this hotel because it had a large, heated indoor pool. We got to our room and I immediately opened my suitcase and pulled out his swimming trunks, that I had packed in secret.  We changed into our swim clothes and headed down to the pool. As we approached the pool, we both noticed that there was also a whirlpool located next to the pool. I was elated! My husband suffers from back pain and the whirlpool would certainly made him feel good. We swam for quite a while, then relaxed in the whirlpool. After we got back to our room, we both were extremely hungry and we agreed that a steak dinner was what we wanted. We ate our favorite steaks along with baked potatoes and creamed spinach.  For dessert, my both had the most delicious chocolate cake that we'd ever eaten. After dinner, I gave him directions to a nearby movie theater, where we planned to see a remake of one of his favorite movies, The Lion King. The theater featured state of the art video and sound, but when we entered the theater to take our seats, I was astonished to see that all of the seats were overstuffed leather recliners that changed position with the touch of a button. Again, this made me particularly happy because of my husband's back issues, sitting for long periods of time can be painful for him. I was sure that he would be very comfortable in his seat and would be able to enjoy the movie thoroughly, which he was and he did.  The sound and video quality, along with the comfort of the seats made us decide that we would never go to different theater ever again. All in all, the weekend was a great success because my husband had a fantastic time.",3K772S5NP9XPKYGV9S5PS80BX75HES,,0.0
0,3018Q3ZVOJCZJFDMPSFXATCQG15AR4,0.3426786299295155,"[-0.10703125, 0.49097156524658203, 0.4088541666666667, 0.11496151194852941, 0.5521477593315972, 0.3020833333333333, 0.296875, -0.470977783203125, -0.279541015625, 0.09114583333333333, 1.2755533854166667, 0.9390625, 0.54974365234375, -0.9234375, -0.05575284090909091, 0.97783203125, 0.310760498046875, 0.6180979410807291, 0.7142857142857143, 1.4914008246527777, 0.22470703125, 0.0171875]","[-13.70703125, -17.60588836669922, -26.390625, -73.330810546875, -68.37158203125, -17.265625, -29.75, -51.1942138671875, -39.419921875, -37.984375, -28.58837890625, -18.484375, -45.1650390625, -28.328125, -80.03515625, -27.1357421875, -63.35284423828125, -44.89080810546875, -42.171875, -12.913330078125, -106.91064453125, -24.802734375]","[-13.171875, -21.533660888671875, -30.0703125, -75.28515625, -78.31024169921875, -18.171875, -31.53125, -44.60052490234375, -37.18359375, -38.53125, -40.068359375, -23.1796875, -53.9609375, -23.7109375, -78.80859375, -36.9140625, -68.946533203125, -52.3079833984375, -47.171875, -26.3359375, -114.775390625, -24.974609375]","Wow, what a memory! I think about that from time to time. it was a benchmark in my life, really. I remember some nutso woman on Facebook telling me, ""Just force yourself to eat! That's what I tell my daughter and sister-in-law when they make such a nonsense bitch! Just EAT!""And that woman was crazy. Forcing yourself to eat probably works most of the time for most people. But what I was suffering from was almost ... an ANTI-eating illness. My body didn't WANT me to eat food. And that is truly weird. I should do some Internet research and find out what was going on with my system.	And I still find it .... interesting, that after taking the medication I was given to make me eat, I now eat regularly with no problem. (I just wish I had better food to eat!)I wonder if my current weird eating habits now have anything to do with my previous problem? I love toast with scads of margarine spread on it. And I'm suddenly really like strawberry. Strawberry ice cream, strawberry jam, strawberry whatever. :)But just so long as I am EATING, it is much, **much** better for me, health wise, than what I was going through a few months ago. Thanks for this opportunity, and have a good day!!",3LEIZ60CDKLUGNP873VA0135A5P9Z1,,0.0
0,3L4D84MIL0EXVE2NNTGGPOD3JE7JH0,1.2002338572295634,"[-0.10120137532552083, 1.30218505859375, 0.23746744791666666, 0.08415391710069445, 1.0529610770089286, 2.1279296875, 1.0602678571428572, 0.8576171875, 0.85247802734375, 2.2296875, 1.20703125, 0.4519561767578125, 2.125, 0.9545454545454546, 0.7755681818181818, 2.156640625, 3.0296875]","[-41.00189208984375, -39.162109375, -81.11328125, -70.09912109375, -30.696044921875, -31.1689453125, -34.078125, -47.365234375, -51.8232421875, -11.6015625, -14.8125, -73.76791381835938, -10.109375, -44.5234375, -31.9169921875, -11.255859375, -4.2421875]","[-39.7874755859375, -59.9970703125, -86.8125, -71.6138916015625, -45.4375, -50.3203125, -41.5, -60.2294921875, -65.462890625, -22.75, -19.640625, -82.80703735351562, -16.484375, -55.0234375, -40.4482421875, -22.0390625, -19.390625]","I was in a musical duo that had decided to part ways. We wanted to fulfill our obligations though, so we performed at a large outdoor festival. I had been wondering what I'd do with my time, and I was also concerned my partner would have some direction forward. We played, but I guess due to nerves we rushed through our set with time to spare. Someone in the crowd asked my partner to play one of her solo songs. I was so happy her own work was appreciated. I got off stage as she played. I got into conversation with some people who are in another local band I like. Without knowing the duo was splitting, they suggested I ""try out"" for them. Really, a formality. They wanted me in. It was pretty remarkable that in a matter of minutes, both her direction forward and mine were made clear. I was relieved. I was also excited we could part with no bad feelings. Once she got off stage, I told her what happened. She was happy for me. I was happy for her.",3B2X28YI3X1BG6KU3ICVU950T2C6B0,,0.0
0,336KAV9KYREJBDU4Q8ECC7MPEF2Y2Y,0.5428580435813102,"[-0.18489583333333334, 0.2935384114583333, 0.3310089111328125, 1.314453125, 0.7400090144230769, -0.0843975360576923, 1.267578125, 0.5143229166666666, 0.2177734375, 0.9625651041666666, 0.5731977982954546, 0.93035888671875, 0.3913352272727273, 0.4326171875, 0.44340587797619047]","[-20.8515625, -23.25146484375, -59.9859619140625, -32.44140625, -44.7255859375, -55.41650390625, -11.16015625, -40.51953125, -25.84375, -18.791015625, -29.41064453125, -49.132568359375, -40.1796875, -112.12109375, -37.8154296875]","[-19.7421875, -25.0126953125, -67.93017578125, -48.21484375, -54.345703125, -54.3193359375, -18.765625, -45.1484375, -28.2392578125, -24.56640625, -35.7158203125, -60.296875, -44.484375, -125.96484375, -47.126953125]",this was a very memorable experience. my daughter has worked very hard. she is a founder of her troop because she was one of the first girls to join boy scouts when girls were allowed in. so she has to work to get her ranks and prove herself. as mom has to help along the way and keep her on track. i felt very happy and over joyed at the court of honor. it was a really big deal. she doing good and moving up ranks pretty quick. it has been a lot of work in a short time. thats ok its well worth it. she has also made some life long friends along the way. he boys were very excepting also of the girls coming in. they have been a possitive influence on my daughter to. my daughter before she joined scouts was pretty lazy and didnt do much so this was a really big surprise that we found her calling and she loves the outdoors and competition. im very proud of the young woman my daughter has become and how much she has grown in such short time.,3OVHNO1VE7N6JD2PJJ0CMXMVZ14ZDS,,0.0
0,3IHR8NYAM8NZ5DHQ3Z1HSVQBNH0P4B,0.9912343928874536,"[0.04434407552083333, 1.080958973277699, 0.7860369001116071, 0.4566650390625, 1.251953125, 0.37323760986328125, 1.1263020833333333, 0.23557090759277344, 1.89039306640625, 2.142578125, 0.4272014911358173, 1.5411783854166667, 0.3686711237980769, 0.6868820190429688, 2.45654296875]","[-68.46014404296875, -24.443252563476562, -52.8646240234375, -30.767578125, -33.03515625, -40.33544921875, -16.560546875, -22.28900146484375, -15.2855224609375, -6.8203125, -83.07330322265625, -14.33642578125, -45.67431640625, -24.8359375, -9.599609375]","[-69.79046630859375, -36.33380126953125, -63.869140625, -34.4208984375, -49.310546875, -46.3072509765625, -26.697265625, -26.058135986328125, -34.189453125, -15.390625, -94.1805419921875, -28.20703125, -50.467041015625, -30.33099365234375, -26.79541015625]","My boyfriend and I had lived together for over five years, We had talked about getting engaged and getting married but we just were not getting around to it. I was pretty specific about the kind of ring I wanted. I didn't want anything really large I just had specific styles in mind. My boyfriend came into a little extra money. It was not a huge amount but enough to made a decent purchase. I woke up one morning and he was already out of bed which was not unusual. I got up and came to the living room. He approached me, got down on one knee, and asked me to marry him. The ring was perfect and of course I said yes. I was so happy. He had obviously been paying attention to my desires involving an engagement ring even though he knows nothing about jewelry which means a lot to me. He had to have done a lot of research. He even made sure the quality was good rather than just the style. I'm thrilled to be engaged to him. I can't wait to marry him.",3HFNH7HEMI00H5BPYDI71PDO9FUGQ0,,0.0
0,3B3WTRP3DCO4ACMWIWMWDQTZCSM29Z,0.6998249455051012,"[-0.05996981534090909, 0.4807400173611111, 0.7143229166666667, 0.6603190104166666, 0.8728745404411765, 0.6086062476748512, 0.9416015625, 0.9509141710069444, 0.23551609205163043, 0.8827570134943182, 0.7638180381373355, 1.1017922794117647, 1.1924002511160714, 0.245703125, 0.9059787326388888]","[-35.37109375, -48.8837890625, -46.19921875, -38.6328125, -43.9599609375, -45.699005126953125, -28.5625, -22.0023193359375, -72.1978759765625, -46.7490234375, -59.051422119140625, -46.28759765625, -35.604248046875, -22.80859375, -31.88232421875]","[-34.71142578125, -57.537109375, -56.9140625, -46.556640625, -58.798828125, -58.479736328125, -37.978515625, -30.560546875, -77.61474609375, -66.169677734375, -73.56396484375, -65.01806640625, -52.2978515625, -25.265625, -48.18994140625]","I experienced the worst thing I could experience as a parent. The most suprising thing to me was the fact that it happened and the emotions I felt. It is unreal when something so painful happens, that you think will never happen. I also never knew the strength of negative emotions I could feel. I thought I knew pain before, but I was never remotely close to feeling real pain. There were many sleepless nights spent crying, and feeling like I was just going to fall over and die. The extreme anxiety and panic attacks I experienced were terrible. I look back wondering how I made it through. After surviving the worst time period of my life I learned that I can take something awful and get some good form it. I think the only way to survive something so bad it to find a way to see something good come from it. I am able to help others, and connect with other bereaved parents who have helped me survive. I can be that person who saves someone from going down the wrong path to handle grief. There have been a couple people who were here for me in that way. That is the best way to handle a bad situation. You have to find something positive to take from it, and use it in a good way.",3STRJBFXOXDIB7Z058XH4MG4XKVKT1,,0.0
0,34J10VATJGKEDWHKO1IAM1Q5BMFIQ0,0.5956543728274937,"[-0.041015625, 4.650297619047619e-05, 0.889325593647204, 0.293902587890625, 0.6131480823863636, 0.9564732142857143, 0.32333955310639884, 0.47080230712890625, 0.714056396484375, 0.6511758340371622, 0.5999875749860492, 0.5962665264423077, 1.200927734375, 0.3891042073567708, 0.80340576171875, 0.30637168884277344, 0.16988932291666667, 0.691796875, 1.64296875, 0.1571197509765625, 1.34765625, 0.47417082609953703, 0.449130859375]","[-7.265625, -72.1826171875, -38.995880126953125, -67.2362060546875, -81.609375, -55.15625, -145.586669921875, -73.89010620117188, -62.0150146484375, -116.57957458496094, -79.01040649414062, -54.09423828125, -52.455078125, -60.947998046875, -32.247314453125, -86.17716979980469, -43.5, -55.2109375, -7.75390625, -66.629638671875, -24.25439453125, -79.9395751953125, -55.131103515625]","[-7.142578125, -72.18359375, -55.89306640625, -73.1142578125, -95.0986328125, -68.546875, -159.16693115234375, -85.18936157226562, -76.296142578125, -140.67308044433594, -95.81005859375, -61.845703125, -71.669921875, -70.2864990234375, -48.3154296875, -95.98106384277344, -46.04833984375, -69.046875, -15.96875, -69.1435546875, -37.73095703125, -92.7421875, -66.359375]","Oh, yes. This was about my relationship with my ex and how it turned out poorly and led to some bad self doubt. My ex and I started out fantastically as friends and unfortunately that is where it should have stayed. We began well enough, having stayed up night after night chatting with one another and gaming with one another. We were young, love struck and despite some flawed starts of jealousy from both sides, we did well at first. Then after the relationship became official it became a nightmare to even survive within. This was after my previous relationship where I royally messed up in the emotional support department and let somebody nice down, so I was more than prepared to endure here as a, I guess, makeup for the last. However, that kindness was taken advantage of and I was manipulated, lost friends and stopped talking to people I once contacted daily. Likewise my personal hobbies deteriorated and I was more or less told to spend every waking moment with them. I cannot personally state all the things that went on, or the ways I was kept in the relationship because I feel like those are too personal, but needless to say I basically hated it. I had to wait for her to get bored of me, find another person to obsess over and let her dump me for things to be peaceful. So I exited that as a mess, both relationship wise and mentally. Hated them in general for the longest time and wondered if I did things wrong. Kind of hard to believe the person I met turned out to be like that, so I blamed myself for it at times. However, over time I learned that it wasn't my fault, I let it go and moved on. There's no easy way to do it, but you just have to take the blow, accept the time lost and stop letting more time slip away due to it. Thankfully I met somebody who would help me with that and she has been amazing. I really wish I could say all the ways she is, but I only have three thousand characters here! So I will say this. She's stubborn, dependable, cocky at times and had humor that matches mine. She's flawed, yet perfect if that makes sense. I didn't make her out to be unrealistic in my mind and she never required it either, so I'm happy to be with her. With this one I can move on without worry and know that even if something happens, it's not the end of the world.",3QRYMNZ7FZ3JJDK32LPXWEX8S9KTNO,,0.0
